Testament,Book,Chapter,Verse,Content
"New","42","5","25","I preci gori stánovši pred njimi, gori je vzéo ono, na kom je ležao, i odíšao je vu hižo svojo dičéči Bogá."
"New","42","5","26","I groza je obvzéla vse, i díčili so Bogá, i napunili so se z stráhom govoréči: ne štímana dugovánja smo dnes vidili."
"New","42","5","27","I po eti je vö šô, i vido je ednoga mautnara po iméni Levia, sedéčega na mauti; i erčé njemi: nasledüj me."
"New","42","5","28","I on je tá niháo vsa, gori je stano, i nasledüvao ga je."
"New","42","5","29","I napravo njemi je veliki máo te Levi vu hiži svojoj, i bilô je dosta lüdstva publikánušov i drügi, kí so bilí ž njimi pri stoli sedéči."
"New","42","5","30","I mrmlali so pisáčke njihovi i Farizeuške prôti vučeníkom njegovim govoréči: zakaj z publikánušmi i grêšnikmi jête i piéte?"
"New","42","5","31","I odgovoréči Jezuš erčé njim: ne potrebüjo ti zdravi vráča, nego ti betéžni."
"New","42","5","32","Nej sem prišao zvát pravične, nego grêšnike na pokôro."
"New","42","5","33","Oni so pa erkli njemi: zakaj se vučenícke Ivanovi postijo čestô, i molitve činíjo, prispodobno i Farizeušovi; tvoji pa jêjo i piéjo?"
"New","42","5","34","On njim je pa erkao: jeli morete činiti, naj se sinovje gostüvanja postijo dokeč je ž njimi ženin?"
"New","42","5","35","Prído pa dnévi, i teda se kraj vzeme od njih ženin; teda se postili bodo vu oni dnévi."
"New","42","5","36","Pravo njim je pa i eto príliko: nišče ne dêva nôvoga gvanta záplato na stári gvant; nači se i to nôvo rasprašči, i k tomi stáromi se ne glíha nôvoga süknja záplata."
"New","42","5","37","I nišče ne vlêva nôvo víno vu stáro posôdo; nači rastrga nôvo vino to posôdo, i ono vö stečé, i posôda se pogübi."
"New","42","5","38","Nego nôvo víno vu nôvo posôdo vlêvajo, i obôje se zdrží."
"New","42","5","39","I nišče, kí stáro pijé, ščé preci nôvo. Ár velí: to stáro je bôgše."
"New","42","6","1","Prigôdilo se je pa vu drügoj sobotti po prvoj, da bi šô on po sêtvi i trgali so vučenícke njegovi vlati, i jeli so je vö menovši z rokami."
"New","42","6","2","Níki pa z Farizeušov so njim erkli: ka činíte tô, štero je nej slobodno činiti vu sobottáj?"
"New","42","6","3","I odgovoréči njim Jezuš erkao je: ni tô ste nej čteli, ka je včíno Dávid, gda je lačen bio on, i kí so ž njim bilí?"
"New","42","6","4","Kakda je notri šô vu hižo Božo, i te lebe postávlenja je vzéo ino jo, i dáo je i onim, kí so ž njim bilí; štere je nej slobodno jesti, nego samim popom."
"New","42","6","5","I pravo je njim: kâ je Sin človeči Gospôd i sobotte."
"New","42","6","6","Prigôdilo se je pa i vu drügoj sobotti, gda bi notri šô vu správišče i včio: bio je tam eden človek, i rôka njegova dêsna je süha bíla."
"New","42","6","7","Kebzüvaliso pa na njega pisáčke i Farizeuške, či bi v sobotto vráčo, da bi najšli tožbo na njega."
"New","42","6","8","On je pa vido premišlávanja njihova, i erčé tomi človeki süho rokô majôčemi: stani gori, i stoj na srêdi. On pa gori stánovši, stao je."
"New","42","6","9","Erčé pa njim Jezuš: nikaj bom vás pítao: jeli je slobodno v sobottáj dobro činiti, ali hüdo činiti? düšo obdržati, ali pogübiti?"
"New","42","6","10","I okôli poglednovši vse njé, erčé tomi človeki: vtégni rokô tvojo. On je pa tak včíno; i nazáj je postánola rôka njegova, liki ta drüga."
"New","42","6","11","Oni so se pa napunili z nepametnostjom, i zgučávali so si med sebom, ka májo včinití Jezuši?"
"New","42","6","12","Prigôdilo se je pa vu dnévi oni, vö je šô na brêg molit; i bio je, prenôčüvajôči, vu molítvi Božoj."
"New","42","6","13","I, gda je dén grátao, prízvao je vučeníke svoje; i vö je odébrao ž njih dvanájset, štere je i Apoštole imenüvao."
"New","42","6","14","(Šimona, šteroga je imenüvao i Petra, i Andráša brata njegovoga, Jakuba i Jánoša, Filipa i Brtalana."
"New","42","6","15","Mátaja i Tomáša, Jakuba siná Alfeušovoga, i Šimona zvánoga Zeloteša."
"New","42","6","16","Júdaša Jakubovoga brata, i Judaš Iškarioteša, kí je i odávec grátao)."
"New","42","6","17","I doli idôči ž njimi stano je na polskom mesti; i šereg vučeníkov njegovi, i vnožina velika lüdstva od vse Judee i Jerušálema, i pri môrji stojéči z Tíruša i Šidona prišli so ga poslüšat, i vráčit se od betegôv svoji."
"New","42","6","18","I dosta zburkani od nečisti dühôv, i zvráčili so se."
"New","42","6","19","I vse lüdstvo je ískalo priliko, da bi se ga doteknoti mogli. Ár je môč od njega vö zhájala i vse je zvráčila."
"New","42","6","20","I on prizdignovši očí svoje na vučeníke svoje erčé: bláženi ste vi siromácke, ár je vaše králevstvo Bože."
"New","42","6","21","Bláženi ste, kí ste zdaj lačni, ár se nasítite. Bláženi ste, kí se zdaj jôčete, ár se smejáli bodte."
"New","42","6","22","Bláženi bodete, gda bodo vás odürjávali lüdjé, i gda vás lôčijo, i psüvali bodo i vö vržejo, imé vaše, liki hüdo, za volo Siná človečega."
"New","42","6","23","Radüjte se vu onom dnévi, i vesélte se, ár ovo veliki je vaš nájem vu nebésáj. Ár so rávno tak činíli prorokom očeve njihovi."
"New","42","6","24","Ali jaj vám bogáci! ár máte obeseljé vaše."
"New","42","6","25","Jaj vám napunjeni! ár lačni bodete. Jaj vám, kí se zdaj smijéte, ár se žalostili i plakali bodete."
"New","42","6","26","Jaj vám, gda vám vsi lüdjé dobro gúčali bodo; ár so rávno tak činíli krivim prorokom očeve njihovi."
"New","42","6","27","Ali vám právim poslüšajôčim: lübíte nepriátele vaše; dobro činte z onimi, kí vás odürjávajo."
"New","42","6","28","Bladoslávlajte one, kí vás preklinjávajo, i molte za one, kí vás ogrizávajo."
"New","42","6","29","Kí te vdári po ednom líci, obrni njemi i to drügo; i od toga, kí ti plášč jemlé, i süknje ne bráni."
"New","42","6","30","Vsákomi pa, kí te prosi, dáj; i od tistoga, ki ona, štera so tvoja, odnesé, ne prosi nazáj."
"New","42","6","31","I kak ščéte, naj vám činijo lüdje, i vi činte njim rávno tak."
"New","42","6","32","I, či lübite one, kí vás lübijo, kákša milošča vám bode? Ár i grêšnicke lübijo one, kí njé lübijo."
"New","42","6","33","I, či tistim dobro činíte, kí vám dobro činíjo, kákša milošča vám bode? Ár i grêšnicke tô činíjo."
"New","42","6","34","I, či posôdite onim, od šteri se vüpate nazáj vzéti, kakša milošča vám bode? Ár i grêšnicke grêšnikom posôdjávajo, naj nazáj vzemejo priglihna."
"New","42","6","35","Nego lübte nepriátele vaše, i dobro činte, i posôdte nikaj nazáj dobiti se nê vüpavši; i bode vaš nájem veliki, i bodete sinovje toga Víšešnjega. Ár je on dobrotiven k tim nezahválnim i hüdim."
"New","42","6","36","Záto bojdite milostivni, liki je i Oča vaš milostiven."
"New","42","6","37","I ne sôdte, i ne bodte osodjeni; ne skvarjüjte, i ne bodte skvarjeni; odpüstite, i odpüstí se vám."
"New","42","6","38","Dájte, i dá se vám; mero dobro, nakláčeno, i natrôšeno, i prêk tekôčo vu nároča vaša vám dájo. Ár z šterov mêrov bodte merili, z tistov bode vam nazáj merjeno."
"New","42","6","39","Erkao je pa njim príliko: jeli more slêpi slêpoga voditi? nêli obá vu jamo spádneta?"
"New","42","6","40","Nej je vučeník več od vučitela svojega; popolni je pa vsáki, či jeste liki vučitel njegov."
"New","42","6","41","Ka pa glédaš trôho vu ôki brata tvojega, a trám pa vu tvojem lastivnom ôki ne vzemeš na pamet?"
"New","42","6","42","Ali kakda moreš erčti brati tvojemi: brat, niháj, naj vö vržem trôho, štera jeste vu ôki tvojem; sám pa vu ôki tvojem tramá ne vídiš? Skazlívec, vrži vö prvot trám z oká tvojega, i teda glédaj, da vö vržeš trôho z oká brata tvojega."
"New","42","6","43","Ár je nej dobro tisto drêvo, štero gníli sád prináša, niti je nej gnílo drêvo, štero dober sád prináša."
"New","42","6","44","Ár vsákše drêvo se z lastivnoga sáda zpozna, ár z trnja ne beréjo fige, niti z ščípka ne trgajo grozdje."
"New","42","6","45","Dober človek v dobroga kinča srcá svojega dobro prináša naprê; i te lagoji človek z lagojega kinča srcá svojega lagoje naprê prináša. Ár z obilnosti srcá gučíjo vüsta njegova."
"New","42","6","46","Ka me pa zovéte Gospodne, Gospodne, i ne čínite, ka velim?"
"New","42","6","47","Vsáki, ki k meni príde, i poslüša reči moje, i činí je, pokážem vám, komi je prispodoben."
"New","42","6","48","Prispodoben je k človeki cimprajôčemi hižo, kí je skopao i zglôbao i položo je fundamentom na pečíni; gda je pa povôden postánola, vdaro je potok v hižo ono; i nej jo je mogao genoti, ár je na pečíni fundálivana bíla."
"New","42","6","49","Kí je pa slíšao i nej je činio: prispodoben je k človeki cimprajôčemi hižo na zemli brezi fundamentoma v štero je vdaro potok, i preci je spádnola; i včinjeni je spadáj hiže one veliki."
"New","42","7","1","Gda bi pa spuno vse svoje rečí na poslüšanje lüdstva, notri je šô v Kapernaum."
"New","42","7","2","Nikoga stotnika sluga pa betéžen bodôči se je k konci približávao, kí njemi je bio drági."
"New","42","7","3","Slišavši pa od Jezuša poslao je k njemi te stariše Židovov proséči ga, da pridôči zvráči slugo njegovoga."
"New","42","7","4","Oni pa pridôči k Jezuši, prosili so ga gedrno govoréči: kâ je vrêden, komi tô včiníš."
"New","42","7","5","Ár lübi naš národ, i správišce nám je on pocimprao."
"New","42","7","6","Jezuš je pa šô ž njimi. Gda bi pa nebi daleč bio od hiže, poslao je k njemi te Stotnik priátele svoje govoréči njemi: Gospodne, ne trüdi se; ár sem nej vréden, ka bi notri šô pod streho mojo."
"New","42","7","7","Záto sem i samoga sebé nevrêdnoga držao, ka bi k tebi šô; nego erči z rečjom, i ozdrávi sluga moj."
"New","42","7","8","Ár sem i jas človek pod oblást postávleni, i mám pod menom vitéze; i erčém etomi: idi, i ide; i drügomi: prídi, i príde, i slugi mojemi: číni tô, i činí."
"New","42","7","9","Gda bi pa eta Jezuš čüo čüdivao se je nad njim, i obrné se k nasledüvajôčemi njega lüdstvi erčé: velim vám, ni vu Izraeli sem tákšo vero nej najšao."
"New","42","7","10","I gda bi se povrnoli ti poslani nazáj vu hižo, najšli so toga betéžnoga slugo ozdrávlenoga."
"New","42","7","11","I prigôdilo se je potom, šô je Jezuš vu mesto, štero se zové Nain; i šli so ž njim vučenícke njegovi vnôgi, i dosta lüdstva."
"New","42","7","12","Gda se je pa priblížao k vrátam toga mesta, ovo nešen je vö eden mrtvi, ki je bio materé svoje jedinorodjeni sin, i ona je vdovica bíla; i vnôgo lüdstva toga mesta je bilô ž njôv."
"New","42","7","13","I, gda bi jo vido Gospôd, smilüvao se je nad njôv i erkao je njê: ne jôči se."
"New","42","7","14","I pristôpivši dotekno se je škrinje (kí so ga pa nesli, stanoli so,) i erčé: mladénec, tebi velim, stani gori."
"New","42","7","15","I gori se je opravo te mertvec, i záčao je gúčati i dao ga je materi njegovoj."
"New","42","7","16","Vzéo je pa stráh vse: i dičili so Bogá govoréči: kâ je Prorok veliki stano med nami, i kâ je prigledno Bôg lüdstvo svoje."
"New","42","7","17","I vö je zíšla ta rêč vu cêloj Judei od njega i vu vsoj okôli bodočoj držéli."
"New","42","7","18","I nazvêstili so Ivani vučenícke njegovi vsa eta."
"New","42","7","19","I gda bi prizvao dvá níka vučeníkov svoji Ivan, poslao njiva je k Jezuši govoréči: ti si te pridôči, ali bomo drügoga čakali?"
"New","42","7","20","Gda bi pa ti možjé k njemi prišli, erkli so: Ivan krstitel je poslao nás k tebi govoréči: ti si te pridôči, ali pa drügoga mámo čakati?"
"New","42","7","21","Vu onoj vöri je ji pa dosta zvráčo od betegôv i bičov, i dühôv hüdi, i vnôgim slêpim je darüvao pogléd."
"New","42","7","22","I odgovoréči Jezuš erčé njim: idôči oznante Ivani, štera vídite, i čüjete; kâ slêpi priglédávajo, plantavi hodijo, gobavci se očiščávajo, glühi čüjejo, mrtvi gori stanjüjo, siromákom se Evangeliom nazveščáva."
"New","42","7","23","I blážen je, kí se vu méni ne spáči."
"New","42","7","24","Gda bi pa odíšli nazvišešávci Ivana, záčao je Jezuš gúčati k lüdstvi od Ivana: ka ste vö šli vu püščávo gledat? trst od vötra vugibajôčo?"
"New","42","7","25","Ali ka ste vö šli vidit? človeka vu mêhkom gvanti oblečenoga? Ovo, kí so vu svetlom gvanti, i v radosti živéjo, vu králevski hižaj so."
"New","42","7","26","Ali ka ste šli vö vidit? proroka? Zaistino velim vám, i vékšega od proroka."
"New","42","7","27","Té je, od šteroga je písano: ovo jas pošílam angela mojega pred lícom tvojim, kí priprávi pôt tvojo pred tebom."
"New","42","7","28","Ár velim vám, vékši med porodjenimi od žén prorok od Ivana krstitela je ni eden nej; te náj ménši pa vu králevstvi Božem je dönok vékši od njega."
"New","42","7","29","I vse lüdstvo, štero je eto čülo, i publikánuške so pravičnoga pravili Bogá okrstivši se z Ivanovim krstom."
"New","42","7","30","Farizeuške pa i právdenicke so tanáč Boži zavrgli prôti sebi, i nej so se dáli od njega krstiti."
"New","42","7","31","Erkao je pa Gospôd: komi bom záto priglihávao lüdínároda etoga? i komi so prispodobni?"
"New","42","7","32","Prispodobni so k deci na pláci sedéčoj i kričéčoj eden drügomi i govoréčoj: žveglárili smo vám, i nej ste plésali; plačno pesem smo vám popêvali, i nej ste se jôkali."
"New","42","7","33","Ár je prišao Ivan krstitel; ne jej krüha, ni vína ne pijé, i právite: vrága má."
"New","42","7","34","Prišao je Sin človeči; jej i pijé, i právite: ovo človek požirávec i víno pivec, publíkánušov priátel i grêšnikov."
"New","42","7","35","I spravičena je modrôst od vsê svoji sinôv."
"New","42","7","36","Proso ga je pa niki z Farizeušov, naj jej ž njim. I notri idôči vu hižo Farizeušovo, doli si je seo."
"New","42","7","37","I ovo edna žena vu onom mesti, štera je bíla grêšnica, gda bi zvêdila, kâ je Jezuš doli seo vu hiži Farizeušovoj, prinesla je eden alabaštrom mazala."
"New","42","7","38","I stojéča pri nogáj njegovi odzaja, plakajôča začne škropiti nogé njegove z kuzami, i z vlasmí glavé svoje je je brísala; i küšüvala nogé njegove, i mázala z mazalom."
"New","42","7","39","Vidôči pa eto Farizeuš, kí ga je zvao, erčé vu sebi govoréči: ete, da bi prorok bio, znao bi, što, i kákša je eta žena, štera se ga dotíče; ár je grêšníca."
"New","42","7","40","I odgovoréči Jezuš erčé njemi: Šimon, mám ti nikaj povedati. On pa velí: vučitel, povej."
"New","42","7","41","Dvá dužníka je meo níki veritel; eden njemi je dužen bio pét stô sodôv, te drügí pa pétdesét."
"New","42","7","42","Gda bi pa onedva ne mela nazáj dati, oböma je tá darüvao; povej mi záto, šteri ga bode med njima bole lübo?"
"New","42","7","43","Odgovoréči pa Šímon erčé: štimam, kâ ov, komi je več darüvao. On pa erčé njemi: prav si sôdo."
"New","42","7","44","I obrné se k toj ženi, i erčé Šimoni: vídiš eto zeno? notri sem prišao vu tvojo hižo, vodô na nogê moje si mi nej dáo; eta je pa z skuzami škropíla nogé moje i z vlasmí glavé svoje je brísala."
"New","42","7","45","Küš si mi nej dáo; eta pa, kak sem notri prišao, je nej hênjala küšüvati nogé moje."
"New","42","7","46","Z oliom glavô mojo si mi nej nemazo; eta je pa z drágim mazalom mázala nogé moje."
"New","42","7","47","Záto, velim tebi, odpüščeni so njé vnôgi grêhi, kâ je vnogo lübila; komi se pa malo odpüstí, malo lübi."
"New","42","7","48","Erčé pa njêj: odpüščeni so ti grêhi."
"New","42","7","49","I záčali so ti v küp sedéči pri stoli praviti vu sebi: što je té, kí i grêhe odpüščáva?"
"New","42","7","50","Erčé pa k toj ženi: vera tvoja je zdržála, idi vu méri."
"New","42","8","1","I prigôdilo se je potom toga, i on je hodo po vsê mêstaj i vesnicaj predgajôči i nazveščávajôči králevstvo Bože; i ti dvanájset ž njim."
"New","42","8","2","I níke žene, štere so bilé zvráčene od dühôv hüdi i nemočnosti; Mária, štera se zové Magdalêna, z štere je sedem vragôv vö zíšlo."
"New","42","8","3","I Joanna žena Kuzova, Herodešovoga dvorskoga, i Šušanna, i drüge, vnôge, štere so njemi slüžile z poíštva svojega."
"New","42","8","4","Gda bi pa vnogo lüdstva vküp bilô i ze vsê mêst bi k njemi prihájali, erčé vu prílikaj."
"New","42","8","5","Vö je šô sejáč sêjat semen svoje; i vu sêjanji je níštero spadnolo kre pôti, i zakláčeno je, i ftice nebeske so je pozobale."
"New","42","8","6","I drügo je spadnolo na pečíno; i vö zidôče posêhnolo je, da je nej melo vlage."
"New","42","8","7","I drügo je spadnolo na srêdo med trnje; i, gda bi z trnjom vrét gori raslo, zadíšilo je je trnje."
"New","42","8","8","I drügo je spadnolo na dobro zemlo; i vö zidôče prineslo je sáda stô teliko. Eta gda bi povedao, gori je skríčao: ki má vüha na poslüšanje, naj poslüša."
"New","42","8","9","Pítali so ga pa vučenícke njegovi govoréči: kákša je tá prílika?"
"New","42","8","10","On je pa erkao: vám je dáno znati skrovnosti králevstva Božega, tim drügim pa vu prílikaj; naj vidôči ne vídíjo, i slíšavši ne razmijo."
"New","42","8","11","Eta je pa tá prílika: semen je rêč Boža."
"New","42","8","12","Štero semen je pa kre pôti spadnolo, tô so ti poslüšávci; potom príde vrág i vzeme rêč z srcá njihovoga, naj ne verjejo, ino se ne zveličajo."
"New","42","8","13","Štero je pa na pečíno, so oni: kí, gda čüjo, z radostjom gori vzemejo rêč. I tê korenjá nemajo; kí do časa verjejo, i vu vrêmeni sküšávanja odstôpijo."
"New","42","8","14","Štero je pa v trnje spadnolo, tê so: kí poslüšajo, i od skrblivosti ino bogástva i náslobosti žítka idôči, zadávlajo se, i zrêli sád ne prinášajo."
"New","42","8","15","Štero je pa vu dobro zemlo spadnolo, tê so: kí vu srci lêpom i dobrom, slíšavši to rêč, obdržávajo jo, i sád prinášajo vu trplivosti."
"New","42","8","16","Nišče pa svêčo vužgáno ne skríje pod posôdo, ni pod postelo jo ne dene; nego vu posvečnjek jo položi, naj ti notri idôči, vídijo svetlost."
"New","42","8","17","Ár nega nikaj tak skrivnoga, štero bi se vö nê vjavilo; niti skritoga, štero bi se nê spoznalo i na očivesnost prišlo."
"New","42","8","18","Glédajte záto, kakda poslüšate. Ár, ki má, dá se njemi; i ki nema, i ka štíma meti, vzeme se od njega."
"New","42","8","19","Prišli so pa k njemi mati i bratje njegovi; i nej so mogli do njega prídti za volo lüdstva."
"New","42","8","20","I nazvêstili so njemi govoréči: mati tvoja i bratje tvoji stojíjo vönê, i ščéjo te viditi."
"New","42","8","21","On pa odgovoréči erčé njim: mati moja i bratje moji so eti, ki rêč Božo poslüšajo, ino jo činijo."
"New","42","8","22","I prigôdilo se je vu ednom ti dnévov, i on je šô vu ládjo i vučenícke njegovi; i erčé njim: hodmo prêk jezere. I püstili so se."
"New","42","8","23","Plavajôči pa oni, záspao je; i doli je prišao vrtélec vötra na jezero, i k časi so se ládje napunjávale, i pogibale so."
"New","42","8","24","Pristôpivši pa, gori so ga obüdili govoréči: Mešter, Mešter, pogibamo! on pa gori stanovši poštrájfao je vöter, i válovje te vodé; i hênjali so i včinjena je tihota."
"New","42","8","25","Erčé pa njim: gde je vera vaša? bojéči so se pa čüdivali govoréči eden drügomi: što je záto ete, kâ i vötrom zapovidáva i vodê, i bôgajo ga?"
"New","42","8","26","I preplavali so vu držèlo Gadarenušov, štera je prôti Galilei."
"New","42","8","27","Gda bi pa on vö šô na zemlo, pribêžao je pred njega níki môž z mesta, kí je meo vragé v sebi od vnogo vrêmena, i gvanta je na sébe nej vzéo i vu hiži je nej ostano, nego vu grobáj."
"New","42","8","28","Vidôči pa Jezuša, i skričavši doli je spadno pred njega, i z velikim glásom je erkao: ka je meni z tebom, Jezuš Sin víšešnjega Bogá? Prosim te, ne mantráj me."
"New","42","8","29","Ár je zapovedao tomi nečístomi dühi vö idti od toga človeka; ár je vnogo vrêmena tistoga bilô, kak ga je vküp potêgno; i vézali so ga z lancmi i z potami, i tak so ga varvali. Ali raztrgao je i vezala, i gnao se je od vrága vu püščáve."
"New","42","8","30","Pítao ga je pa Jezuš govoréči: ka ti je imé? On pa erčé: Legio. Ár je vnogo vragov šlo v njega."
"New","42","8","31","I prosili so ga, naj njim ne zapovej vu prepast idti."
"New","42","8","32","Bíla je pa tam edna velíka črêda svinj, štere so se pasle na brêgi. I prosili so ga, naj njim dopüsti vu njé idti. I dopüsto njim je."
"New","42","8","33","Vö idôči pa ti vrazjé z človeka, notri so šli vu svinjé; i sünola se je ta črêda svinj kre strmca vu jezero, i vtôpìla se je."
"New","42","8","34","Vidôči pa pastérje, ka se je zgôdilo, odbêžali so; i odidôči nazvêstili so vu mesti i vu vesnicaj."
"New","42","8","35","Vö so pa šli, da bi vidili, ka se je zgôdilo; i prišlí so k Jezuši, i najšli so sedéčega toga človeka, z koteroga so vö odíšlí ti vrazjé, oblečenoga i spametnoga pri nogáj Jezušovi; i prestrašili so se."
"New","42","8","36","Nazvêstili so pa njim i ti vidôči, kakda je ozdravo te vragometen."
"New","42","8","37","I prosila ga je vsa vnožina Gadarenušov držéle, naj odíde od njih, ár so z velikim stráhom obvzéti. On pa notri idôči vu ládjo, nazáj se je povrno."
"New","42","8","38","Molo se je pa njemi te môž, od šteroga so vö zišli ti vrazjé, ka bi ž njim bio. Jezuš ga je pa kraj odpüsto govoréči:"
"New","42","8","39","Povrni se vu hižo tvojo, i pripovedávaj, ka ti je Bôg včíno. I odišao je po cêlom mesti predgajôči, ka je njemi včíno Jezuš."
"New","42","8","40","Zgôdilo se je pa, gda bi se povrno Jezuš, gori ga je prijalo to lüdstvo, ár so ga vsi čakali."
"New","42","8","41","I ovo prišao je eden môž, komi je imé Jajruš; i on je bio vládnik správišča. I spadnovši k nogám Jezuša, proso ga je, kâ bi notri šô vu hižo njegovo."
"New","42","8","42","Ár je meo jedinorodjeno čér, okoli dvanájset lêt staro, i ona je mrla. (Gda bi pa on šô, lüdstvo ga je stiskávalo.)"
"New","42","8","43","I žena bodôča vu otôki krví od dvanájset lêt, štera je cêlo svoje živlênje na vráče potrošila, i nej se je mogla od nikoga zvráčiti."
"New","42","8","44","Pristôpivša odzajaj, doteknola se je rôba gvanta njegovoga, i preci je stano tekáj njé krvi."
"New","42","8","45","I erčé Jezuš: što se me je dotekno? gda bi pa vsi tajili, erčé Peter, i kí so ž njim bili: Mešter, lüdstvo se pšé i stiskáva, i práviš: što se me je dotekno?"
"New","42","8","46","Jezuš pa erčé: dotekno se me je nikák. Ár sem jas spoznao, ka je môč vö šla od méne."
"New","42","8","47","Vidôča pa ta žena, kâ se nemre skriti, trepetajôča naprê ide i pred njega spádne, i, za kákši zrok se ga je doteknola, nazvêstila njemi je pred vsêm lüdstvom, i kakda je ozdrávila preci."
"New","42","8","48","On je pa erkao njê: vüpaj se čí, vera tvoja te je zdržála; idi vu méri."
"New","42","8","49","Gda bi pa ešče on gúčao, prišao je niki od vládnika toga správišča govoréči njemi: mrla je čí tvoja, ne trüdi vučitela."
"New","42","8","50","Jezuš pa, gda bi tô čüo, odgôvoro je njemi govoréči: ne boj se, li veri, i zdrží se čí tvoja."
"New","42","8","51","Notri idôči pa v hižo, nej je dopüsto notri idti nikomi, nego Petri, i Jakubi i Jánoši, i oči te deklíčke, ino materi."
"New","42","8","52","Jôkali so se pa vsi, i plakali so jo. On je pa erkao: ne jôčte se: nej je mrla, nego spí."
"New","42","8","53","I osmêjalí so ga; ár so znali, kâ je mrla."
"New","42","8","54","On pa, geto je vse vö vrgao, príjao je njé rokô i kríčao je govoréči: deklíčka, stani gori."
"New","42","8","55","I povrno se je düh njé, i gori je stánola preci, i zapovedao je njê dati jesti."
"New","42","8","56","I čüdivali so se rodjenici njé. On je pa zapovedao njim, kâ bi nikomi nepravili, ka se je zgôdilo."
"New","42","9","1","Gda bi pa vküp zézvao ti dvanájset vučeníkov svoji, dáo njim je môč i oblást nad vsêmi vragmí, i betéžne vráčiti."
"New","42","9","2","I poslao je je predgat králevstvo Bože, i vráčit te nemočne."
"New","42","9","3","I erčé njim: nikaj ne vzemte na pôt, niti palico, niti mošnjo, niti krüha, niti pêneze, niti dvê süknji ne mête."
"New","42","9","4","I vu štero hižo bodte notri šli, tam ostanfe i odnut vö nejdite."
"New","42","9","5","I kíkoli vás ne prímejo, vö idôči z mesta onoga i práh od nôg vaši kraj stepte, na svedôstvo prôti njim."
"New","42","9","6","Vô idôči pa šli so okôli po vesnicaj nazveščávajôči Evangeliom, i vráčivši povsud."
"New","42","9","7","Čüo je pa Herodeš Štrták ona, štera so včinjena od njega vsa, i zadrgávao se je záto, ka je povêdano od níki, kâ je Ivan zbüdjen od mrtvi."
"New","42","9","8","Od níki pa, ka se je Eliáš vjavo; drügi pa, kâ je prorok, eden z ti stári, stano gori."
"New","42","9","9","I erčé Herodeš: Ivani sem jas glávo vzéo; što je pa ete, od šteroga jas eta čüjem? I ískao ga je viditi."
"New","42","9","10","I gda bi se povrnoli Apoštolje, pripovedávali so njemi, šterakoli so činili. I k sebi je vzévši, odíšao je zôseb v püsto mesto onoga váraša, kí se zové Betžajda."
