Testament,Book,Chapter,Verse,Content
"New","48","5","23","Prôti tákšim nega právde."
"New","48","5","24","Kí so pa Kristušovi: têlo so ráspili znáklonostami i želami vrét."
"New","48","5","25","Či živémo vu Dühi: vu Dühi i hodmo."
"New","48","5","26","Ne bojdmo márne díke želávci edendrügoga dráždžci, edendrügomi nevoščéni."
"New","48","6","1","Bratje, či se kákši človik posíli skákšim prestoplênjem: vi, kí ste dühovni, zravnajte tákšega vu dühi krotkosti; i gledaj sám sebé, naj se i tí ne sükšáva."
"New","48","6","2","Edendrügoga bremen noste; i tak spunte právdo Kristušovo."
"New","48","6","3","Ár, či se što za koj štima bidti, geto je nikaj, sám sebé znori."
"New","48","6","4","Vsákši pa naj sám svoje delo sküsi: i teda bode sám vu sebi meo hválo, i nej vu drügom."
"New","48","6","5","Ár vsákši bode svoje lastivno bremen noso."
"New","48","6","6","Kí se pa vči na rejč Božo: tomi, kí ga včí, naj podili zevsê dobrot svoji."
"New","48","6","7","Ne blôdíte: Bôg se ne dá osmijávati. Ár, kakoli sêja človík, tisto bodo i žeo."
"New","48","6","8","Záto, kí sêja na têlo svoje, z têla bode žeo skvarjênje: kí pa sêja na Düh, z Dühá bode žeo žítek vekivečni."
"New","48","6","9","To dobro pa činéči ne obtrüdmo. Ár vu svojem vrêmeni bomo želi obilno: či dobro činiti ne hênjamo."
"New","48","6","10","Záto, dokeč čas mámo zevsêmi dobro činmo; naj bole pa zdománjimi vere naše."
"New","48","6","11","Vište z kelikimi pískmi sem vám písao zmojov rokôv."
"New","48","6","12","Kíkoli se ščéjo dopádnoti vu têli: tisti vás primárjajo na obrizávanje; li naj se za volo Kristušovoga križa ne pregánjajo."
"New","48","6","13","Ár niti ti obrêzani samí právdo ne zdržávajo: nego ščéjo; ka bi se ví obrezali; naj se vu vašem têli hválijo."
"New","48","6","14","Od méne pa tô kraj bojdi, ka bi se hválo: nego vu kríži Gospodna našega Jezuša Kristuša; po kom je meni svêt raspétí, i jassvêti."
"New","48","6","15","Ár vu Kristuš Jezuši niti obrizávanje kâ valá, niti neobrizávanje: nego nôvo storjenjé."
"New","48","6","16","I, kíkoli pôleg té regule hodijo, mér nad njimi i smilenost, i nad Izraelom Božim."
"New","48","6","17","Na dale mi pa nišče dela ne dáva: ár jas vorcane Gospodna Jezuša vu mojem têli nosim."
"New","48","6","18","Milošča Gospodna našega Jezuša Kristuša z dühom vašim, bratje. Amen. Galatáncom pisani z Rima."
"New","49","1","1","Pavel Apoštol Jezuš Kristušov po vôli Božoj tim svétim, kí so vu Efezuši, i vernim vu Kristuš Jezuši."
"New","49","1","2","Milošča vám i mér od Bogá Očé našega, i Gospodna Jezuš Kristuša."
"New","49","1","3","Blagoslovleni Bôg i Oča Gospodna našega Jezuš Kristuša, kí nás je blagoslovo zevsem blagoslovom dühovnom v nebeski dugovánjaj vu Kristuši."
"New","49","1","4","Liki je nás odébrao po njem pred fundamentomom svêta; naj bomo svéti i nepokárani pred njim vu lübeznosti."
"New","49","1","5","Zrendelüvavši nás naprê na sinovčino po Jezuš Kristuši vu sebi pôleg dopádnenjá vôle svoje."
"New","49","1","6","Na hválo díke milošče svoje v šteroj nás je vugodne včíno vu tom lübeznivom."
"New","49","1","7","Vu kom mámo odküplenjé po krvi njegovoj, sád pa odpüščanje prestoplenjá pôleg bogastva miloče njegove."
"New","49","1","8","Štera je obilno razíšla na nás vu vsoj modrôsti i čednôsti."
"New","49","1","9","Geto nam je na znánje dáo skrovnost vôle svoje pôleg dopadnenjá svojega; štero je naprê vu sebi gori djáo."
"New","49","1","10","Da bi se vu dokončávanji punosti vrémena vsa pod edno glavô vküp potégnola vu Kristuši i tá, štera so vu nebésaj, i tá, štera so na zemli."
"New","49","1","11","Vu njem, v kom smo i öročíno vzéli mi naprê zrendelüvani pôleg gori djánja toga; kí vsa činí pôleg tanáča vôle svoje."
"New","49","1","12","Naj bomo na hválo díke njegove mi, kí smo se prvle vüpali vu Kristuši."
"New","49","1","13","V kom se i ví vüpate, da čüjete rêč te istine, tô je, Evangeliom zveličanja vašega, v kom ste i potom, kak ste vervali, zapečáčeni z obečanjá Dühom ztim svétim."
"New","49","1","14","Kí je zádava öročíne naše na odrêšenjé ti lastivni na hválo díke njegove."
"New","49","1","15","Záto i jas, slíšavši vero vašo, štera je vu Gospon Kristuši i lübéznost k vsêm svécom."
"New","49","1","16","Ne hênjam hválo dávati za vás spomínavši se z vás vu molitvaj moji."
"New","49","1","17","Naj vam Bôg Gospodna našega Jezuša Kristuša, Oča te dike, dá Dühá modrôsti i oznanosti na njegovo spoznanje."
"New","49","1","18","I presvečene očí pámeti vaše; naj znáte, štera je vüpazen ti pozváni njegovi, i štero je bogástvo díke öročíne njegove vu ti svéti."
"New","49","1","19","I štera je ta nezmerna velikôča môči njegove k nám vervajôčim pôleg delanja môči zmožnosti njegove."
"New","49","1","20","Štera je delao vu Kristuši, gda je gori zbüdo z mrtvi i posádo ga je na desnico svojo vu ti nebeski."
"New","49","1","21","Više vsê poglavnikov i oblást i môčí gospodstva i vsega iména, štero se imenüje nej samo na etom svêti; nego i príšestnom."
"New","49","1","22","I vsa je podvrgao pod nogé njegove i njega je dáo; naj bode giáva nad vsêm te Cérkvi."
"New","49","1","23","Štero jé njegovo telo, punost toga, kí vsa vu vsem spunjáva."
"New","49","2","1","I vás je ožívo: kí ste bilí mrtvi vu prestoplenjáj i vgrêhi:"
"New","49","2","2","Vu šteri ste nigda hodili pôleg šegé etoga svêta; pôleg poglavníka, kí oblast má zráka, tô je, pôleg düha, kí zdaj dela vu siní te nevernosti."
"New","49","2","3","Med šterimi smo se i mí vsi obračali nigda vu želáj têla našega činéči vôle têla i mísel: i bilí smo deca srditosti po natúri, liki i ti drügi."
"New","49","2","4","Bôg pa bogat bodôči vu smilenosti po velikoj lübéznosti svojoj, šterov je nás lübo."
"New","49","2","5","I bodôče nás mrtve v prestoplenjáj s Kristušom nás je oživo; (po milošči ste tak zveličani:)"
"New","49","2","6","I gori nás je zbüdo žnjím vrét, i žnjim vrét nás je postavo vu ta nebeska po Kristuš Jezuši."
"New","49","2","7","Da bi pokázao vu prišestnom vrêmeni to preveč obilno bogástvo milošče svoje po dobrotivnosti svojoj nad nami v Kristuš Jezuši."
"New","49","2","8","Ár ste z milošče zveličani po veri: i tô je nej zvás; Boži dár je."
"New","49","2","9","Nej zdêl; naj se što ne hváli."
"New","49","2","10","Ár smo njegova náprava stvorjeni vu Kristuš Jezuši na dobra dela: štera je pripravo Bôg; naj vu njí hodimo."
"New","49","2","11","Záto spômente se; kâ ste ví nigda poganje bilí vu têli, i pravilí ste se neobrizávanje po ti zroki včinjenoga obrizávanja, štero se velí vu têli."
"New","49","2","12","Ká ste bilí v tistom vrêmeni brezi Kristuša, tühi od pörgarstva Izraelskoga i zvüna Zákonov obečanja, vüpanja nemajoči brezi Bogá ste bíli na svêti."
"New","49","2","13","Zdaj ste pa vu Kristuš Jezuši, ví, ki ste nigda bilí daleč, blüzi včinjeni po krvi Kristušovoj."
"New","49","2","14","Ár je on mér naš: ki je z obôjega edno včíno; i te srêdnje stêne plôt je doli vtrgno."
"New","49","2","15","Protivnost vu têli svojem, tô je právde zapovéd, vu návukaj bodôčo, je odevzéo; da bi dvá stvôro vu sebi na ednoga nôvoga človeka, i tak bí včíno mér."
"New","49","2","16","I zméro bi obá vu ednom têli z Bogom po kríži geto bi protivnost po njem vmôro."
"New","49","2","17","I pridôči nazvíščávao je mér vám, kí ste daleč, i, ki ste blüzi."
"New","49","2","18","Ár po njem mámo prihodbo obôji vednom Dühi k Oči."
"New","49","2","19","Že ste pa nej več tühénci i žalárje: nego pörgarje z svétimi vrét i dománji Boži."
"New","49","2","20","Gorí pocimprani na fundamentum Apoštolov i Prorokov: šteroga vogléni kamen je Jezuš Kristuš."
"New","49","2","21","Vu kom ves cimper vküp zloženi rasté na Cérkev svéto vu Gospodni."
"New","49","2","22","Vu kom ste i ví navküp gori pocimprani na prebiválišče Bože vu svétom Dühi."
"New","49","3","1","Záto jas Pavel zvézani Kristuš Jezušov rob za vás poganov volo."
"New","49","3","2","Da ste čüli šafarstvo milošče Bože dáno meni k vám."
"New","49","3","3","Ká je po oznanenjê meni na znánje dáo skrovnost: liki sem pred têm zmalim písao."
"New","49","3","4","Z šteroga morete, geto ga čteli bodete, razmeti znanost mojo vu skrovnosti Kristušovoj."
"New","49","3","5","Štera je vu drügi pokolênjaj nej dána na znánje sinom človečim; liki je zdaj oznanjena njegovim svétim Apoštolom i Prorokom po S. Dühi."
"New","49","3","6","Kâ so poganje znami vrét öročnicke i znami edno têlo znami vrét tálnicke obečanja njegovoga vu Kristuši po Evangeliomi."
"New","49","3","7","Šteroga sem jas včinjen sluga pôleg dára milošče Bože meni dáne, pôleg dela môči njegove."
"New","49","3","8","Meni naj ménšemi vsê svécov je dána milošča eta: naj med poganmi nazviščávam nezgrüntano bogástvo Kristušovo."
"New","49","3","9","I presvêtim vse, štero je občinstvo ete skrovnosti, štera je skrita bíla od vekivekôma vu Bôgi; ki je vsa stvôro po Jezuš Kristuši."
"New","49","3","10","Naj znána bode zdaj poglavárstvi i oblásti vu nebeski prebiváliščaj po gmajni vnôge felé modrôst Boža."
"New","49","3","11","Pôleg skončanja vekivečnoga; štero je včíno vu Kristuš Jezuši Gospodni našem."
"New","49","3","12","Vu kom mámo srčnost i prihodbo vu vüpaznosti po veri njegovoj."
"New","49","3","13","Záto prosim vás, ne obtrüdte vu moji nevoláj, štere za vás trpim; ár so one dika vaša."
"New","49","3","14","Za etoga volo nakleknem kôlina moja pred Očom Gospodna našega Jezuš Kristuša."
"New","49","3","15","Zšteroga se vsa držina vu nebésaj i na zemli imenüje."
"New","49","3","16","Naj vam dá pôleg bogástva díke svoje: da se močno potrdíte po Dühi njegovom vu tom notrejšnjem človeki."
"New","49","3","17","Da prebíva Kristuš po veri vu srcáj vaši."
"New","49","3","18","I da vu lübéznosti okorenjeni i fundálivani, morete zapopádnoti zevsêmi svéci: štera je ta šérjava i dúžava i globočína i visína."
"New","49","3","19","I spoznati, ka Kristuša lübiti je več, liki vsa znati: naj se napunite zevsov punostjov Božov."
"New","49","3","20","Kí je pa močen više vsega včiniti obilno bole, liki prosimo, ali míslímo pôleg môči delajôče vnami:"
"New","49","3","21","Tistomi bojdi dika vu cérkvi po Kristuš Jezuši med vsêmí národmi na veki veke. Amen."
"New","49","4","1","Prosim vas záto jas zvézani za Gospodna: hodite tak; kak se dostája pozvánja, skim ste pozváni."
"New","49","4","2","Zevsov poniznostjov i krotkostjov, ztrplivostjov znášajôči edendrügoga vu lübéznosti."
"New","49","4","3","Paščivfi se zdržati jedinstvo dühá vu vezali méra."
"New","49","4","4","Edno têlo i eden düh bojdte: liki ste i pozváni na edno vüpanje pozvánja vašega."
"New","49","4","5","Ár je eden Gospôd, edna vera, eden krst."
"New","49","4","6","Eden Bôg i Oča vsê: kí je nad vsêmi i po vsêmi i vu vsêmi vami."
"New","49","4","7","Ednomi vsákšemi med nami je pa dána milošča pôleg mere dára Kristušovoga."
"New","49","4","8","Záto právi: gori idôči vu visíno vlovleno je pelao vlovlenjé, i dáo je dári lüdém."
"New","49","4","9","Tô pa, kaj je gori šô, ka je: nego kaj je i doli šô prvle na naj níšiši tál zemlé?"
"New","49","4","10","Té, kí je doli šô, je tisti: kí je gori šô više vsê nebés; da bi napuno vsa."
"New","49","4","11","I on je dáo, níke Apoštole, níke pa proroke, níke pa Evangelište, níke pa pastére i vučitele."
"New","49","4","12","Na vküp správlanje svécov, na delo slüžbe, na cimpranje têla Kristušovoga."
"New","49","4","13","Dokeč se ne sréčamo vsi vu jedinstvi vere i znanosti Sina Božega gda bomo popolni možjé vu meri pune vrsti Kristušove."
"New","49","4","14","Naj več ne bomo cecátja dečica: kí bi se premetávali i okoli gonili od vsákoga vötra kakštê návuka vu jálnosti i vu čalárnosti lüdstva, kí za nami šütajo."
"New","49","4","15","Istíno delajôči pa vu lübéznosti, rásmo vnjem vsegavêč, kí nám je gláva, tô je Kristuš."
"New","49","4","16","Z šteroga vse têlo zrédom vküp zloženo i sklenjeno po vsê čonkláj podávanja pôleg premôči vu meri ednoga vsákšega tála rašenjé têla činí na cimpranje svoje vu lübéznosti."
"New","49","4","17","Tô záto velim i svedočim vu Gospodni: naj več ne hodite, liki ti drügi poganje hodijo, vu márnosti pámeti svoje."
"New","49","4","18","Kí so vpámeti potemneli i odtühili so se od žítka Božega za volo neznanja, štero je vu njíh i za volo trditosti srcá svojega."
"New","49","4","19","Kí, geto so se žalostiti henjali, samí sebé so ta dáli hotlivosti na delanje vse nečistôče vu parovnosti."
"New","49","4","20","Ví ste se pa nej tak včíli Kristuša."
"New","49","4","21","Či ste ga načí čüli i vu njem ste navčeni; liki je istina vu Jezuši."
"New","49","4","22","Ka se vám pristája doli djáti pôleg prvoga živlênja toga stároga človeka skvárjenoga pôleg žél zapelávanja."
"New","49","4","23","Ponoviti se pa vdühi pámeti vaše."
"New","49","4","24","I oblêčti nôvoga človeka pôleg Bogá stvorjenoga vu pravici i svestvi te istine."
"New","49","4","25","Záto doli dênte láž i gúčte istino vsákši zblíznjim svojim: ár smo edendrügoga kotrige."
"New","49","4","26","Srdte se, ali ne grêšte: sunce naj ne zájde nad vašov srditostjov."
"New","49","4","27","Ne dájte mesta vrági."
"New","49","4","28","Kí je kradno: več naj ne krádne; nego bole naj dela dobro činéči z rokami, da má kaj podiliti tomi potrêbnomi."
"New","49","4","29","Nikša gníla réč zvüst vaši naj vö neide: nego či je kákša dobra na pobôgšanje potrêbčíne, naj dá miloščo poslüšávcom."
"New","49","4","30","I ne dresélte Božega svétoga Dühá; vkom ste zapečáčeni na dén odküplenjá."
"New","49","4","31","Vsáka britkost i čemér i srd i krič i preklinjanje kraj bodi od vás zevsov hüdôbov."
"New","49","4","32","Bojdte pa k edendrügomi priaznivi, milostivni zobstom si odpüščávajôči: liki je i Bôg vu Kristuši vám odpüsto."
"New","49","5","1","Bojdte záto naslednicke Boži; liki lübezniva deca."
"New","49","5","2","I hodte vu lübéznosti, liki je Kristuš lübo nás i tá je dáo sám sebe za nás dár i áldov Bôgi na dobro díšanje."
"New","49","5","3","Práznost pa i vsáka nečistôča, ali skopôst se naj ni ne imenüje med vami; liki se dostájá svésov."
"New","49","5","4","I rúžnost i blázni guč, ali šála, štera se ne dostájajo; nego bole hválo dávanje."
"New","49","5","5","Ár tô vám na znánje bojdi: kâ vsáki práznik, ali nečísti ali skôpi, ki je bolvánčar, nema öročíne v králevstvi Kristušovom i Božem."
"New","49","5","6","Nišče vás naj ne zapela spráznimi ričmí. Ár za toga volo príde srditost Boža na siní neverností."
"New","49","5","7","Ne bojdte záto v tom tálnicke ž njimi."
"New","49","5","8","Ár ste bili nigda kmica; zdaj ste pa svetlost vu Gospodni: liki deca svetlosti hodite."
"New","49","5","9","(Ár je sád Dühá vsa dobrôta i pravica i istina.)"
"New","49","5","10","Vardêvajte, ka je vugodno Gospodni."
"New","49","5","11","I ne mêjte občinstva z nesadovenim delom te kmice: nego je bole kárajte."
"New","49","5","12","Ár, ká se skrívoma godíjo od njíh, grdô je ešče praviti."
"New","49","5","13","Tá pa vsa, da se kárajo od svetlosti, očivesna grátajo. Ár je vse ka je očivesno včinjeno, svetlost."
"New","49","5","14","Záto právi: zbüdi se, ki spiš i stani z mrtvi i presvêti se tí Kristuš."
"New","49","5","15","Glédajte záto: da skrblivo hodite: nej, liki nemôdri, nego liki môdri,"
"New","49","5","16","Vö si küpte k zveličanji prílično vrémen: ár so dnévi hüdi."
"New","49","5","17","Záto ne bojdte nečedni: nego rázumni v onom; ka je Gospodnova vola."
"New","49","5","18","I ne zapójte se z vínom, v kom je hotlivost: nego se napunte z svétim Dühom;"
"New","49","5","19","Gučéči med sebom z Žoltármi i z hválmi i z dühovnimi pesmami spêvavši i cínkavši vu srci vašem Gospodni."
"New","49","5","20","Hválo dávajôči vsigdár za vsa vu iméni Gospodna našega Jezuša Kristuša, Bôgi i Oči."
"New","49","5","21","Podáni eden drügomi vu stráhi Božem."
"New","49","5","22","Žene lastivním možom podáne naj bodo, liki Gospodni."
"New","49","5","23","Záto: kâ je môž gláva žené, liki je i Kristuš gláva materé Cérkvi; i on je zveličitel têla."
"New","49","5","24","Nego, liki je cérkev podána Kristuši tak i žene lastivnim možom vu vsem."
"New","49","5","25","Možjé, lübte žene svoje: liki je i Kristuš lübo mater Cérkev i sám sebé je tá dáo za njô."
"New","49","5","26","Da bi jo posvéto očistivši jo z kôpeljov vodé vu rêči."
"New","49","5","27","Da bi jo postavo sám sebi odičeno tákšo Cérkev, ka bi ne mêla špreglo, ali grbo, ali kâ tákšega: nego da bi bíla svéta i nepokárana."
"New","49","5","28","Tak so dužni možjé lübiti svoje žene; liki svoja têla. Kí lübi svojo ženo: sám sebé lübi."
"New","49","5","29","Ár je nišče nej nigdár sám svoje têlo odüro; nego je hráni i varje: liki i Gospôd Cérkev svojo."
"New","49","5","30","Ár smo kotrige têla njegovoga ž njegovoga mesá i z kôst njegovi."
"New","49","5","31","Za toga volo ostávi Človik očo svojega i mater svojoj pridrüži se k ženi svojoj, i dvá bodeta edno têlo."
"New","49","5","32","Eta skrovnost je velika. Jas pa právim od Kristuša i od matere Cérkvi."
"New","49","5","33","Záto i ví eden po ednom, vsákši svojo ženo tak lübte; liki samí sebé: žena se pa naj bojí možá."
"New","49","6","1","Otroci, pokorni bojdte roditelom vašim vu Gospodni; ár je tô pravično."
"New","49","6","2","Poštüj očo tvojega i mater tvojo; (štera je prva zapovid vu obečanji)."
"New","49","6","3","Naj ti dobro bode i bodeš dúgoga vrêmena na zemli."
"New","49","6","4","I vi očeve ne dráždžite otroke vaše; nego je hránte vu stráhi i opomínanji Gospodnovom."
"New","49","6","5","Slugi, pokorni bojdte vašim telovnim gospodárom strahotov i strepetlivostjov vu prostôči srcá vašega, liki Kristuši."
"New","49","6","6","Naj nej li samo nazôči slüžite: liki da bi se lüdém šteli dopádnoti: nego, liki slugi Kristušovi, činte volo Božo z düše."
"New","49","6","7","Z dobrov míslov slüžéči Gospodni; i nej lüdém."
"New","49","6","8","Znajôči, kâ vsákši, kakoli dobroga včiní, tistoga pláčo vzeme od Gospodna, áli je sluga, ali slobodnják."
"New","49","6","9","I vi gospodárje ta ista činte ž njimi tá nihávši prtjé znajôči, kâ i ví samí máte Gospôda vu nebésaj i prijímanje osôb je nej pri njem."
"New","49","6","10","Na dale, bratje moji, močni bojdte v Gospodni i vu môči zmožnosti njegove."
"New","49","6","11","Oblêčte na sé vse rožjé Bože; da bodte mogli státi prôti jálnomi vrájžemi šütanji."
"New","49","6","12","Ár mí nemamo boja prôti krvi i têli: nego prôti poglavníkom, prôti oblásti, prôti svêta zmožnosti: kí vu kmicí etoga svêta ládajo, prôti dühovnim hüdôbam, za ti nebeski volo."
"New","49","6","13","Záto gori vzemte vse rožjé Bože; da morete prôti stánoti vu tom hüdom dnévi i vsa opravivši, obstáti."
"New","49","6","14","Stojte záto opásani na ledevjáj vaši z istinov i oblečeni sprsnjekom pravice."
"New","49","6","15","I obüti na nogáj z prípravov Evangelioma toga méra."
"New","49","6","16","Više vsega ešče vzemte gori záslobo te vere; z šterov morete vse ognjene strêle toga hüdoga vgasiti."
"New","49","6","17","Ilebko zveličanja vzemte i meč dühá; kí je rêč Boža."
"New","49","6","18","Vu vsákoj molítvi i prošnji moléči stálni bojdte vsákom vrêmeni vu Dühi, i v tom ístom verostüvajôči vu vsoj gedrnosti i molítvi za vse svéce."
"New","49","6","19","I za méne; naj se mi dá rêč vu odpéranji vüst moji vu srčnosti na oznanüvanje skrovnosti Evangelioma."
"New","49","6","20","Nad šterim poselstvo nosim vu lánci; naj v njem srčno gučim, liki trbê gúčati."
"New","49","6","21","Naj pa znáte i ví moja dugovánja, ka delam: vsa vám na znánje dá Tihikuš te lübléni brat i veren sluga vu Gospodni."
"New","49","6","22","Šteroga sem poslao k vám za toga volo: naj vám oznáni tá, štera se okoli nás godíjo, i obeselí srcá vaša."
"New","49","6","23","Mér bratom i lübézen z verov od Očé Bogá i Gospodna Jezuša Kristuša."
"New","49","6","24","Milošča zevsêmi, kí lübijo Gospodna našega Jezuša Kristuša v neskvarjenosti. Amen. K Efezáncom písani z Ríma po Tihikuši."
"New","50","1","1","Pavel i Timoteuš slugi Jezuš Kristušovi vsêm svétim vu Kristuš Jezuši, bodôčim vu Filippi, zpüšpekmi i z Diákonušmi vrét."
"New","50","1","2","Milošča vám i mér od Bogá Očé našega i Gospodna Jezuša Kristuša."
"New","50","1","3","Hvalo dájem Bôgi mojemi: gda koli se zvás spomínam."
"New","50","1","4","Vsigdár vu vsákoj molítvi mojoj za vse vás zradostjov molítev činéči."
"New","50","1","5","Nad občinstvov vašov vu Evangeliomi od prvoga dnéva notri do vezdášnjega."
"New","50","1","6","Gvüšen bodôči v tom; kâ, kí je záčao vu vami to dobro delo, i dokonča je notri do dnéva Jezuš Kristuša."
"New","50","1","7","Liki je i pravično meni tô misliti od vsê vás; geto vás vu srci mám, i vu vôzi mojoj i vu zgovárjanji i potrdjávanji Evangelioma: liki kí ste vsi tálnícke zmenom vrét milošče."
"New","50","1","8","Ár mi je svedok Bôg; kakda vás vse želêm vu lübéznosti Jezuš Kristušovoj."
"New","50","1","9","I záto se molim: naj lübézen vaša ešče bole i bole obiljáva vu spoznávanji i vsákom žmahi."
"New","50","1","10","Da sküsite: štera se razločávajo; naj bodete čísti i nepoteknjeni na dén Kristušov."
"New","50","1","11","Napunjeni s sádom pravice po Jezuš Kristuši na díko i hválo Božo."
"New","50","1","12","Ščém pa, naj znáte, bratje; kâ so mojega robstva dugovánja bole na naprê idênje Evangelioma prišla."
"New","50","1","13","Tak; da so moja vézanja očivesna vu Kristuši včinjena vu cêlom Casarskom dvori i vu vsej drügi mêstaj."
"New","50","1","14","I vnôgi bratov vu Gospodni z moje vôze so srčnêši grátali, obilnê smêjo brezi strahá réč gúčati."
"New","50","1","15","Níšteri istina i z nenávidnosti i njefke; níšteri pa i zdopádnenjá prédgajo Kristuša."
"New","50","1","16","Kí istina z njefke Kristuša nazviščávajo nej čísto: štímajo, ka tak vékšo nevolo prineséjo mojmi vézanji."
"New","50","1","17","Kí pa zlübéznosti: znájo, kâ sem jas na zagovárjanje Evangelioma postávleni."
"New","50","1","18","Ka záto? Dönok zevsim tálom, ali skazlivostí, ali z istine se nazviščáva Kristuš, i v tom se radüjem; ali i radüvao se bodem."
"New","50","1","19","Ár znám; ka mi tô bode k zveličanji po vašoj molítvi i pomáganji Dühá Jezuš Kristušovoga."
"New","50","1","20","Pôleg skrblivoga čákanja i vüpanja mojega; kâ se v nikom ne osramotim; nego v srčnom gúčanji, liki vsigdár, tak i zdaj se zvišáva Kristuš vu têli mojem, ali požítki, ali po smrti."
"New","50","1","21","Ár je meni žítek Kristuš i smrt mi je dobiček."
"New","50","1","22","Či mi je pa živeti vu têli: tak mi je tô sád dela; i, ka si odlôčim, neznam."
"New","50","1","23","Ár se stiskávam od obôjega: želênje mám k razvézanji i s Kristušom bidti; kotero mi zvnôgim več valá."
"New","50","1","24","Ostánoti pa vtêlí mi je bole potrêbno za vás volo."
"New","50","1","25","I tô za gvüšno znám: kâ ostánem i zevsêmi vami ostánem na vaše gori jemánje i radost vere."
"New","50","1","26","Naj hvála vaša obiljáva vu Kristuš Jezuši nad menom po mojem páli k vám pridênji."
"New","50","1","27","Li, kak je vrêdno, pôleg Evangelioma Kristušovoga hodite: naj, ali prídem i vídim vás, ali ôzdaleč bodôči, čüjem eta od vás; kâ stojite vu ednom Dühi z ednov düšov se navküp borivši za vero Evangelioma."
"New","50","1","28","I ne prestrašte se vu nikom od ti prôti stojéči; štero je njim istina kázanje skvarjenjá, vám pa zveličanja: i tô je od Bogá."
"New","50","1","29","Ár je vám zobstom dáno za Kristuša nej samo vu njem vervati; nego i za njega trpeti."
"New","50","1","30","Té boj majôči, šteroga ste vidili v meni, i zdaj čüjete od méne."
"New","50","2","1","Či je záto kákše opominjanje vu Kristuši, či je kákša obéselnost lübézni, či je kákše občinstvo dühá, či je kákša milostivnost i smilenost med vami,"
"New","50","2","2","Napunte mojo radost; naj tô ísto míslite, tô isto lübéznost máte; edne düše i edne mísli bojdite."
"New","50","2","3","Nikaj po njefki, ali márnoj díki ne činte: nego zponiznostjov eden drügoga od sébe za vékše preštímajôči."
"New","50","2","4","Ne glédajte vsákši svoja; nego i tá, štera so ti drügi, vsákši naj gléda."
"New","50","2","5","Tá náklonost naj bode vu vami: štera je i vu Kristuš Jezuši."
"New","50","2","6","Kí vu obrázi Božem bodôči nej je za ftrgnenjé držao; ka je ednáki bio z Bôgom."
"New","50","2","7","Nego je sám sebé ponízo, obráz slugov je na sé vzéo vu spodobnosti človečoj je bio."
"New","50","2","8","I vnošenjê je nájden, liki prôsti Človik: ponízo se je, včinjeni pokoren notri do smrti, smrti pa kríža."
