Testament,Book,Chapter,Verse,Content
"New","40","1","1","Knige rodstva Jezuš Kristuša, siná Dávidovoga, siná Abrahámovoga."
"New","40","1","2","Abrahám je porôdo Ižáka; Ižák je pa porôdo Jákoba; Jákob je pa porôdo Juda, i brate njegove."
"New","40","1","3","Juda je pa porôdo Fáreša i Zára z Támare; Fáreš je pa porôdo Ešroma; Ešrom je pa porôdo Arama."
"New","40","1","4","Aram je pa porôdo Aminadába; Aminadáb je pa porôdo Naaššona; Naaššon je pa porôdo Šalmona."
"New","40","1","5","Šalmon je pa pôrodo Boózá z Ráhabe; Boóz je pa porôdo Obeda z Rute; Obed je pa porôdo Ješšea."
"New","40","1","6","Ješše je pa porôdo Dávid Krála: Dávid Král je pa porôdo Šalamona z Uriášove žené."
"New","40","1","7","Šalamon je pa porôdo Roboáma; Roboám je pa porôdo Abia; Abia je pa porôdo Aša."
"New","40","1","8","Aša je pa porôdo Jošafáta; Jošafát je pa porôdo Joráma; Jorám je pa porôdo Oziáša."
"New","40","1","9","Oziáš je pa porôdo Joatama; Joatam je pa porôdo Aháza; Aház je pa porôdo Ezekiáša."
"New","40","1","10","Ezekiáš je pa porôdo Manaššešša; Manaššeš je pa porôdo Amona; Amon je pa porôdo Jóšiáša."
"New","40","1","11","Jošiáš je pa porôdo Jehoniáša, i brate njegove za vrêmena Babilonskoga seljenjá."
"New","40","1","12","Po Babilonskom seljenjé je pa Jehoniáš porôdo Šalatiela; Šalatiel je pa porôdo Zorobábela."
"New","40","1","13","Zorobábel je pa porôdo Abiuda; Abiud je pa porôdo Eliákima; Eliákim je pa porôdo Azora."
"New","40","1","14","Azor je pa porôdo Šádoka; Šádok je pa porôdo Ahima; Ahim je pa porôdo Eliuda."
"New","40","1","15","Eliud je pa porôdo Eleázara; Eleázar je pa porôdo Mátána; Mátán je pa porôdo Jákoba."
"New","40","1","16","Jákob je pa porôdo Jožefa možá Marie, z štere je porôdjen Jezuš, ki se zové Kristuš."
"New","40","1","17","Záto vsa eta pokolênja od Abraháma notri do Dávida so štirinájsetera pokolênja; i od Dávida notri do Babilonskoga seljenjá je štirinájset pokolênj, i od Babilonskoga seljenjá je štirinájset pokolênj notri do Kristuša."
"New","40","1","18","Jezuš Kristuša rodjenjé je pa etak bilô: zaročena mati njegova Mária Jožefi prvle, liki sta vküp prišla, nájdena je noséča z Dühá svétoga."
"New","40","1","19","Jožef pa njé môž, pravičen bodôči nej jo je šteo osramotiti; nego jo je šteo skrivomá odpüstiti."
"New","40","1","20","Gda bi pa eta v sebi premišlávao: ovo, Angel Gospodnov se je njemi skázao vu sne, erkôči: Jožef Sin Dávidov, neboj se k sebi prijéti Mário ženo tvojo. Ár ka se je v njê popríjalo, z Svétoga Dühá je."
"New","40","1","21","Porodi pa Sina, i zváo boš imé njegovo Jezuš; ár on zveliča lüdstvo svoje od grêhov njegovi."
"New","40","1","22","(Tô se je pa celô záto zgôdilo: da bi se spunilo, ka je povêdano od Gospodna po Proroki erkôčem:"
"New","40","1","23","Ovo, dêva bode noséča, i porodi Sina, i zváli bodo imé njegovo: Emmánuel, štero je razklajeno: znami Bôg.)"
"New","40","1","24","Obüdjen pa Jožef zesna včíno je tak, liki je zapovedao njemi Angel Gospodnov; i k sebi je prijao ženo svojo."
"New","40","1","25","I nej jo je spoznao: dokeč je nej parodila sina svojega prvorodjenoga; i zváo je imé njegovo Jezuš."
"New","40","2","1","Gda se je pa Jezuš porôdo v Betlehemi Júde, vu dnévi Herodeš Krála; ovo môdri so prišli od sunčenoga zhoda v Jerušálem erkôči:"
"New","40","2","2","Gde je te porodjeni kral Židovski? Ár smo vidili njegovo zvêzdo na sunčenom zhodi, i prišli smo ga molit."
"New","40","2","3","Tô pa slišavši Herôdeš Král, zburkao se je, i žnjim ves Jerušálem."
"New","40","2","4","I, vküp spravivši vse vládnike popovske, i pisáče lüdstva spítávao je od njih: gde bi se meo Kristuš poroditi?"
"New","40","2","5","Oni so pa erkli njemi: v Betlehemi Júde. Ár je tak pisano po proroki:"
"New","40","2","6","I ti Betlehem, zemla Júde, znikakšim tálom si nej nájménša med poglavniki Júde. Ar z tébe bode zhájao voj; šteri bode páso lüdstvo moje Izráelsko."
"New","40","2","7","Teda je Herodeš skrivomá zvao te môdre, i skrblivo je zvedávao od njih ono vrêmen; v kom se je skázala ta zvêzda."
"New","40","2","8","I, poslao je v Betlehem, i erčé: idôči skrblivo spitávajte od deteta; gda je pa nájdete, nazvêstite mi, da je i jas, tá idôči, molim."
"New","40","2","9","Oni pa poslühnovši Krála, šli so tá. I ovo, zvêzda, štero so vidili na zhodi pred njimi je šla; dokeč pridôč je stánola, gde je bilô to dête."
"New","40","2","10","Vidivši pa zvêzdo, radüvali so se jáko zvelikom radostjom."
"New","40","2","11","I idôči vu hižo, naišli so to dête z Máriom materjom njegovom: i pokleknovši molili so je; i ôdprli so kinče svoje i darüvali so njemi dári, zláto, i kadilo, i miro."
"New","40","2","12","I opômenjeni od Bogá vu sne, naj se ne vrnéjo nazá k Herôdeši, po drügoj pôti so šli nazâ vu svoje domovine."
"New","40","2","13","Gda so pa oni odíšli; ovo Angel Gospodnov skázao se je vu sne Jožefi, erkôči: gori stánovši vzemi to dête i mater njegovo i bêži v Egiptom, i boj tam, dokeč ti povêm. Ár Herodeš bode ískao to dête na pogübel."
"New","40","2","14","On pa gori stánovši vzéo je to dête, i mater njegovo v noči, i odíšao je v Egiptom."
"New","40","2","15","I bio je tam notri do smrti Herodešove; da bi se spunilo; ka je povêdano od Gospodna po proroki erkôčem: z Egiptoma sem zvao sina mojega."
"New","40","2","16","Teda Herodeš gda bi vido, kâ je ošpotan od ti môdri, rasrdo se je jáko, i poslavši vojsko spomôro je vso deco, v Betlehemi i vu vsê krainaj njegovi, od dvê let i niže staro poleg vrêmena, štero je paščlivo zeznao od ti môdri."
"New","40","2","17","Teda se je spunilo ka je povêdano od Jeremiáš proroka erkôčega:"
"New","40","2","18","Glás je v Rámi slišani, plač i joč i cvil vnôgi. Ràhel je jôkala svoje Sini, i nej se je štela obeseliti záto; kâ ji je nej bilô."
"New","40","2","19","Po smrti pa Herodešove, ovo Angel Gospodnov v sne se je skázao Jožefi v Egiptomi."
"New","40","2","20","Erkôči: stani gori vzemi to dête i mater njegovo, ino idi v Izraelsko zemlo; Ár so pomrli, ki so ískali düšo deteta."
"New","40","2","21","On pa gori stánovši vzéo je to dête i mater njegovo, i šô je v Izraelsko zemlo."
"New","40","2","22","Slišavši pa, kâ Arhelauš kralüje nad Judeom mesto Herodeša očé svojega, bojao se je tá idti. Opômenjeni pa od Bogá vu sne, šao je na stráni Galilee."
"New","40","2","23","I, tá pridôči prebivao je v mesti, štero se velí Názaret: dabi se spunilo povêdanje po prorokáj; kâ bode se Nazarenski zváo."
"New","40","3","1","Vu oni dnévi prišao je Ivan krstitel predgajôči vu püščávi Judee."
"New","40","3","2","I govoreči: povrnte se; ár se je približalo Králevstvo nebesko."
"New","40","3","3","Ár je eto, ka, je povêdano od Ežaiáša proroka govoréčega: glás kričéčega vu püščávi, napravlajte pôt Gospodnovo, rávne činte steze njegove."
"New","40","3","4","On pa, Ivan, je meo odetel svojo z gomilskoga kosminja i remeni pojás okôli ledevjôv svoji: njegova hrána je pa bila, kobiice i polski méd."
"New","40","3","5","Teda je vö šô k njemi Jerušalem, i vsa Judea, i vse okôli Jordáná ležajôče držéle."
"New","40","3","6","I okrsčávali so se v Jordáni od njega, vadlüvajôči grêhe svoje."
"New","40","3","7","Gda bi pa vido vnôge z Farizeušov i z Sadduceušov prihájajôče k svojemi krsti, erkao njim je: zleženjé vipere, što vám je pokázao bèžati od prišestne srditosti?"
"New","40","3","8","Prinášajte záto sád vrêdni pokôre."
"New","40","3","9","I ne štímate ešče kâ bi pravili vu sebi: očo mámo Abraháma. Ár velim vám, kâ je zmožen Bôg z etoga kaménja zbüditi sini Abrahámi."
"New","40","3","10","Že je pa i sekera na korenjé drevja položena. Záto vsáko drêvo, štero ne prináša dobroga sáda, se vö vsečé, i na ogen vrže."
"New","40","3","11","Jas istina krstšávam vás vu vodi na pokôro: ki pa za menom pride, močnêši je od méne, šteroga šôlincov sem nej vrêden nositi; on bode vás krstšávao v Svétom Dühi, i v ognji."
"New","40","3","12","Šteri má vejačo vu rôki svojoj, i ščisti gümno svoje, i vküp správi pšenico svojo v škegen; pleve pa zežgé z nevgašenim ognjom."
"New","40","3","13","Teda je prišao Jezuš od Galilee k Jordáni k Ivani da bise krsto od njega."
"New","40","3","14","Ivan se je pa odgovárjao erkôči: meni se je potrêbno od tébe krstiti, i ti kmeni prihájaš?"
"New","40","3","15","Odgovoréči pa Jezuš erkao njemi je: niháj zdâ; ár se tak dostája náj spuniti vso pravic o. Teda ga je püsto."
"New","40","3","16","I okrsčen Jezuš preci je gori šô, od vodé: i ovo, odprla so se njemi nebésa, i vido je Dühá Božega doli idôčega, liki golôba, i idôčega na njega."
"New","40","3","17","I ovo glás z nebés govoréči: ete je Sin moj, te lübléni: v kom se mi je dopadnolo."
"New","40","4","1","Teda je Jezuš odnešeni vu püščávo od Dühá da bi se sküšávao od vrága."
"New","40","4","2","I da bi se posto štiridesét dni, i štiridesét nôči, potom je ogládo."
"New","40","4","3","I pristôpivši k njemi te sküšávec, erkao je: či si Sin Boži, erči, naj eta kaménja krüh bodo."
"New","40","4","4","On je pa, odgovoréči erkao: pisano, je, človek neživé z samim krühom; nego vsákov rečjov, štera z vüst Boži zhája."
"New","40","4","5","Teda ga je vzéo vrág vu svéto mesto, i postavo ga je na perotnico Cérkvi."
"New","40","4","6","I erkao je njemi: či si Sin Boži, vrži se doli. Ár je pisano; kâ Angelom svojim zapovê od tébe; in na roké te vzemejo, da kak ne vdáriš vu kamen nogé tvoje."
"New","40","4","7","Erkao je njemi Jezuš: pá je pisano; ne sküšávaj Gospodna Bogá tvojega."
"New","40","4","8","Pá ga vzeme vrág na edno jáko visoko gorô, i pokáže njemi vsa králevstva toga svêta i njih díko."
"New","40","4","9","I velí njemi: eta vsa tebi dam; či doli spádnovši me molo bodeš."
"New","40","4","10","Teda njemi velí Jezuš: odídi Šatan. Ár je pisano: Gospodnoga Bogá tvojega moli i njemi samomi slüži."
"New","40","4","11","Teda ga je niháo vrág: i ovo Angelje so pristôpili, ino so njemi slüžili."
"New","40","4","12","Gda bi pa čüo Jezuš; ka je Ivan v roké dáni: šô je nazâ v Galileo."
"New","40","4","13","I ostavivši Názaret idôči je prebívao v Kapernaumi v tom pri môrji vu Krajináj Zabulona, i Neftalima."
"New","40","4","14","Da bi se spunilo povêdanje po Ežaiáši proroki govoréčem:"
"New","40","4","15","Zemla Zebulon, i Zemla Neftalim pôleg pôti môrja prêk Jordána, Galilea poganov."
"New","40","4","16","Lüdstvo sedéče v kmici, je vidilo svetlost veliko: i tim sedéčím vu držéli i senci smrtnoj, je svetlost zišla."
"New","40","4","17","Od tistoga máo je záčao Jezuš predgati, i praviti: povrnte se; àr se je približalo králevstvo nebesko."
"New","40","4","18","Hodéči pa Jezuš kre môrja Galileánskoga, vido je dvá brata, Šimona, šteri se zové Peter, i Andráša brata njegovoga, metajôčiva vlák vu môrje; (ár sta ríbiča bilá)."
"New","40","4","19","I velí njima: nasledüjta me, i včinim vaj lüdi ríbiča."
"New","40","4","20","Onedva sta pa preci tá nihála vlaké, nasledüvala sta njega."
"New","40","4","21","I dale idôči odnut, vido je drüga dvá brata, Jákuba Zebedeušovoga Siná, i Ivana brata njegovoga, v ládji z Zebedeušom njidva očom poprávlajôče vlaké svoje; i zváo njidva je."
"New","40","4","22","Onedva sta pa preci tá nihála ládjo, i očo svojega, nasledüvala sta njega."
"New","40","4","23","I okôli je šò po vsoj Galilei Jezuš vučéči vu správiščaj njihovi i predgajôči Evangeliom králevstva, i vráčivši vsáki beteg, i vsáko medlovnost med lüdstvom."
"New","40","4","24","I vö je zišao glás njegov vu vso Širio; i prinesli so k njemi, ki so se hüdô meli, z rázločnimi boleznostmi i mokami obvzéte, i vragometne, i mêsečne, i zžlakom vdárjene; i zvráčo je je."
"New","40","4","25","I nasledüvalo ga je vnožina lüdstva od Galilee, i desét mêst, i Jerušálema, i Judee i prêk Jordána bodôči."
"New","40","5","1","Gda bi pa vido Jezuš to lüdstvo, šô je gori na goro: i gda bi doli seo, pristôpili so k njemi vučenicke njegovi."
"New","40","5","2","I odpré vüsta svoja, včio je je govoréči:"
"New","40","5","3","Bláženi so, ki so siromácke v dühi: ár je njihovo Králevstvo nebesko."
"New","40","5","4","Bláženi so, ki se žalostijo: ár se oni obeselijo."
"New","40","5","5","Bláženi so ti krotki: ár oni bodo zemlô öroküvali."
"New","40","5","6","Bláženi so, ki gladüjejo, i žéjajo pravico: ár se oni nasitijo."
"New","40","5","7","Bláženi so ti milostivni: ár oni miloščo dobíjo."
"New","40","5","8","Bláženi so oni, ki so čistoga srcá: ár oni bodo Bogá vidili."
"New","40","5","9","Bláženi so ti mirovni: ár se oni Boži sinovje zváli bodo."
"New","40","5","10","Bláženi so, ki se za volo pravice pregánjajo: ár je njihovo Králevstvo Nebesko."
"New","40","5","11","Bláženi ste, gda vás psüvali i preganjali bodo, i gučali bodo vso hüdo rêč prôti vám lažéči, za mojo volo."
"New","40","5","12","Radüjte se ino se vesélte: kâ je vaš nájem veliki vu nebésaj. Ár so tak preganjali i proroke: ki so pred vami bili."
"New","40","5","13","Vi ste sol zemlé: či se pa sol skvari, s kim se bode solíla? Nika ne valá več: nego da se vö vrže, i skláči od lüdi."
"New","40","5","14","Vi ste svetlost etoga svêta. Nemore mesto skrito bidti, štero je na velikom brêgi položeno."
"New","40","5","15","Niti ne vužgéjo posvêta: naj ga pod korc denejo: nego v posvečnjek, i svêti vsêm, ki so v hiži."
"New","40","5","16","Tak se naj svêti svetlost vaša pred lüdmi: da vidijo vaša dobra dela, i dičijo Očo vašega, ki je vu nebésaj."
"New","40","5","17","Ne štimajte; kâ sem prišao razvežüvat Právdo, ali Proroke: nej sem prišao razvežüvat nego spunjávat."
"New","40","5","18","Ár zaistino velim vám: dokečkoli ne prêde Néba i Zemla, eden pisk, ali edna piknjica ne prêde z Právde; dokečkoli se vsa ne zgodijo."
"New","40","5","19","Záto, šterikoli razvéže edno zapoved tê ti naj ménši, i tak bode včio lüdí, naj ménši se bode zváo v králevstvi nebeskom: šteri pa bode prav činio i včio; té bode se veliki zváo v králevstvi nebeskom."
"New","40","5","20","Záto velim vám kâ, či ne bode popolna pravica vaša bole, liki pisáčov ino Farizeušov, ne bodete šli v králevstvo nebesko."
"New","40","5","21","Čüli ste; kâ je povêdano tim starišom: ne vmôri; šterikoli pa vmori, vrêden je sôdbe."
"New","40","5","22","Jas pa velím vám: kâ vsáki, šteri se srdi na brata svojega zamán; vrêden je sôdbe: šterikoli pa erčé brati svojemi, lajhár; vrêden bode správišča: šterikoli pa erčé, blázen; vrêden bode gehenskoga ognja."
"New","40","5","23","Či záto gori prineséš dár tvoj na oltár, i tam se spomenéš, kâ brat tvoj má kâ prôti tebi."
"New","40","5","24","Niháj tam dár tvoj pred oltárom, ino idi, zméri se prvle z bratom tvojim, i teda pridôči prinesi dár tvoj."
"New","40","5","25","Boj dobre pámeti k protivniki tvojemi hitro, dokeč si na pôti žnjim, naj te gda ne dá protivník sodci, i sodec te dá hlápci, i v temnico se vržeš."
"New","40","5","26","Zaistino velim tebi: ne boš vöšò odnut; dokeč ne pláčaš te slêdnji sôd."
"New","40","5","27","Čüli ste, kâ je povêdano tim starišom: ne praznüj:"
"New","40","5","28","Jas pa velim vám: kâ vsáki, ki se zglédne na ženo k poželênji, že je praznüvao žnjom vu svojem srci."
"New","40","5","29","Či te pa okô tvoje dêsno spáka; vö je skopaj i vrži je od tébe. Ár je bole tebi: da se pogübí edna kotríg tvoji; liki, ka bi se cêlo tvoje têlo vrglo v gehenno."
"New","40","5","30","I či te dêsna tvoja rôka spáka; odreži jo, i vrzi jo od tébe. Ár je bole tebi: da se pogübí edna kotríg tvoji; liki, ka bi se cêlo tvoje têlo vrglo v gehenno."
"New","40","5","31","Povêdano je pa: ká, šterikoli odpüstí ženo svojo, nâ ji dá razločenjá list."
"New","40","5","32","Jas pa velim vám: ká, šterikoli odpüsti ženo svojo brezi zroka práznosti, včiní jo praznüvati; i, šterikoli odpüščeno vzeme, praznüje."
"New","40","5","33","Páli ste čüli; kâ je povêdano tim starišom: krívo ne priségaj; dáj pa Gospodni prisego tvojo."
"New","40","5","34","Jas pa velim vám: ne priségajte celô, niti na nébo záto, kâ je Boži trônuš."
"New","40","5","35","Niti na zemlo záto; kâ je podnogáonica njegova: niti na Jerušálem záto; ka je mesto velikoga krála."
"New","40","5","36","Niti na glávo tvojo ne priségaj: ár nemreš ednoga vlása bêloga, ali črnoga včiniti."
"New","40","5","37","Bojdi pa rêč vaša: tak, tak; nej, nej; ka je pa više toga, z hüdoga je."
"New","40","5","38","Čüli ste, kâ je povêdano: okô za okô; i zôb za zôb."
"New","40","5","39","Jas pa velím vám: ne stante prôti hüdomi; nego kikoli te vdári na dêsnom tvojem líci, obrni njemi i to drügo."
"New","40","5","40","I ki se ščé z tebom právdivati, ino ti süknjo vzéti: püsti njemi i plášč."
"New","40","5","41","I kikoli te bode primárjao na edno milo zemlé, idi žnjim dvê."
"New","40","5","42","Ki te prosi; daj njemi: i ki ščé od tébe na pôsodo vzéti, ne obrni se od njega."
"New","40","5","43","Čüli ste; kà je povêdano: lübi bližnjega tvojega, i odürjávaj nepriátela tvojega."
"New","40","5","44","Jas pa velim vám: lübte nepriátele vaše; blagoslávlajte one, ki vás preklinjajo; dobro činte z onimi, ki vás odürjávajo; i molte za one, ki vás sküšávajo ino pregánjajo."
"New","40","5","45","Da bodete sinovje Očé vašega, šteri je v nebésaj, ki sunce svoje gori zhájati čini na hüde i dobre, i dá deždž na pravične i nepravične."
"New","40","5","46","Ár, či bodete lübili li té, ki vás lübijo, kákši nájem bodete meli? Nêli i publikánuške tô činijo?"
"New","40","5","47","I, či bodete se poklanjali samo vašim bratom; ka obilnoga včinite? Nêli i publikánuške tak činijo?"
"New","40","5","48","Záto bojdite vi popolni, liki i Oča vaš, šteri je vu nebésaj, je popolni."
"New","40","6","1","Kebzüjte, álmoštvo vaše ne činte pred lüdmi; naj se od njih vidíte: drügači nájema nêmate pri Oči vašem, šteri je vu nebésaj."
"New","40","6","2","Gda pa činiš álmoštvo: ne tromböntaj pred tebom, liki skazlivci činijo vu správiščaj, i na vilicaj; naj se dičijo od lüdi. Zaistino velím vám: prijali so nájem svoj."
"New","40","6","3","Ti pa tak čini álmoštvo: naj nezna lêva tvoja, ka čini dêsna tvoja."
"New","40","6","4","Naj bode tvoje álmoštvo vu skrivnom mesti, i Oča tvoj, ki vidi vu skrivno, on ti povrné vu očivesnom."
"New","40","6","5","I, gda moliš, ne bojdi, liki skazlívci. Ár lübijo vu správiščaj i na vogláj vilic stojéči moliti: naj se vidijo od lüdi. Zaistino velím vám: kâ so vzéli nájem svoj."
"New","40","6","6","Ti pa, gda moliš, idi notri v kámro tvojo i doli zapri dveri tvoje, i moli Očo tvojega vu skrivnom, i Oča tvoj vidôči vu skrivnom, povrné ti vu očivosnom."
"New","40","6","7","Moléči pa ne bojdite vnogogučéči, liki poganje. Ár štimajo, kâ se vu svojem vnogom gúčanji poslühnejo."
"New","40","6","8","Záto ne priglihávajte se k njim. Ár zná Oča vaš, štera potrebüjete, prvle, liki ga vi prosite."
"New","40","6","9","Záto vi etak molte: Oča naš, ki si vu nebésaj. Svéti se Imé Tvoje."
"New","40","6","10","Prídi Králevstvo Tvoje: bojdi vola Tvoja, kako je vu Nébi tak i na Zemli."
"New","40","6","11","Krüha našega vsakdenéšnjega dáj nam ga dnes."
"New","40","6","12","I odpüsti nám dugé naše, kako i mi odpüščamo dužníkom našim."
"New","40","6","13","I nevpelaj nás vu sküšávanje: nego oslôbodi nás od hüdoga. Ár je tvoje Králevstvo, i môč, i dika na veke. Amen."
"New","40","6","14","Ár, či odpüstíte lüdém prestoplenjé njihovo, odpüstí i vám Oča vaš nebeski."
"New","40","6","15","Či pa ne odpüstíte lüdém prestoplenjá njihova: ni Oča vaš ne odpüsti vám prestoplenjá vaša."
"New","40","6","16","Gda se pa postite: ne bojdte, liki skazlívci, žalostnoga obráza. Ár zgrdijo svoja lica: naj se vidijo od lüdi; kâ se postijo. Zaistino velím vam: kâ so vzeli nájem svoj."
"New","40","6","17","Ti pa, gda se postiš, namaži tvojo glavô, i líce tvoje muj."
"New","40","6","18","Naj se ne vídiš lüdém ka se postiš: nego Oči tvojemi, šteri je vu skrivnom: i Oča tvoj, ki vu skrivno gléda, povrné ti vu očivesnom."
"New","40","6","19","Ne správlajte si kinče na zemli, gde je mol i erja skvari, i gde je tatjé podkopajo i vkrádnejo."
"New","40","6","20","Správlajte si pa kinče vu Nébi: gde je ni mol, ni erja ne skvari, i gde je tatjé ne podkopajo, niti je ne vkrádnejo."
"New","40","6","21","Ár, gde je kinč vaš, tam je i srce vaše."
"New","40","6","22","Posvêt têla je okô. Záto, či bode okô tvoje prôsto, cêlo têlo tvoje svetlo bode."
"New","40","6","23","Či pa okô tvoje bode hüdo: cêlo têlo tvoje kmično bode. Či je záto tá svetlost, štera je v tebi, kmica: ta kmica kelika bode?"
"New","40","6","24","Nišče nemre dvöma Gospôdoma slüžiti. Ár ali ednoga bode odürjávao, i toga drügoga lübo, ali se k ednomi pridrüži, i toga drügoga zavrže. Ne morete Bôgi slüžiti i mammoni."
"New","40","6","25","Záto velím vám: ne skrbte se za žítek vaš, ka bodte jeli, i ka bodte pilí: niti za têlo vaše, ka bodte obláčali. Nej je žítek več, liki hrána, i têlo, liki oblečalo?"
"New","40","6","26","Glédajte na ftice nebeske: one ne sêjajo, ni ne ženjajo, niti ne správlajo vu škegnje; i dönok Oča vaš nebeski njé hráni. Nê ste ví vnogo poglavitêši od njih?"
"New","40","6","27","Što pa z vás skrblivajôč more pridati k Visokosti svojoj eden lakét?"
"New","40","6","28","I za oblečalo ka se skrbite? včite se: liliomi polski kakda rastéjo; ne delajo, ní ne predéjo."
"New","40","6","29","Velím pa vám: kâ se je ni Šalamon vu vsoj díki svojoj nê tak obláčao; kak edno z eti."
"New","40","6","30","Či pa trávo polsko, štera dnes jeste, a vütro se pa v péč vrže, Bôg tak obláča; nêli vás zvnôgim bole, maloverci?"
"New","40","6","31","Ne skrbte se tak govoréči: ka bomo jeli? i ka bomo pili? ali, ka bomo oblačali?"
"New","40","6","32","Ár vsa eta poganje spitávajo: ár zná Oča vaš nebeski, kâ ví vsa eta potrebüjete."
"New","40","6","33","Iščite pa prvo králevstvo Bože, i pravico njegovo; i eta vsa se vám privržejo."
"New","40","6","34","Ne skrbte se záto na ütrášnji dén; ár ütrášnji dén se bode skrbo za svoja. Zadosta je dnévi hüdôba njegova."
"New","40","7","1","Ne sôdte, naj se ne sôdite."
"New","40","7","2","Ár, z šterom sôdbom sôdite, z tistom bodete sodjeni: i z šterom merom mêrite, z tistom bode vám nazá merjeno."
"New","40","7","3","Ka pa glédaš trôho v ôki brata tvojega: trám pa vu tvojem ôki na pamet ne vzemeš?"
"New","40","7","4","Ali kakda práviš brati tvojemi: nihaj naj vö vržem trôho z Oká tvojega, i ovo trám je v ôki tvojem?"
"New","40","7","5","Skazlívec! vrži vö prvo trám z oká tvojega i teda pogledni; da vö vržeš trôho z Oká brate tvojega."
"New","40","7","6","Ne dájte to Svéto psom, niti ne mečte džünzdže vaše pred svinjé; naj ga gda ne zakláčijo z nogami svojimi, i vrnôče vás rastrgajo."
"New","40","7","7","Proste, i dá se vam: iščite, i nájdete: trüpajte, i odpré se vám."
"New","40","7","8","Ár vsáki, šteri prosi, vzeme; i šteri íšče, nájde; ino tomi trüpajôčemi se odpré."
"New","40","7","9","Ali što je z vás človek, šteroga či bode proso sin njegov krüha, jeli njemi kamen dá?"
"New","40","7","10","I či bode ga ribo proso, jeli njemi kačo dá?"
"New","40","7","11","Či záto ví, hüdi bodôči, znáte dobre dári dávati deci vašoj; od koga bole Oča vaš, šteri je vu nebésaj, dá dobra onim, kí ga prosijo."
"New","40","7","12","Vsa záto, šterakoli ščéte, naj vám včiníjo lidjé, tak i ví činte njim. Ár je eta Právda i Prorocke."
"New","40","7","13","Idite notri po tesni vrátaj: ár so prestrana vráta, i širôka je ta cesta, štera pela na skvárjenjé, i vnogo ji je, ki po njé hodijo."
"New","40","7","14","Ár so tesna vrátá, i vôska je ta pôt, štera pela vu žitek: i malo ji je, šteri jo nájdejo."
"New","40","7","15","Varte se pa od krívi prorokôv; šteri prihájajo k vám vu ovčeni odêvkaj, znotra so pa zgráblívi vucké."
"New","40","7","16","Z njihovoga sáda je poznate. Jeli berájo z trnja grozdje, ali z četálja fige?"
"New","40","7","17","Tak vsákše dobro drêvo dober sád prináša: lagoje drevo pa lagoji sád prináša."
"New","40","7","18","Nemore dobro drêvo hüdi sád prinášati: niti lagoje drêvo dober sád, prinášati nemore."
"New","40","7","19","Vsáko drêvo, štero ne prináša dober sád, doli se vsečé, ino se na ogen vrže."
"New","40","7","20","Záto ž njihovoga sáda je poznate."
"New","40","7","21","Nebode vsáki, kí meni právi, Gospodne! Gospodne! notri šao vu králevstvo nebesko: nego ki činí volo Očé mojega, šteri je vu nebésaj."
"New","40","7","22","Vnogo ji bode pravilo v onom dnévi! Gospodne! Gospodne! nej smo vu tvojem Iméni proroküvali, i vu tvojem Iméni vragé zganjali, ino vu tvojem Iméni zmožnosti vnôge delali?"
"New","40","7","23","I teda njim vadlüvao bodem: kâ sem vas nigdár népoznao: odídte od méne činéči neprávednost."
