Testament,Book,Chapter,Verse,Content
"New","44","5","32","I mí smo etoga svedocke z etimi rečmí, poleg toga pa i svéti Düh tüdi, šteroga je dáo Bôg têm, kí ga bôgajo."
"New","44","5","33","Oni pa eto slíšavší, prežágani so, i šteli so je vmoriti."
"New","44","5","34","Gori stanovši pa níki Farizeuš vu tanáči po iméni Gamáliel právdevučítel, pošteni pred vsêm lüdstvom, zapovedo je, naj edno malo vö pelajo apoštole."
"New","44","5","35","I erkao njim je: možjé Izraelski, pazite na sébe za volo eti lüdi, ka vám je činiti?"
"New","44","5","36","Ár pred têmi dnévi je stano Teudáš, govoréči sebé koga bidti, k šteromi se je pridrüžo veliki račun možôv okoli štiri stô, kí je prêšao; i vsi, ki so se k njemi privrgli, so raztepeni, i včinjeni so na nikoj."
"New","44","5","37","Po tom je stano Júdáš Galileánski vu dnévi spišüvanja, i obrno je poredno lüdstva za sebom; i on je prêšao, i vsi, kí so ga nasledüvali, so se raztepli."
"New","44","5","38","I zdaj, velim vám, odstôpte od tej lüdi i nihájte je. Ár, či je z lüdi té tanáč, ali tô delo, razvéže se;"
"New","44","5","39","Či je pa z Bogá, ne morete je razvézati; naj se kak prôti Bôgi bojüvajôči ne najdete."
"New","44","5","40","Bôgali so ga pa, i prizovéjo apoštole, zbíjejo je, i zapovejo njim, naj več ne gučijo vu Jezušovom iméni; i odpüstili so je."
"New","44","5","41","Oni so pa vö šli od líca správišča radüvali so se, ka so za imé njegovo vrêdni preštímani, kí bi nepoštüvani bilí."
"New","44","5","42","I nej so hênjali vsáki dén vu cérkvi, i po hižaj včiti i nazviščávati Jezuš Kristuša."
"New","44","6","1","Vu oni dnévi pa, gda bi se vučenícke povnôžali, včinjeno je mrmranje Grkov prôti Židovom: ka so zametávali vu vsakdenéšnjoj slüžbi njihove vdovice."
"New","44","6","2","Ti dvanájset ji pa prizové to vnožino vučeníkov i erčéjo: nej je vugodno, ka bi mi tá niháli Rêč Božo, i slüžili stolom."
"New","44","6","3","Glédajte záto bratje, da zíščete z vàs sedem možôv dobroga svedôstva, pune Dühá svétoga i modrôsti; štere postávimo na eto potrêbčino."
"New","44","6","4","Mí pa v molítvi i v slüžbi te rêči obstojímo."
"New","44","6","5","I priétna je bíla eta rêč pred vsov vnožinov. I odébrali so Števana, moža punoga vere i Dühá svétoga, i Filippa, i Prohora, i Nikánora, i Tímona, i Parména, i k veri obrnjenoga Antiohuškoga Mikloša."
"New","44","6","6","Té so postavili pred Apoštole, i moléči djáli so na njé roké svoje."
"New","44","6","7","I rêč Boža je rásla, i napunjávao se je račun vučeníkov vu Jerušálemi jáko. I vnogo popovskoga réda lüdstva je pokornoga bilô veri."
"New","44","6","8","Števan pa, pun vere i môči, činio je čüda i znamênja velika med lüdstvom."
"New","44","6","9","Gori so pa stanoli níki z správišča, štero se zove Libertinušov, i Cirineušov, i Aleksandriáncov, i oni, kí so z Cilície i Ážie, štükavši se z Števanom."
"New","44","6","10","I nej so mogli prôti stánoti modrôsti i Dühi, z kim je gúčao."
"New","44","6","11","Teda so podvrgli možé govoréče: čüli smo ga, kâ je prokletne rečí gúčao prôti Môšeši i Bôgi."
"New","44","6","12","I nadignoli so lüdstvo i stariše i pisáče, i pristôpivši ftrgnoli so ga, i pelali so ga vu tanáč."
"New","44","6","13","I postavili so kríve svedoke govoréče: ete človek ne hênja rečí prokletne gúčati prôti etomi svétomi mesti i právdi."
"New","44","6","14","Ár smo ga čüli gučéčega, kâ te Nazarenski Jezuš potere eto mesto i preminé návade, štere nám je dáo Môšeš."
"New","44","6","15","I na njega so glédali vsi, kí so vu tanáči sédeli, i vidili so líce njegovo, liki líce kákšega angela."
"New","44","7","1","Erkao je pa te víšešnji pop: jeli se eta tak májo?"
"New","44","7","2","On je pa erkao: možjé brátje i očeve, poslüšajte. Bôg dike se je skázao oči našemi Ábrahámi bodôčemi vu Mešopotámii prvle, liki je prebívao vu Háráni."
"New","44","7","3","I erkao njemi je: idi vö z tvoje zemlé i tvoje rodbine, ino idi vu zemlo, štero ti pokážem."
"New","44","7","4","Teda vö idôči z zemlé Haldeánske, prebívao je vu Háráni. I od tistec po smrti očé njegovoga prinesao ga je vu eto zemlo, vu šteroj ví zdaj prebívate."
"New","44","7","5","I nej njemi je dáo öročíne vu njê ni eden stopáj; nego njemi je obečao, ka njemi jo dá na ládanje, i semeni njegovomi po njem, gda je ešče nej méo siná."
"New","44","7","6","Etak je pa gúčao Bôg: ka bode semen njegovo tüho vu lückoj zemli, i pod slüžbo je vržejo, i hüdo bodo ž njim činíli štiri stô lêt."
"New","44","7","7","Ali tisto lüdstvo, šteromi bodo slüžili, bom jas sôdo, velí Bôg. I po tom bodo vö šli, i slüžili bodo meni na etom mesti."
"New","44","7","8","I dáo njemi je zákon obrizávanja. I té je porôdo Ižaáka, i obrezao ga je na ôsmi dén, i Ižaák Jákoba, i Jákob dvanájset patriárke."
"New","44","7","9","I pátriárke nevoščéni bodôči, ôdali so Jožefa vu Egiptom. Ali Bôg je bio ž njim."
"New","44","7","10","I oslôbodo ga je ze vsê nevôl njegovi, i dáo njemi je miloščo i modrôst pred Farao králom Egiptomskim; i postavo ga je voja nad Egiptomom i cêlov hižov svojov."
"New","44","7","11","Prišao je pa glád na cêlo zemlo Egiptomsko i Kánaánsko, i velika nevola; i nej so najšli hráno očeve naši."
"New","44","7","12","Gda bi pa čüo Jákob ka je silje v Egiptomi, vö je poslao očeve naše oprvič."
"New","44","7","13","I ob drügim spoznao se je Jožef od bratov svoji, i očivesni je postano Farao Králi národ Jožefov."
"New","44","7","14","Poslao je pa Jožef i prízvao je očo svojega Jákoba i vso rodbino njegovo sedemdesét i pét düš."
"New","44","7","15","Doli je pa šô Jákob vu Egiptom, i mr’o je on i naši očeve."
"New","44","7","16","I prêk so prinešeni vu Šihem, i položeni so vu grob, šteroga je küpo Ábrahám z cênov srebra od sinôv Emorra, očé Šihemovoga."
"New","44","7","17","Gda se je pa približávalo vrêmen obečanja, štero je priségno Bôg Ábrahámi, raslo je lüdstvo, i povnôžalo se je vu Egiptomi."
"New","44","7","18","Dokeč je nej stano drügi kral, kí je nej znao Jožefa."
"New","44","7","19","Té je z jálnostjov na njé vzéo naš národ; i hüdo je méo oče naše tô činéči, da so mogli svojo dečico vö dêvati, naj neživé."
"New","44","7","20","Vu šterom vrêmeni se je porôdo Môšeš; i vugoden je bio Bôgi, kí je hránjeni trí mêsece vu hiži očé svojega."
"New","44","7","21","Vö djánoga je pa gori vzéla čí Faraova, i gori ga je hránila sebi za siná."
"New","44","7","22","I vučen je Môšeš na vso modrôst Egiptáncov. Bio je pa zmožen vu rêčih i vu delaj."
"New","44","7","23","Gda bi pa štiridesét lêt vrêmena star bio, prišlo njemi je v srcé, ka bi pogledno brate svoje siní Izraelske."
"New","44","7","24","I vidôči níkoga nepravično trpeti, bráno ga je; i včino je zadomeščanjé tomi nepravično trpéčemi, doli pobivši Egiptánca."
"New","44","7","25","Štímao je pa, kâ razmijo bratje njegovi, kâ njim Bôg dá oslobodjenjé po njegovoj rôki; oni so ta nej razmeli."
"New","44","7","26","Na drügi dén se je pa pá skázao njim njefkajôčim, i správlao je je na mér govoréči: možjé, bratje ste si; zakaj činíte krivico eden drügomi?"
"New","44","7","27","Té, pa, kí je krívico činio blížnjemi, ga je kraj süno govoréči: što te je postavo poglavníka i sodca nad nami?"
"New","44","7","28","Jeli i mené ščéš bujti, liki si bujo včera Egiptánca?"
"New","44","7","29","Pobegno je záto Môšeš na eto rêč; i včinjen je tühénec vu Midiánskoj zemli, gde je porôdo dvá siná."
"New","44","7","30","I, gda bi se spunilo štiridesét lêt, skázao se je njemi vu püščávi goré Šinajske angel Gospodnov vu ščípka ognjenom plámni."
"New","44","7","31","Môšeš pa vidôči, čüdivao se je nad vidênjem. Gda bi pa on bliže šô glêdat, včinjen je glás Gospodnov k njemi:"
"New","44","7","32","Jás sem Bôg očév tvoji, Bôg Ábrahámov, i Bôg Ižaákov, i Bôg Jákobov. Prestrašivši se pa Môšeš, nej je sméo na njega glédati."
"New","44","7","33","Erkao njemi je pa Gospôd: odvéži črêvle nôg tvoji; ár mesto, na šterom stojíš, je svéta zemla."
"New","44","7","34","Vidôč sem vido nevolo lüdstva mojega vu Egiptomi, i zdühávanje njihovo sem čüo; i doli sem prišao, naj je oslobodim. I zdaj hodi i pošlem te vu Egiptom."
"New","44","7","35","Toga Môšeša, šteroga so zatájili erkôči: što te je postavo poglavníka i sodca? toga je Bôg poglavníka i osloboditela poslao po rôki angelskoj, kí se je njemi skázao vu ščípki."
"New","44","7","36","Toté je je vö spelao činéči čüda i znamênja vu zemli Egiptomskoj i vu erdéčem môrji i vu püščávi štiridesét lêt."
"New","44","7","37","Tô je tisti Môšeš, kí je pravo sinom Izraelskim: proroka vám pobüdi Gospodin Bôg vaš z brátov vaši, liki mené; tistoga poslüšajte."
"New","44","7","38","Té je, ki je bio vu správišči vu püščávi z angelom; kí njemi je gúčao na gori Šinajskoj i očém našim; kí je vzéo žíve rečí, da bi je nám dáo."
"New","44","7","39","Komi so nej šteli pokorni bidti očeve naši; nego so ga odvrgli i obrnoli so se srcom svojim vu Egiptom."
"New","44","7","40","Govorèči Aroni: napravi nám Bogé, kí bodo pred nami hodili. Ár Môšeši tistomi, kí nás je zpelao z Egiptomske zemlé, neznamo, ka se njemi je zgôdilo."
"New","44","7","41","I napravili so tele vu dnévi oni, i prípelali so áldov tomi bolvani; i veselíli so se vu delaj rôk svoji."
"New","44","7","42","Obrno se je pa Bôg, i dáo je je, da bi slüžili vojski nebeskoj, liki je písano vu prorocki knigaj: jeli ste mi zarêzana i vužgána áldüvali štiridesét lêt vu püščávi, hiža Izraelska?"
"New","44","7","43","I gori ste vzéli šator Móloka i zvêzdo Bogá vašega Remfana, te kêpe štere ste si napravili, da bi je molili. Záto prêk vás zoselim z ovkraj Babilona."
"New","44","7","44","Šator svedôstva je pa bio pri očáki naši vu püščávi, liki je zrendelüvao, kí je Môšeši gúčao, ka bi ga napravo pôleg forme, štero je vido."
"New","44","7","45","Šteroga so i notri pelali, gori ga vzévši očeve naši z Jezušom vu pogánsko ládanje; štere je vö zgono Bôg od líca očév naši notri do Dávidovi dnévov."
"New","44","7","46","Kí je najšao pred Bogom miloščo; i proso je, da bi najšao šator Jákobovomi Bôgi."
"New","44","7","47","Šalamon njemi je pa hižo pocimprao."
"New","44","7","48","Ali te náj víšešnji vu z rokami naprávleni cérkváj ne prebíva, liki prorok právi:"
"New","44","7","49","Néba je meni králevski stolec, zemla pa podnogáonica nôg moji. Kákšo hižo bodete mi cimprali, velí Gospôd. Ali štero je mesto počivanja mojega?"
"New","44","7","50","Nej je rôka moja naprávila eta vsa?"
"New","44","7","51","Trdnoga Šinjeka i neobrêzanoga srcá i vüh, vi vsigdár svétomi Dühi prôti stojíte; liki očeve vaši, tak i ví."
"New","44","7","52","Šteroga prorokov so nej preganjali očeve vaši? i vmôrili so je; ki so naprê nazviščávali od prišestjá toga pravičnoga, šteroga ste zdaj ví odávci i lüdomorci včínjeni."
"New","44","7","53","Kí ste vzéli právdo vu rédi angelov, i nej ste jo zdržali."
"New","44","7","54","Gda bi pa eta čüli, prežagala so se njim srcá, i škrípali so z zobmi na njega."
"New","44","7","55","On pa pun bodôči Dühá svétoga, gda bi vu nébo gledao, vido je díko Božo i Jezuša stojéčega na desnici Božoj."
"New","44","7","56","I erčé: ovo, vídim Nebésa odprta, i Siná človečega stojéčega na desnici Božoj."
"New","44","7","57","Kričéči pa z velikim glásom, zateknoli so vüha svoja; i sünoli so se z ednim žlakom na njega."
"New","44","7","58","I, gda bi ga z nesta vö vrgli, kamenüvali so ga. I svedocke so doli djáli gvant svoj k nogám ednoga mladénca, kí se je Šauluš zváo."
"New","44","7","59","I kamenüvali so Števana, zezávajôčega i govoréčega: Gospon Jezuš! vzemi k sebi düh moj."
"New","44","7","60","Pokleknovši pa na kôlina, kričao je z velikim glásom: Gospodne, ne postavi njim pred njéh ete grêh. I, gda bi tô erkao, záspao je."
"New","44","8","1","Šauluš je pa privolo k njegovomi vmárjanji. Včinjeno je pa vu onom dnévi veliko pregánjanje prôti správišči, štero je bilô v Jerušálemi; i vsi so razíšli po držélaj Judee i Šamárie z vün apoštolov."
"New","44","8","2","Poránili so pa Števana, možjé pobožni, i jáko so se plakali nad njim."
"New","44","8","3","Šauluš je pa opüščávao správišče od hiže do hiže idôči, i vličéči možé i žene, metao je je vu temnico."
"New","44","8","4","Kí so záto razíšli, okôli hodéči glásili so Rêč Božo."
"New","44","8","5","Filip pa, pridôči vu mesto Šamárie, predgao njim je Kristuša."
"New","44","8","6","Lüdstvo je pa z ednákov pámetjov poslüšalo ona, štera so od Filippa právlena, gda bi čüli i vidili znamênja, štera je činio."
"New","44","8","7","Ár vnôgi imajôči nečíste dühé kričéči z velikim glásom so vö šli; vnôgi pa žlakom vdárjeni i plantavi so ozdravili."
"New","44","8","8","I včinjena je radost velika vu mesti onom."
"New","44","8","9","Bio je pa niki môž po iméni Šimon, kí je pred temtoga vu onom mesti čalêro i noro lüdstvo Šamárie govoréči, ka je on nikak veliki."
"New","44","8","10","Na toga so pazili vsi od máloga notri do velikoga govoréči: ete je ta velika môč Boža."
"New","44","8","11","Pazili so pa na njega záto; ár je je poredno vrêmena z čalaríov noro."
"New","44","8","12","Gda bi pa vervali Filipi nazviščávajôčemi Evangeliom od králevstva Božega i iména Jezuš Kristušovoga, okrstili so se možjé i žene."
"New","44","8","13","Ali i Šimon je vervao, i okrstšeni držao se je Filipa; i vidôči, ka se znamênja i močí velike godìjo, strsno se je."
"New","44","8","14","Gda bi pa čüli apoštolje, kí so bilí v Jerušálemi, ka je notri vzéla Šamária rêč Božo, poslali so k njim Petra i Jánoša."
"New","44","8","15","Šteriva doli idôča molila sta za njé, da bi vzéli Düha svétoga."
"New","44","8","16","(Ár je ešče na nikoga njih nej spadno; nego samo so okrstšeni bilí vu iméni Gospon Jezuša)."
"New","44","8","17","Teda sta djála roké na njé, i vzéli so Dühá svétoga."
"New","44","8","18","Gda bi pa Šimon vido, kâ se po devanji Apoštolski rôk svéti Düh dáva, ponüjao njim je pêneze."
"New","44","8","19","Govoréči: dájte i meni tô oblást; da, na kogakoli položim rokè, vzeme Dühà švètoga"
"New","44","8","20","Peter njemi pa erčé: srebro tvoje ti naj s tebom bode na pogübelnost; kâ štímaš, ka se Boži dàr za pêneze láda."
"New","44","8","21","Nemaš tí tála niti šorša vu etoj rêči; ár je tvoje srcé nej ednáko pred Bogom."
"New","44","8","22","Povrni se záto od ete tvoje hüdôbe i moli Bogá, či se ti kak odpüstí srcà tvojega mišlênje."
"New","44","8","23","Ár te vídim, ka si vu britkosti žúča i nepravičnosti vezali."
"New","44","8","24","Odgovoréči pa Šimon erčé: molte se ví za méne k Gospodni, naj nikaj ne príde na mé z toga, štera ste pravili."
"New","44","8","25","Oni záto, gda bi svedočili i gúčali rêč Gospodnovo, povrnoli so se v Jerušálem, i nazviščávali so Evangeliom po vnôgi Šamaritánski vesnicaj."
"New","44","8","26","Gúčao je pa angel Gospodnov Filipi, govoréči: stani gori, i idi k pôldnévi na pôt, štera doli ide od Jerušálema v Gázo, tá je püsta."
"New","44","8","27","I gori stanovši, šô je. I ovo eden môž Črnkavec vkopleni i Kandaceše, Črnkavcov Kralíce, kamurnik, kí je bio postávleni nad vsêmi njé kinči, prišao je Bogá molit v Jerušálem."
"New","44","8","28","I vu nazáj povrnenjê bodôči i sedéči na kôli svoji, čtéo je Ežaiáš proroka."
"New","44","8","29","Erkao je pa Düh Filipi: pristôpi i pridrüži se k têm kôlam."
"New","44","8","30","Pribêžavši pa Filip čüo ga je, kâ je čtéo Ežaiáš proroka, i erčé: jeli razmíš, ka čtéš?"
"New","44","8","31","On pa erčé: kak bi mogao, nego či bi mi što kázao? I zváo je Filipa, ka bi gori šô i k njemi bi si seo."
"New","44","8","32","Tál pa toga písma, štero je čtéo, je ete bio, liki ovca na zarizávanje, je pelani; i, liki ágnec pred brijáčom svojim neglasni, tak je nej ôdpro vüst svoji."
"New","44","8","33","Vu njegovoj poníznosti je zvíšena sôdba njegova; rod pa njegov što pôvej vö? Ár se vzeme od zemlé žítek njegov."
"New","44","8","34","Odgovoréči pa kamurnik Filipi, erčé: prosim te, od koga právi tô prorok? od sébe, ali od koga drügoga?"
"New","44","8","35","Odpré pa Filip vüsta svoja, i začnovši od toga písma nazviščávao njemi je Jezuša."
"New","44","8","36","Gda bi pa šli po pôti, prišli so k nikšoj vodi; i erčé kamurnik: ovo je voda; što mi prepovê, naj se ne okrstim?"
"New","44","8","37","Erčé pa Filip: či verješ ze vsega srcá, more bidti. Odgovoréči pa erčé: verjem, kâ je Jezuš Kristuš Sin Boži."
"New","44","8","38","I zapovedao je postánoti kôlam. I doli sta šla obá vu vodô, i Filip i kamurnik, i okrsto ga je."
"New","44","8","39","Gda bi pa vö šla z vodé, Düh Gospodnov je vnesao Filipa, i nej ga je vido več te kamurnik. Šô je pa po pôti svojoj z radostjov."
"New","44","8","40","Filip je pa nájdeni vu Azoti; i okôli hodéči nazviščávao je Evangeliom vsêm mêstam, dokeč je prišao vu Cezário."
"New","44","9","1","Šauluš pa ešče píhávši pritjé i lüdomorstvo na vučeníke Gospodnove, odidôči k víšešnjemi popi,"
"New","44","9","2","Proso je od njega listí vu Damaškuš k správiščam, kâ, či bi koga najšao, kí bi té pôti bilí, možé i žene, zvézane bi pelao v Jerušálem."
"New","44","9","3","Zgôdilo se je pa, gda bi šô, i približávao bi se k Damaškuši, na nágli se je zblesnola okôli njega svetlost od nébe."
"New","44","9","4","I spadnovši na zemlo, čüo je glás njemi govoréči: Šaul, Šaul, ka me pregánjaš?"
"New","44","9","5","On pa erčé: što si, Gospodne? Erčé pa Gospôd: jas sem Jezuš, šteroga tí pregánjaš. Žmetno ti je prôti spici brsati."
"New","44","9","6","Drgečéči pa i trepečéči erčé: Gospodne, ka ščéš, naj činim? I Gospôd njemi erčé: gori stani, i idi vu mêsto, i povej se ti, ka ti je potrêbno činiti."
"New","44","9","7","Ti možjé pa, ki so ž njim pôtniküvali, so stáli drevéni, ár so čüli glás; nikoga so pa nej vidili."
"New","44","9","8","Gori je pa stano Šauluš od zemlé: i, gda bi očí svoje ôdpro, nikoga nej je vido. Pelavši ga pa za rókô, notri so ga pelali v Damaškuš."
"New","44","9","9","I bio je trí dní ne vidôči; i nej je jo, ni pio."
"New","44","9","10","Bio je pa eden vučeník v Damaškuši po iméni Anániáš; i erkao njemi je Gospôd vu poglédi: Anániáš! on pa erčé: ovo sem jas, Gospodne."
"New","44","9","11","Gospôd njemi pa erčé: stani gori i idi vu vilico, štera se zové rávna; i íšči vu Júdášovoj hiži Šauluša po iméni Taršinskoga, ár ovo moli."
"New","44","9","12","(I vido je Pavel vu vidênji ednoga možá po iméni Anániáša notri idôčega i na sébe rókô dêvajôčega; naj preglédne.)"
"New","44","9","13","Odgovorí pa Anániáš: Gospodne, čüo sem od vnôgi od toga možá, keliko hüdoga je včíno tvojim svétim vu Jerušálemi."
"New","44","9","14","I eti má oblást od víšešnji popov zvézati vse, kí tvoje imé zezávajo."
"New","44","9","15","Erkao njemi je pa Gospôd: idi, ár mi je on odebrána posôda; kí bode noso imé moje pred poganmi, i králmi i sinmi Izraelskimi."
"New","44","9","16","Ár njemi jas pokážem, keliko njemi je potrêbno za volo iména mojega trpeti."
"New","44","9","17","Odíšao je pa Anániáš, i notrí je šô vu hižo, i na njega položi roké i erčé: Šaul brat, Gospôd me je poslao (Jezuš, kí se ti je skázao na pôti, po šteroj si šô,) naj preglédneš i napuniš se z Dühom svétim."
"New","44","9","18","I preci so doli spadnole z ôči njegovi, líki lüske; i pregledno je preci, i gori stanovši okrsto se je."
"New","44","9","19","I, gda bi hráno k sebi vzéo, pokrêpo se je. Bio je pa Šaul z vučeníkmi vu Damaškuši nikeliko dní."
"New","44","9","20","I preci je vu správiščaj predgao Kristuša, ka je on Sin Boži."
"New","44","9","21","Strsnoli so se pa vsi, kí so ga čüli, i erkli so: nej je tô té, kí je opüščávao vu Jerušálemi one, kí se z etim iménom zovéjo? I esi je za toga volo prišao, ka bi je zvézane pelao k vládnikom popovskim."
"New","44","9","22","Šauluš je pa ešče bole pokrêpo, i stiskávao je Židove prebívajôče vu Damaškuši svedočéči, ka je té Kristuš."
"New","44","9","23","Gda bi se pa poredno dnévov spunilo, tanáč so držali Židovje med sebom, ka bi ga bujli."
"New","44","9","24","Na zvêst je pa dáni Šauluši tanáč njihov i strážili so vráta dén i nôč, da bi ga bujli."
"New","44","9","25","Vučenícke so ga pa vzéli v nôči, i prêk zída so ga djáli i doli so ga püstili vu korbli."
"New","44","9","26","Gda bi pa Šauluš vu Jerušálem prišao, sküšávao se je pridrüžiti k vučeníkom; i vsi so se ga bojali ne vervavši, ka bi vučeník bio."
"New","44","9","27","Barnabáš ga je pa k sebi vzéo, i pelao ga je k apoštolom; i pripovidávao njim je, kakda je na pôti vido Gospodna, i kâ njemi je gúčao, i kakda je vu Damaškuši srčno gúčao vu iméni Jezušovom."
"New","44","9","28","I ž njimi je bio notri idôči i vö idôči v Jerušálemi, i srčno gučéči vu Gospon Jezušovom iméni."
"New","44","9","29","Gúčao je pa i štükao se je prôti Grkom; oni so ga pa šteli bujti."
"New","44","9","30","Štero gda bi zvedili bratje, doli so ga pelali v Cezário, i odposlali so ga vu Taršuš."
"New","44","9","31","I tak so gmajne po vsoj Judei i Galilei i Šamárii mér mele, povékšávajôče se, i hodéče vu bojaznosti Gospodnovoj, i z trôštom Düha svétoga so se napunjávale."
"New","44","9","32","Zgôdilo se je pa, gda bi Peter hodo po mêstaj, prišao je i k tim svétim prebivajôčim vu Liddi."
"New","44","9","33","Najšao je pa tam ednoga človeka po iméni Eneáša, od osem lêt ležéčega na posteli, kí je bio žlakom vdárjeni."
"New","44","9","34","I erkao njemi je Peter: Eneáš, zvráči te Jezuš Kristuš; stani gori, i posteli si sám. I preci je gori stano."
"New","44","9","35","I vidili so ga vsi stojéči vu Liddi i v Šároni, kí so se povrnoli k Gospodni."
"New","44","9","36","Vu Joppi je pa bíla níka vučeníca po iméni Tabita, štera razkládjena se zové Dorkaš. Tá je bíla puna dobri dêl i álmoštva, štera je činíla."
"New","44","9","37","Prigôdilo se je pa vu dnévi oni, gda bi nemočna bila, mrla je. Geto so jo pa ôprali, položili so jo vu zgoránjo hižo."
"New","44","9","38","Blüzi je pa bíla Lidda k Joppi; i vučenícke slíšavši, ka je Peter v njê, poslali so dvá možá k njemi, proséči ga, naj njemi ne bode žmetno k njim prêk prídti."
"New","44","9","39","Gori stanovši pa Peter, šô je ž njimi. Šteri, gda bi prišao, gori so ga pelali vu zgoránjo hižo, i okôli njega so postanole vse vdovice jôkajôče i kàzajôče süknje i srakice štere je delala, gda je ž njimi bíla, Dorkaš."
"New","44","9","40","Vö zgonivši pa Peter vse, pokleknovši na kôlina, molo je; i obrnovši se k têli erčé: Tabita, gori stani. Ona je pa odprla očí svoje; i vidôča Petra, gori je sêla."
"New","44","9","41","Šteroj pa da bi rokô dáo, gori jo je oprávo; i prizvavši te svéte i vdovice, postavo jo je pred njé živôčo."
"New","44","9","42","Na znánje je pa včinjeno tô po celoj Joppi, i vnôgi so vervali vu Gospodni."
"New","44","9","43","Zgôdilo se je pa, da bi poredno dní ostano vu Joppi pri níkom Šimoni kožári."
"New","44","10","1","Bio je pa eden môž vu Cezárii po iméni Korneliuš stotnik z onoga šerega, ki se zové Vlaški."
"New","44","10","2","Pobožen i Bogá bojéči ze vsov hižov svojov, i činéči álmoštva vnôga lüdstvi, i moléči Bogá vseskôs."
"New","44","10","3","Vido je vu vidênji očivesno, liki okoli devéte vöre dnéva, angela Božega doli idôčega k sebi, i govoréčega njemi: Korneli!"
"New","44","10","4","On pa na njega gledôči, prestrašo se je i erčé: ka je Gospodne? erčé pa njemi: molítve tvoje i álmoštva tvoja so gori prišla na spomínanje pred Bogá."
"New","44","10","5","I zdaj pošli vu Joppo možé i zovi prêk Šimona, kí se zové Peter."
"New","44","10","6","Té stán má pri nikom Šimoni kožári, kí má hižo pôleg môrja; té ti povej, ka ti je činiti."
"New","44","10","7","Gda bi pa odíšao angel, kí je Korneliuši gúčao, prizové dvá z držine svoje i ednoga pobožnoga vitéza z tisti, kí so se pri njem držali."
"New","44","10","8","I geto njim je vsa vö povedao, odposlao je je vu Joppo."
"New","44","10","9","Drügi dén pa idôči oni po pôti i k mesti se približávajôči, gori je šô Peter na hižo molit okôli šéste vöre."
"New","44","10","10","Gda bi pa lačen grátao i šteo bi jesti, dokeč so oni obed priprávlali, spadno je na njega sas."
"New","44","10","11","I vido je nébo odprto, i doli idôčo k sebi edno posôdo, liki kákši lelahen veliki na štiri kiklê zvézani i doli püščeni na zemlo."
"New","44","10","12","Vu kom so bilé vse stvári zemelske štiri nogé majôče, i zviríne, i lazéče i letajôče stvári nebeske."
"New","44","10","13","I včinjeni je glás k njemi: gori stani, Peter, koli i jej."
