Testament,Book,Chapter,Verse,Content
"New","41","14","40","Wahdé per tarret, disti padá wáb ant. Áyáni chamm rohézag o wábénag atant o nazántesh áiá ché passaw bedayant."
"New","41","14","41","Sayomi randá, padá moridáni kerrá átk o gwashti: “Angat ham waptag o árám kanagá ét? Bass ent! Á wahd o sáhat rasetag. Nun Ensánay Chokk dróhag o gonahkáráni dastá dayaga bit."
"New","41","14","42","Pád áét berawén! Á ke maná dróhit, pédák ent.”"
"New","41","14","43","Issá angat habará at ke cha dwázdahén moridán yakké, bezán Yahudá, átk o raset. Áiá rombé mardom hamráh at ke zahm o latthesh gón at. É romb, cha mazanén dini péshwá, Sharyatay zánóger o kawmay kamásháni némagá ráh dayag butagat."
"New","41","14","44","Yahudáyá áyáná é nesháni dátagat: “Hamáiá ke mana chokkán, Issá hamá ent. Áiá dazgir kanét o gón mohr o mohkamén negahpánié bebarét.”"
"New","41","14","45","Gorhá, Yahudá tachkátachk Issáay kerrá átk o gwashti: “Oo ostád!” Randá, Issái chokket."
"New","41","14","46","Yahudáay hamráhán Issá gept o dazgir kort."
"New","41","14","47","Cha Issáay hamráhán yakkéá wati zahm kasshet o masterén dini péshwáay nawkaray sará orosh bort o áiay góshi sest."
"New","41","14","48","Issáyá gón hamá mardomán ke áiay dazgir kanagá átkagatant, gwasht: “Záná, man yági o rahzané án ke gón zahm o latthán pa mani geragá átkagét?"
"New","41","14","49","Man har róch, shomay démá mazanén parasteshgáhá tálim dátag o shomá maná nageptag. Bale Pákén Ketábáni habar báyad ent sarjam bebant.”"
"New","41","14","50","Á wahdi, moridán á yalah dát o jestant."
"New","41","14","51","Warnáé ke lilomén jámagé gwará ati o bass, Issáay randá gón kapt, áesh ham gept."
"New","41","14","52","Bale dazgir kanagay wahdá, áiay jámag lakosht o á jándará tatk."
"New","41","14","53","Issáay dazgir kanókán, Issá zort o masterén dini péshwáay kerrá bort, hamódá é dega mazanén dini péshwá, kawmay kamásh o Sharyatay zánóger mocch atant."
"New","41","14","54","Petros ham dur durá Issáay randá rawán at, masterén dini péshwáay lógay péshgáhá potert o gón hezmatkárán ásay kerrá nesht o dastáni tápagá lagget."
"New","41","14","55","Mazanén dini péshwá o sarókáni diwánay sajjahén básk, pa Issáay markay sezá dayagá sháhediay shóházá atant, bale sháhed néstat."
"New","41","14","56","Bázénéá, drógén sháhedi dát, bale áyáni habar gón yakdomiá yakk o hamdap naatant."
"New","41","14","57","Dega lahtén, pa drógén sháhedi dayagá pád átk o gwashtesh:"
"New","41","14","58","“Má eshkotag ke é mardá gwashtag: ‘Man ensánay addh kortagén é mazanén parasteshgáhá karóján o próshán o say róchay tahá yakké bandán ke ensánay jórhéntagéna nabit.’”"
"New","41","14","59","Bale á sháhedáni habar ham yakk dhawlá naatant."
"New","41","14","60","Masterén dini péshwá pád átk o sajjahénáni démá cha Issáyá josti kort: “Tai bárawá chónén sháhedi dayagá ant? Esháni hecch passawa nadayay?”"
"New","41","14","61","Bale Issá bétawár at o hecch passawé nadáti. Masterén dini péshwáyá padá cha áiá jost kort o gwashti: “Taw hamá Masih, mazanshánén Hodáay Chokk ay?!”"
"New","41","14","62","Issáyá passaw dát: “Man Hamá Án, shomá yakk róché gendét ke Ensánay Chokk, zóráwarén Hodáay rástén némagá neshtag. Cha ásmánay jambaráni tahá ham kayt.”"
"New","41","14","63","Masterén dini péshwáyá wati gwaray jámag dert o gwashti: “Angat ham márá sháhed pakár ent?"
"New","41","14","64","Shomá wat eshiay kopr eshkot. Nun shomay shawr o saláh ché ent?” Sajjahénán darráént: “Eshiay sezá mark ent.”"
"New","41","14","65","Cha áyán lahténá, Issáay dap o démá tokk jat, áiay chammesh bastant, mosht o shahmátesh jat o gwashtesh: “Nun paygambari kan!” Sepáhigán, á gept o gón latth o shahmátán mán bast."
"New","41","14","66","Á wahdá ke Petros, jahlá, péshgáhá neshtagat, cha masterén dini péshwáay móledán yakké átk."
"New","41","14","67","Petrosi dist ke ásay démá neshtag o watá garm kanagá ent. Áiay némagá rogurogu cháret o gwashti: “Taw ham Issá Náseriay hamráh butagay!”"
"New","41","14","68","Bale áiá namannet o gwashti: “Na, mana nazánán o sarpada nabán ke taw ché gwashagá ay.” Gón é habará, dém pa darwázagá rahádag but. Hamé damáná korósá báng dát."
"New","41","14","69","Á móledá yakk baré padá Petros dist o gón áyán ke ódá óshtátagatant, gwashti: “É mard ham cha hamáyán ent!”"
"New","41","14","70","Bale Petrosá padá namannet. Kammé randterá, á ke ódá óshtátagatant, padá gón Petrosá gwashtesh: “Allamá taw cha hamáyán ay, chéá ke taw ham Jalilié ay.”"
"New","41","14","71","Bale Petrosá sawgend wárt o gwasht: “Mani sará Hodáay nálat bát agan dróg bebandán. É mardá ke shomá gwashét, mania nazánán.”"
"New","41","14","72","Hamé damáná korósá domi báng dát. Nun Petros, Issáay hamá habaray yátá kapt ke gwashtagati: “Cha korósay domi bángá pésar, say randá mani pajjáh áragá enkára kanay.” Nun delranj but o sakk gréti."
"New","41","15","1","Sabáhá máhallah mazanén dini péshwá, kawmay kamásh, Sharyatay zánóger o sarókáni diwánay sajjahén básk hamshawr butant o Issáesh bast, gerrán kort o Pilátusay dastá dát."
"New","41","15","2","Pilátusá cha áiá jost kort: “Taw Yahudiáni bádsháh ay?” Issáyá passaw dát: “Taw wat gwashagá ay.”"
"New","41","15","3","Mazanén dini péshwá áiay sará bázén bohtám janagá atant."
"New","41","15","4","Pilátusá padá jost kort: “Pa ché passawa nadayay? Bechár tai sará chinchok bohtám janagá ant.”"
"New","41","15","5","Issáyá hecch passaw nadát. Pilátus hayrán mant."
"New","41","15","6","Pilátusá, har sál aiday wahdá, cha Yahudi bandigán yakké, hamá ke mardomán belóthetén, ázáta kort."
"New","41","15","7","Bandigáni tahá Bárábás námén mardé hastat. Gón hamá áshópián gerag butagat ke shóreshay wahdá hón o kóshesh kortagat."
"New","41","15","8","Mardom, Pilátusay kerrá átkant, dazbandiesh kort o gwashtesh: “Har dábá ke taw gwastagén sálán kortag, embari ham hamá dábá bekan.”"
"New","41","15","9","Pilátusá jost kort: “Shomá lóthét ke Yahudiáni bádsháhá pa shomá ázát bekanán?”"
"New","41","15","10","Áiá zántagat ke dini péshwáyán, Issá pa hasadd o konnat áiay dastá dátag. Paméshká chosh gwashti."
"New","41","15","11","Bale dini péshwáyán mardom shórént o áshopéntant tán cha Pilátusá Issáay badalá, Bárábásay ázátiá belóthant."
"New","41","15","12","Pilátusá padá jost kort: “Gorhá é mardá ke shomá áiá Yahudiáni bádsháha gwashét, chón kanán?”"
"New","41","15","13","Mardomán kukkár kort: “ Salibi kassh!”"
"New","41","15","14","Pilátusá jost kort: “Chéá bárén? Mayári ché ent?” Bale áyán géshter kukkár kort: “Salibi kassh!”"
"New","41","15","15","Gorhá Pilátusá, ke lótheti mardomán cha wat razá bekant, Bárábás ázát kort o Issá, shallák janáént o dáti ke salibay sará bedranjanti."
"New","41","15","16","Sepáhigán, Issá wáliay kóth o márhiay péshgáhá bort o sepáhigáni sajjahén lashkar lóthet o mocch kort."
"New","41","15","17","Áyán, bádsháhi jamurangén kabáhé Issáay gwará dát, cha dhangar o konthagán tájé jórhént o áiay sará ér kort."
"New","41","15","18","Gón kalág o rishkandé, sharap o ezzat dát o gwashtesh: “Salám o drót, o Yahudiáni bádsháh!”"
"New","41","15","19","Latthesh sará jat, dap o démá tokk jat o sojdahesh kort."
"New","41","15","20","Wahdé kalág o malandhesh hallént, gwaray jamurangén kabáhesh kasshet o áiay jenday godesh padá gwará dátant. Randá, dém pa salib kasshagá bortesh."
"New","41","15","21","Hamá wahdá, Keriniay shahray Shamun námén mardé, ke Eskandar o Ruposay pet at, cha keshárán dém pa shahrá áyagá distesh. Sepáhigán pa bigár gept ke Issáay salibá baddhá bekant."
"New","41","15","22","Áyán, Issá hamá jágahá áwort ke námi “Joljotá” bezán “Kámpól” ent."
"New","41","15","23","Gorhá, sharábesh morr mán kort o pa waragá dát, bale Issáyá nawárt."
"New","41","15","24","Nun salibay sará dratkesh, pocch o póshákesh watmánwatá bahr kortant o shartesh bast ke bárén kayá ché rasit."
"New","41","15","25","Sohbay wahd at ke Issáesh salib kasshet."
"New","41","15","26","Mayárnámagay sará pa áiay jorm o mayárá chosh nebeshtagat: “Yahudiáni bádsháh.”"
"New","41","15","27","Issáay hamráhiá do yági o dozzesh ham salibay sará dratk, yakké rástén o domi chappén némagá."
"New","41","15","28","É dhawlá, Pákén Ketábay hamá péshgói sarjam but ke gwashit: Á cha radkárán zánag but."
"New","41","15","29","Rahgwazán dozhmán dayán, wati sar chandhént o gwashtesh: “Oo mazanén parasteshgáhay karójók ke gwashtaget: ‘Say róchá padá áiá addha kanán’!"
"New","41","15","30","Nun watá berakkén o cha salibá ér á!”"
"New","41","15","31","Hamé paymá mazanén dini péshwá o Sharyatay zánóger rishkand o maskará kanagá atant o gwashtesh: “Á dega mardomi rakkéntant bale watá rakkénta nakant."
"New","41","15","32","Bell ke Masih, Esráilay bádsháh, nun cha salibá ér bekapit tánke má begendén o báwar bekanén.” Á doén ham ke gón áiá dár kasshag butagatant, Issáyá bad o rad gwashagá atant."
"New","41","15","33","Némróchá beger tán bégáhay sayá, sajjahén molk anágat tahár but."
"New","41","15","34","Bégáhay sáhat sayá, Issáyá chihál jat: “Elui, Elui, lemá sabakktani?” (Bezán: Oo mani Hodá, oo mani Hodá! Taw chéá maná tahná esht?)"
"New","41","15","35","Ódá nazzikká, lahtén óshtátagén mardomá wahdé eshkot, gwashtesh: “Bechárét, Elyásá tawár kanagá ent.”"
"New","41","15","36","Cha áyán yakké tacháná shot, espanjé zort o tropshén sharábá missénti. Espanji dáréay sará bast o pa chussagá Issáay némagá shahárt o gwashti: “Sabr kanét, bechárén bárén Elyás eshiay rakkénagá kayt yá na?”"
"New","41","15","37","Gorhá, Issáyá borzén tawáréá chihál kasshet o sáh dát."
"New","41","15","38","Hamé wahdá, mazanén parasteshgáhay pardah, borzádá beger tán jahlád dert o do bahr but."
"New","41","15","39","Hamá pawji apsar ke Issáay dém pa démá óshtátagat, wahdé disti ke áiá chón sáh dát, gorhá gwashti: “Béshakk é mard Hodáay Chokk at.”"
"New","41","15","40","Lahtén janén dur óshtátag o cháragá at, gón áyán, Maryam Majdaliah, kasánén Ákub o Yusháay mát Maryam o Sálumah gón atant."
"New","41","15","41","Wahdé Issá Jalilá at, é janén áiay hamráh atant o áiay hezmat o cholópagesh kortagat. Abéd cha eshán, dega bázén janéné ham ódá at ke áiay hamráhiá Urshalimá átkagatant."
"New","41","15","42","Á róch, Jomahay róch at o mardom, pa Shabbatay róchay árám kanagá, watá tayár kanagá atant."
"New","41","15","43","Issop námén mardé ke Arimátiáay shahray nendók at, sarókáni diwánay ezzatmandén báské at o wat ham Hodáay bádsháhiay rahchár o wadárig at. Jomahay bégáhá Pilátusay kerrá shot o gón bahádorri o deléri, Issáay jónay baragay ejázati lóthet."
"New","41","15","44","Wahdé Pilátus sahig but Issá chó zutt mortag, hayrán o habakkah mant o pawjiáni masteri lóthet tán bezánt ke Issá mortag yá na?"
"New","41","15","45","Pawjiáni masteray sajjahén hál o habaráni eshkonagá rand, Issáay jónay baragay ejázati dát."
"New","41","15","46","Issopá, lilomén godé bahá gept o áwort, áiay jón cha salibá ér gétk o hamá goday tahá kapan kort. Kabréay tahá ke cha pésará cha talárá tráshag o tayár kanag butagat, Issái kabr kort o mazanén dhóké léth dayáná kabray dapá ér kort."
"New","41","15","47","Maryam Majdaliah o Yusháay mát Maryam, har doénán dist ke áesh kojá kall kort."
"New","41","16","1","Wahdé Shabbatay róch halás but, Maryam Majdaliah, Ákubay mát Maryam o Sálumahá, washbóén dáru gept ke Issáay jóná charp kanant."
"New","41","16","2","Yakshambehay bámgwáhá, dém pa Issáay kabrá shotant."
"New","41","16","3","Ráhá, watmánwat habar kanagá atant ke “Bárén, kabray dapay dhóká kay pa má léthénit o dura kant?”"
"New","41","16","4","Bale wahdé nazzikk rasetant distesh dhók, ke sakk mazan at, léthénag butag."
"New","41","16","5","Kabrá ke potertant, distesh ke rástén némagá yakk espétpóshén warnáé neshtag. Cha áiay gendagá, sakk hayrán o habakkah mantant."
"New","41","16","6","Warnáyá gwasht: “Matorsét, shomá Issá Náseriay shóházá ét ke salib kasshag butag. Á zendag butag, jáhi jatag o edá naent. Bechárét, é hamá jágah ent ke edá áiay jón ér at."
"New","41","16","7","Nun shomá berawét, Petros o á dega moridán sahig kanét ke Issá cha shomá pésar, Jalilá rawt. Anchosh ke wat shomárá gwashtagati, hamódá áiá gendét.”"
"New","41","16","8","Janén dar átk o cha kabray sará jestant. Á cha torsá larzag o drahagá atant. Paméshká, gón hechkasá habaresh nakort."
"New","41","16","9","Yakshambehay sabáhá máhallah, cha wati jáh janagá rand, Issá cha sajjahénán pésar, Maryam Majdaliahay démá paddar but. É hamá Maryam ent ke Issáyá cha áiá hapt jenn kasshetagat."
"New","41","16","10","Á shot o hamáyáná háli dát ke Issáay hamráh butagatant o nun gréwán o mótk árán atant."
"New","41","16","11","Bale wahdé áyán é habar eshkot ke Issá zendag butag o Maryamá distag, báwaresh nakort."
"New","41","16","12","Randá, Issá dega shekl o dróshoméá, do moriday démá záher but ke dém pa yakk kallagéá rawagá atant."
"New","41","16","13","Á, padá átkant o é dega moridesh hál dátant, bale áyán ham báwar nakort."
"New","41","16","14","Randá, Issá wati yázdahén moridáni démá, hamá wahdá átk o záher but ke warák waragá atant. Issáyá, pa áyáni kambáwari o sengdeliá, á mayárig kortant chéá ke á mardománi habaresh báwar nakortagat ke Issáesh cha jáh janagá rand distagat."
"New","41","16","15","Gón áyán gwashti: “Shomá donyáay sajjahén kawmáni kerrá berawét o wasshén mestágá sar kanét."
"New","41","16","16","Harkas ke mani sará báwara kant o pákshódia kant, á rakkit. Bale kasé ke mani sará báwara nakant, mayáriga bit."
"New","41","16","17","Báwarmandán, é nesháni góna bant: mani námay sará, jennán cha mardomána kasshant, nók nókén zobánán habara kanant,"
"New","41","16","18","márán pa dasta gerant o agan zahrnákén chizz ham bwarant, áyán hecch parwáha nabit. Gón báwarmandáni dast per moshagá, nádráh wassh o dráha bant.”"
"New","41","16","19","Anchosh ke Hodáwandén Issáyá gón áyán wati habar halás kortant, ásmáná barag but o Hodáay rástén némagá nesht."
"New","41","16","20","Morid, pa áiay mestágay sheng o tálán kanagá, har molk o shahrá shotant o Hodáwand ham áyáni hamráh at o gón bázén mójezah o ajabbatén neshánián, wati habaráni barhakkii rást o paddar kort."
"New","42","1","1","Sharapdárén wájah Tiupilos! Anchén sargwast may nyámá sarjam butagant ke Enjilay awali hezmatkárán cha bongéjá, hamé sargwast gón wati chammán distagant o randá pa má raséntagant. Bázénéá áyáni bárawá nebeshtag o annun man johlánkén patth o pólé kortag o pa wat gehter distag ke áyán pa taw gón sharrén red o bandé benebisán,"
"New","42","1","2",""
"New","42","1","3",""
"New","42","1","4","tán hamá tálim ke taw geptagant, áyáni rástiay bárawá tai báwar mohr o mohkamter bebit."
"New","42","1","5","Yahudiahay damagay bádsháh Hirudisay zamánagá, Zakaryá námén dini péshwáé hastat ke cha Abiáay dini péshwáyáni thóliá at. Áiay jan, cha Hárunay nasl o padréchá at o námi Elizábet at."
"New","42","1","6","Á, har doén, Hodáay chamm o nezará nék o pahrézkár atant o Hodáwanday sajjahén hokm o rahbandáni sará pa bémayári zendesha gwázént."
"New","42","1","7","Bale chokkesh néstat, chéá ke Elizábet santh o béchokk at o doénáni omr ham mazan at."
"New","42","1","8","Yakk randé ke hezmatkáriay bárig pa Zakaryáay thóliá kapt o á, Hodáay bárgáhá dini péshwái kanagá at,"
"New","42","1","9","gón dini péshwáiay rahbandáni randgiriá, Zakaryá pálay sará gechén kanag but ke á, Hodáwanday mazanén parasteshgáhá berawt o sóchoki dutt bedant."
"New","42","1","10","Wahdé Zakaryá sóchoki dutt dayagá at, é dega sajjahén mardom dhanná dwá kanagá atant."
"New","42","1","11","Anágat, Hodáwanday préshtagé, bósóchi korbánjáhay rástén némagá, Zakaryáay démá záher but."
"New","42","1","12","Gón préshtagay gendagá, Zakaryá bah mant o áiay jesm o jáná torsé kapt."
"New","42","1","13","Bale préshtagá gón áiá gwasht: “Oo Zakaryá! Mators. Tai dwá mannag but, tai jan Elizábet mardénchokkéay sará chellaga bit o báyad ent taw áiay námá Yahyá bekanay."
"New","42","1","14","Á, pa taw shádehi o wasshia kárit o cha áiay butená bázéné ham shádána bit,"
"New","42","1","15","chéá ke á, Hodáwanday chammán mazanén mardomé bit. Nabáyad ent sharáb o dega hanósh o bésár kanókén chizzán dap per bekant o bwárt. Á, mátay lápá cha Hodáay Pákén Ruhá porra bit."
"New","42","1","16","Bázén Bani Esráiliáni delán dém pa Hodáwandá tarrénit, ke áyáni Hodá ent."
"New","42","1","17","Á, gón Elyás nabiay ruh o kodratá, cha Hodáwandá pésara kayt, tánke petáni delán chokkáni némagá betarrénit o namannókán ham pahrézkáráni hekmatay némagá chahr bedant, tánke pa Hodáwandá kawmé tayár bekant.”"
"New","42","1","18","Zakaryáyá cha préshtagá jost kort: “Eshiá chón bezánán o báwar bekanán? Man pir án o mani jan ham mazanomr ent.”"
"New","42","1","19","Préshtagá passaw dát: “Man Jebráil án o Hodáay bárgáhá óshtók án. Annun rawán dayag butagán, gón taw habar bekanán o tará é mestágá bedayán."
"New","42","1","20","É wahdá, nun taw lell o gonga bay o tán á róchá ke é habaráni rásti allama bit, habar korta nakanay. Chéá ke taw, mani é habar ke kawl dátagén wahdá rást o paddara bant báwar nakortant.”"
"New","42","1","21","Hamé wahdá, mardom dhanná Zakaryáay entezár o wadárá atant. Hayrán atant ke á chéá mazanén parasteshgáhá inkadar mahtal butagat."
"New","42","1","22","Wahdé Zakaryá dhanná dar átk, áiá gón mardomán habar kort nakort. Gorhá zántesh áiá parasteshgáhá elhámé rasetag o shobéné distagi. Chéá ke áiá gón mardomán esháraha kort o habar kanagay wáki néstat."
"New","42","1","23","Zakaryá cha hezmatkáriay halásiá rand, wati lógá per tarret."
"New","42","1","24","Chizzé wahdá rand, áiay jan, Elizábetá chokkéay ométwári but o tán panch máhá, démgir but o cha lógá dara nakapt."
"New","42","1","25","Áiá gón wat gwasht: “Hodáwandá pa man choshén káré kortag, é róchán wati mehri mani sará gwáréntag o mardománi chammá é kamezzatii cha man dur kortag.”"
"New","42","1","26","Shashomi máhá, Hodáyá wati préshtag Jebráil, Jalilay damagay shahr Náserahá, Maryam námén neshtagén jenekkéay kerrá ráh dát ke áiay sáng gón Issop námén mardéá butagat. Issop, cha Dáuday nasl o padréchá at."
"New","42","1","27",""
"New","42","1","28","Préshtag, Maryamay kerrá átk o gwashti: “Gal o shádán bay ke Hodáay nékén wáhagay sáhegá ay o Hodáwand gón taw gón ent.”"
"New","42","1","29","Cha é habaray eshkonagá, Maryam báz paréshán but o delá gwashti: “Bárén, é dhawlén hál o hawál kanagay máná ché ent?!”"
"New","42","1","30","Préshtagá gwasht: “Oo Maryam! Mators, chéá ke Hodáay mehr o rahmat tai hamráh ent."
"New","42","1","31","Nun taw pa chokká ométwára bay o tará mardénchokké bit, ke báyad ent áiay námá Issá bekanay."
"New","42","1","32","Á, mazanén mardomé bit o borzén arshay Hodáay Chokk zánaga bit o Hodáwandén Hodá, áiay pet o piroki, bezán Dáuday bádsháhiay tahtá áiá bakshit."
"New","42","1","33","Á, Ákubay padréchay sará modám bádsháhia kant o áiay bádsháhi hechbara nakotthit.”"
"New","42","1","34","Maryamá cha préshtagá jost kort: “É chón buta kant ke man taningah sur nakortag o janénchokké án?!”"
"New","42","1","35","Préshtagá passaw dát: “ Hodáay Pákén Ruh tai sará éra kayt o borzén arshay Hodáay zór o kodrat tai sará sáhéla bit. Paméshká á, pák o Hodáay Chokk zánaga bit."
"New","42","1","36","Elizábet ham ke tai syád ent, piránsariá pa mardénchokkéá ométwár ent. Hamá ke gwashtagatesh santh o bérand ent, nun shash máh ent ke lápi porr ent."
"New","42","1","37","Chéá ke pa Hodáyá, hecch káré nabuteni naent.”"
"New","42","1","38","Maryamá gwasht: “Man Hodáwanday móled án, hamé dhawlá ke taw gwashtag, anchosh bát.” Randá préshtag cha áiay kerrá shot."
"New","42","1","39","Hamá róchán, Maryam eshtápiá ráh gept o Yahudiahay kóhestáni hand o damagay shahréá shot."
"New","42","1","40","Ódá Zakaryáay lógá shot o Elizábeti hál o hawál kort."
"New","42","1","41","Anchosh ke Maryamay tawár Elizábetay góshán kapt, áiay lápá, chokká serr bast o Elizábet cha Pákén Ruhá porr but."
"New","42","1","42","Gón borzén tawáré gwashti: “Taw janénáni nyámá bahtáwar ay! Bahtáwar ent hamá chokk ke tai lápá ent."
"New","42","1","43","Man kay án ke mani Hodáwanday mát mani gendagá byayt?"
"New","42","1","44","Wahdé tai tayárjórhiay tawár mani góshán kapt, chokk cha galá lápay tahá soret."
"New","42","1","45","Bahtáwar ay taw ke báwaret kortag, chéá ke Hodáwanday hamá habar ke gón taw gwashag butagant, sarjama bant.”"
"New","42","1","46","Maryamá, áiay passawá gwasht: “Mani sáh o ján, Hodáwandá satá o saná kant."
"New","42","1","47","Mani ruh galá bál ent, ke Hodá mani rakkénók ent."
"New","42","1","48","Chéá ke wati móleday nezórii cháretag. Cha ed o rand, sajjahén nasl o padréch maná bahtáwara zánant."
"New","42","1","49","Chéá ke á Páknámén Zórmandá pa man mazanén kár kortag."
"New","42","1","50","Áiay mehr o rahmat, hamá sajjahénáni posht dar poshtá mánit ke áiay torsesh delá hastent."
"New","42","1","51","Áiá gón wati porzórén báská, mazanén kár o kerd pésh dáshtag o hamá ke wati delá bázén pahresh bastag, áiá sheng o sháng kortagant."
"New","42","1","52","Áiá, hokmrán cha wati tahtán sarshakun o garib, borz o sarperáz kortagant."
"New","42","1","53","Shodig, gón wasshén chizzán sérláp o séréni dast hórk o hálig rahádag kortagant."
"New","42","1","54","Á wati mehr o rahmatáni yátá kaptag o pa wati hezmatkárén Bani Esráili kawmá mehrabán butag,"
"New","42","1","55","bezán pa Ebráhém o áiay chokk o óbádagán abadi mehri bakshetag, hamá paymá ke gón may pet o pirokán labzi kortagat.”"
"New","42","1","56","Maryam, say máhay kesásá Elizábetay lógá mant o randá per tarret o wati lógá shot."
"New","42","1","57","Wahdé Elizábetay máh o róch sarjam butant, áiá mardénchokké but."
"New","42","1","58","Áiay chellagiay hál ke syád o hamsáhegán sar but o eshkotesh Hodáwandá áiay sará mazanén mehr o rahmaté kortag, gorhá gón áiay wasshiá hór o sharikdár butant."
"New","42","1","59","Wahdé nonnoká hasht róch but, pa áiay sonnat kanagá átkant. Áyán nonnokay nám petay námay sará, Zakaryá per bandagi at."
"New","42","1","60","Bale nonnokay mátá gwasht: “Na, áiay nám báyad ent Yahyá bebit.”"
"New","42","1","61","Mardomán gwasht: “Tai kothom o hándáná, é námén mardom kass nabutag.”"
"New","42","1","62","Gorhá áyán chokkay pet, Zakaryá pa eshárah jost kort ke á wati chokká chónén námé pera bandit?"
"New","42","1","63","Zakaryáyá nebisagi dártahtagé lóthet o áiay sará nebeshti: “Chokkay nám Yahyá ent.” Gorhá sajjahén mardom hayrán butant."
"New","42","1","64","Hamá damáná Zakaryáay gongén zobán pach but o habará lagget o Hodáay satá o sanái bongéj kort."
"New","42","1","65","Cha é habará, hamsáhegán tors delá kapt o Yahudiahay damagay kóhestagáni sajjahén mardomán é bárawá habara kort."
"New","42","1","66","Harkasá ke é hál eshkot wati del o hayálá chosh gwashti: “Bárén, é chokk chónén mardomé bit?” Chéá ke Hodáwanday dast gón áiá gón at."
"New","42","1","67","Gorhá, Yahyáay pet Zakaryá, cha Pákén Ruhá porr but o péshgói kort o gwashti:"
"New","42","1","68","“ Hodáwand, Esráilay Hodáyá satá o saná bát, chéá ke pa wati kawmay madat kanagá átkag o kawmi rakkéntag."
"New","42","1","69","Áiá cha wati hezmatkárén Dáuday lóg o bonjáhá, kánthé pa may rakkénagá jórhéntag,"
"New","42","1","70","anchosh ke áiá bázén wahdéá pésar, cha wati pákén nabiáni zobáná kawl dátag."
"New","42","1","71","Áiá, cha may sajjahén dozhmen o badwáhán ke cha má naprata kanant, márá rakkéntag,"
"New","42","1","72","may pet o pirokáni sará mehr o rahmati kortag o wati pákén hamá ahd o karáray yát o tránagi dáshtag."
"New","42","1","73","Gón may pet Ebráhémá sawgendi ham kortagat,"
"New","42","1","74","ke márá cha dozhmenáni dastá berakkénit, tánke bé tors o bimmá pa áiá hezmat bekanén o"
"New","42","1","75","áiay chamm o nezará wati sarjamén zendá nék o pák bebén."
"New","42","1","76","Taw, oo mani chokk! Borzén arshay Hodáay nabi zánaga bay, chéá ke taw cha Hodáwanday áyagá pésar, áiay ráh o keshká tachk o tayára kanay."
