Testament,Book,Chapter,Verse,Content
"New","45","13","4","Pa tai sharriá, hokumat Hodáay hezmatkár ent, bale agan badkária kanay, cha áiá betors chéá ke zahm mopt o bé sawab áiay dastá naent. Á Hodáay hezmatkár ent, sezá dayóké ke pa badkárán kahra kárit."
"New","45","13","5","Gorhá, báyad ent hokumatay chérdast bebay, tahná cha kahray torsá na, cha wati jabin o wejdáná ham."
"New","45","13","6","Pa hamé sawabá song o máliát ham dayét, parchá ke hákem Hodáay hezmatkár ant o wati wahdá pa hamé kárá dayant."
"New","45","13","7","Harkasay hakká báyad ent bedayét. Agan song o máliátó per ent, báyad ent bedayét, agan rasad per ent, gorhá rasadá bedayét. Agan ezzat ent, ezzat bekanét o agan sharap ent, sharap."
"New","45","13","8","Hechkasay dayn shomárá per mabit. Shomay daynkári tahná gón yakdegará mehr kanag ent; chéá ke harkas gón domiá mehra kant, áiá Sharyat barjáh dáshtag."
"New","45","13","9","Parchá ke “zená makan”, “hón makan”, “dozzi makan”, “tamáh makan” o á dega hokm gón hamé habará gwandh geraga bant: “Gón wati hamsáhegá wati jenday paymá mehr bekan.”"
"New","45","13","10","Mehr gón hamsáhegá badia nakant. Paméshká mehr kanag, Sharyatay sarjami ent."
"New","45","13","11","Anchosh ham, shomá annugén wahdá zánét ke nun á sáhat átkag ke cha wábá pád byáét o hozzhár bebét. Chéá ke nun may rakkag cha á wahday hesábá nazzikter ent ke má awalá báwarmand butagatén."
"New","45","13","12","Shap, dém pa halásiá ent o róch nazzikk. Nun byáét tahárókiay kár o kerdán yalah kanén o rozhnáiay zerahá bepóshén."
"New","45","13","13","Byáét sharapdárén zendé begwázénén, hamá zend ke róchay rozhnáiá gwázénaga bit, choshén zendé magwázénén ke pa ayyáshi, hanósh o malár, waylánki, landhari, pasát o hasadd bebit."
"New","45","13","14","Esháni badalá, Hodáwand Issá Masihá wati póshák bekanét o wati gonahkárén sareshtay wáhagáni sarjam kanagay pad o randá mabét."
"New","45","14","1","Nezórén báwarmandá wasshátk kanét o bezurét o nagisshetagén habaráni sará gón áiá jérhah makanét."
"New","45","14","2","Yakkéay báwar áiá har chizzay waragá kellit, bale domi ke báwari nezór ent tahná sabzia wárt."
"New","45","14","3","Á ke har chizza wárt, domiá pa áiay pahréz kanagá kamarzesh mazánt o á ke pahréza kant, á degaray sará ke har waráka wárt hokm maborrit, chéá ke Hodáyá, á wasshátk kortag o zortag."
"New","45","14","4","Taw kay ay ke degaréay hezmatkáray sará hokm beborray? Á wati jenday hodábonday péshgáhá óshtit yá kapit. Bale bezán ke óshtit, chéá ke Hodáwandá é wák hast ke áiá bedárit."
"New","45","14","5","Kasé yakk róchéá cha dega róchéá shartera zánt o degaréay delá sajjahén róch yakk ant. Harkas wati delay hayáláni sará saddak bebit."
"New","45","14","6","Á kas ke yakk róchéá hásén róché zánt, pa Hodáwandaygi chosha kant. Á kas ke wárt ham pa Hodáwandaygia wárt, parchá ke Hodáay shográ gipt o á kas ke cha waragá pahréza kant, pa Hodáwandaygi chosha kant o Hodáay shográ gipt."
"New","45","14","7","Cha má hechkas pa watigi zendag naent o kass pa watigia namerit."
"New","45","14","8","Agan zendag én pa Hodáwandá zendag én o agan bemerén pa Hodáwandá merén. Gorhá zendag bebén yá bemerén, Hodáwandayg én."
"New","45","14","9","Masih paméshká mort o padá zendag but ke mordagáni ham Hodáwand bebit o zendagénáni ham."
"New","45","14","10","Nun taw chéá wati brátá éra janay? Pa ché áiá kamarzesha zánay? Chéá ke hesábay róchá má sajjahén Hodáay bárgáhá óshtén."
"New","45","14","11","Parchá ke nebisag butag: “Hodáwanda gwashit: ‘Anchosh ke man zendag án, é habar ham rást ent, hamok mardom mani démá kóndhána kapit o har zobán Hodáyá satá kant o sárháit.’”"
"New","45","14","12","Gorhá cha má har yakkéá Hodáay démá wati hesáb dayagi ent."
"New","45","14","13","Byáét cha ed o rand yakdomiay hokmá maborrén. Eshiay badalá, wati delá shawr bekanét ke á dega brátáni pádráhá lakoshánkén dhók ér makanét o band mabandét."
"New","45","14","14","Man, cha Hodáwandén Issáay némagá saddak án ke hecch waráké watáwat palit naent, bale agan kasé chizzéá pa wat palit bezánt pa áiá palit ent."
"New","45","14","15","Agan gón tai warákéay waragá tai brát delranja bit, gorhá cha ed o rand mehray tahá gám najanagá ay. Pa wati waráká áiá tabáh makan ke Masih pa hamáiá mort."
"New","45","14","16","Maylét mardom á chizzáni bárawá badén habar bekanant ke shomá áyán néka zánét."
"New","45","14","17","Chéá ke Hodáay bádsháhi pa warag o nóshag naent, áiay bádsháhi, palgári o sohl o shádehi ent ke cha Pákén Ruhá rasit."
"New","45","14","18","Harkas hamé paymá Masihay hezmatá bekant, Hodáyá washnóda kant o mardom ham áiá mannant."
"New","45","14","19","Gorhá byáét modám hamá káráni pad o randá bebén ke dém pa sohl o árámi o yakdomiay rost o rodómá barant."
"New","45","14","20","Hodáay kárá pa waráká zawál makan. Pa rásti sajjahén warák pák ant, bale tai har hamá waráké pa taw bad ent ke degaréay thagal waragay sawabsáza bit."
"New","45","14","21","Sharter ent ke cha gósht, sharáb yá dega har chizzá pahréz bekanay ke tai brátay thagal waragay sawabsáza bit."
"New","45","14","22","É chizzáni sará wati mohrén báwará watig o Hodáay nyámá bedár, taw bezánay o Hodá. Gal pa hamáiá ke wati mannetagén chizzáni sará watá mayáriga nakant."
"New","45","14","23","Bale á ke warákéay sará shakk ent, agan áiá bwárt mayárig ent, chéá ke gón báwar o imáná nawártagi. Harché ke cha báwar o imáná mabit, gonáh ent."
"New","45","15","1","Má ke zórmand én, báyad ent nezórén báwarmandáni kamzórián wati baddhá bezurén o bass wati jenday wasshiáni randá mabén."
"New","45","15","2","Cha má har yakké wati hamsáhegá pa áiay rost o rodómay sharrén maksadá washnód bekant."
"New","45","15","3","Chéá ke Masih ham wati washnódiay padá naat, anchosh ke nebeshtah ent: “Tai rad o bad kanókáni rad o bad, mani sará kaptagant.”"
"New","45","15","4","Har chizzé ke pésará nebisag butag, pa may tálimá butag, tán gón Pákén Ketábay bakshetagén sabr o delbaddhiá márá omét berasit."
"New","45","15","5","Nun sabr o delbaddhiay Hodá shomárá anchén zendé bebakshát ke Issá Masihay paymá gón yakdomiá hamdel o hamsetk bebét,"
"New","45","15","6","tán shomá pa hamdeli o hamtawári Hodá, bezán may Hodáwandén Issá Masihay Petá, satá o saná bekanét."
"New","45","15","7","Nun pa Hodáay shán o shawkatá, shomá yakdomiá hamá paymá wasshátk bekanét o bezurét ke Masihá shomárá zortag."
"New","45","15","8","Shomárá gwashán ke pa Hodáay rástiay pajjáragá, Masih Yahudiáni hezmatkáré butag tánke hamá kawl o wádahán pakká bekant ke bonpirokán dayag butagatant o"
"New","45","15","9","tánke darkawm, Hodáyá pa áiay rahmatán satá o saná bekanant. Anchosh ke nebisag butag: “Paméshká tará kawmáni nyámá satá kanán o tai námá názénán.”"
"New","45","15","10","Padá gwashag butag: “Oo darkawmán! Gón áiay kawmá shádehi kanét.”"
"New","45","15","11","Démterá: “Oo sajjahén kawmán! Hodáwandá benázénét. Jahánay sajjahén ráj áiá satá o saná bekanant.”"
"New","45","15","12","Eshayá nabi ham gwashit: “Yassiay risshaga rodit, hamá ke páda kayt tán darkawmáni sará bádsháhi bekant, áiay sará darkawm ométa bandant.”"
"New","45","15","13","Ométay Hodá ke shomá áiay sará báwar kortag, shomay delá cha shádehi o sohl o árámiá porr kanát, tán gón Pákén Ruhay wák o zórá cha ométá sarréch bebét."
"New","45","15","14","Oo brátán! Man deljam án ke shomá wat cha sharri o nékiá porr ét, har paymén zántá tamán ét o pa yakdomiay pant o tálimá twáná ét."
"New","45","15","15","Bale man shomay sará lahtén chizzáni bárawá pa deléri nebeshtag tán padá á chizzán shomay yátá byárán. É cha hamá rahmatá ent ke Hodáyá maná bakshetag,"
"New","45","15","16","ke man pa darkawmán Issá Masihay hezmatkár bebán o pa Hodáay wasshén mestágay rasénagá hezmat o péshwái bekanán, tánke darkawm Hodáay dargáhá zortagén hayráté bebant ke cha Pákén Ruhá palgárag butag."
"New","45","15","17","Gorhá, pa Issá Masihaygi, pa Hodáyá wati kortagén hezmatáni sará pahra kanán."
"New","45","15","18","Maná bass hamá káráni bárawá habar kanagay tahm o joriat hastent ke Masihá cha mani dastá, bezán cha mani habar o kárán, kortagant tán darkawm parmánbardár bebant."
"New","45","15","19","Áiá é kár, cha nesháni o mójezaháni wák o kodratá, gón Hodáay Ruhay zórá kortagant. Gorhá cha Urshalimá beger tán Ilirikumay damagá, man sajjahén ráhá tarr o gard kortag o Masihay wasshén mestág pa sarjami jár jatag."
"New","45","15","20","Mani armán hamé butag ke mestágá á jágahán jár bejanán ke Masih ódá pajjárag nabutag o degaráni ér kortagén bonheshtáni sará chizzé addh makanán."
"New","45","15","21","Bale hamá dábá ke nebeshtah ent: “Hamá ke áiay bárawá hechbar hál dayag nabutagant, gendant o hamá ke hechbar áiay bárawá naeshkotagesh, sarpada bant.”"
"New","45","15","22","Paméshká báz randá mani dém dárag butag ke shomay kerrá átk makanán."
"New","45","15","23","Bale nun pa man, é hand o damagán kár kanagá jáhé pasht nakaptag o bázén sáléá mani armán ham butag ke shomay kerrá byáyán."
"New","45","15","24","Paméshká mani delá ent ke dém pa Espániáyá wati sát o saparay ráhá, gón shomá gend o nend bekanán tán shomay gendokay wasshián o rand, shomá maná pa óday sapará madat bekanét."
"New","45","15","25","Bale nun Urshalimá, palgártagénáni hezmat kanagá rawagá án."
"New","45","15","26","Chéá ke Makduniah o Akáyahay kelisáyán shawr kort ke pa Urshalimay nézgárén palgártagénán máli komaké ráh bedayant."
"New","45","15","27","É áyáni wati jenday shawr at. Á pa rásti Yahudiáni wámdár ant, chéá ke wahdé darkawm gón Yahudiáni ruhi barkatán sharikdár butagant, á ham wámdár ant ke gón wati máli hastiá, Yahudiáni hezmatá bekanant."
"New","45","15","28","Wahdé é káron sarjam kort o deljam bután ke é théki pa áyán sar butag, dém pa Espániáyá sara gerán o hamé saparay ráhá shomárá gendán."
"New","45","15","29","Mana zánán ke wahdé shomay kerrá byáyán, gón Masihay sarjamén barkatána káyán."
"New","45","15","30","Oo brátán! Pa may Hodáwand Issá Masihá o pa Pákén Ruhay mehrá cha shomá dazbandia kanán ke Hodáay dargáhá pa man dwá bekanét o gón wati dwáyán mani johdán hamráh bebét."
"New","45","15","31","Dwá kanét ke cha Yahudiahay nábáwaráni dastá berakkán o Urshalimay shahrá, palgártagén mardom mani hezmatá bemannant,"
"New","45","15","32","tán gón Hodáay wáhag o razáyá pa shádehi shomay kerrá byáyán o gón shomay gend o nendá nókén wák o twáné begerán."
"New","45","15","33","Sohl o émeniay Hodá shomá sajjahénáni hamráh bát. Anchosh bát. Ámin."
"New","45","16","1","Shomay kerrá mayshomay gohár Pibiay sepáreshá kanán, ke Kenkriahay shahray kelisáay hezmatkáré,"
"New","45","16","2","tánke pa Hodáwandaygi, hamá paymá ke palgártagénáni arzesh ent, áiá gón wat bezurét o wasshátk bekanét o har komaké ke cha shomá lóthit, bekanét, chéá ke á, bázén mardoméay madatkár butag o mani jenday ham."
"New","45","16","3","Mani salámán pa hamkárén Priskilá o Akwiláyá sar kanét, ke mani hamráhiá Issá Masihay hezmatesh kortag."
"New","45","16","4","Á pa manigi, cha wati zendá sar gwastagant. Tahná man na, darkawmáni sajjahén kelisá ham áyáni shográ gerant."
"New","45","16","5","Anchosh ham hamá kelisáyá mani salámán berasénét ke áyáni lógá barjáh dáraga bit. Mani dordánagén dóst Epaynétusá ke pa Masihá Ásiáay damagay awali bar o samar at, salám sar kanét."
"New","45","16","6","Maryamá ke pa shomaygi bázén zahmaté kasshetagi salám sar kanét."
"New","45","16","7","Mani syád Andrunikás o Yuniásá ke mani hamráhiá bandig atant salám sar kanét. Kásedáni nyámá á, arzeshmand o námdárén chehrag ant o cha man o pésar, Masihay báwarmand butagant."
"New","45","16","8","Ampliátusá salám sar kanét. Á, pa Hodáwandaygi maná báz dóst ent."
"New","45","16","9","Masihay hezmatá may hamkár Urbánus o mani dóstén sangat Estákisá salám sar kanét."
"New","45","16","10","Apelisá ke Issá Masihay kár o hezmatá páydár ent o anchosh ham Aristubulosay lógay mardomán salám sar kanét."
"New","45","16","11","Mani syád Hirudiuná salám sar kanét, Nárkisusay lógay hamá mardomán ke Hodáwanday sará báwarmand ant salám berasénét."
"New","45","16","12","Bánokén Tripiná o Tripusáyá ke pa Hodáwandá bázén káré kortagesh o anchosh dordánagén Persisá ke Hodáwanday ráhá mazanén hezmati kortag salám sar kanét."
"New","45","16","13","Pa Ruposá ke cha Hodáwanday némagá gechén kanag butag o áiay mátá ke pa man ham mátay paymá ent salám sar kanét."
"New","45","16","14","Asinkritus, Pligun, Hermes, Pátrubás, Hermás o á dega brátán ke gón áyán ant salám berasénét."
"New","45","16","15","Anchosh Pilulugos, Yuliá, Nirias o áiay gohár Ulimpás o sajjahén palgártagénán ke gón áyán ant salám sar kanét."
"New","45","16","16","Gón pákén chokkagán, yakdomiá drót o drahbát begwashét. Masihay sajjahén kelisá pa shomá salám déma dayant."
"New","45","16","17","Oo brátán! Cha shomá dazbandia kanán, á mardomán sharr bechárét o watá cha áyán dur bedárét ke mardománi nyámá pléndhia kanant o shomay geptagén tálimáni helápá gonáhay sawabsáza bant."
"New","45","16","18","Chéá ke choshén mardom may Hodáwand Masihay hezmatá nakanant, á wati lápay golám ant o gón wati narm o charpén zobáná sádahén mardomán rada dayant."
"New","45","16","19","Shomay parmánbardáriay tawár o áwáz sajjahénáni nyámá proshtag o man cha shomá shádmán án, bale cha shomá lóthán ke pa nékén kárán dáná o hóshmand bebét o cha sellén kárán pák o sáp bemánét."
"New","45","16","20","Sohl o émeniay Hodá, hamé zuttán Shaytáná shomay pádáni chérá hurta kant. May Hodáwand Issá Masihay rahmat shomay hamráh bát."
"New","45","16","21","Mani hamkár Timutáwus shomárá drót o drahbáta gwashit, anchosh mani syád Lukius, Yásun o Susipáterus pa shomá salám déma dayant."
"New","45","16","22","Man Tertius, é kágaday washnebis, cha Hodáwanday némagá shomárá salám o dróta gwashán."
"New","45","16","23","Gáyus ke maná o kelisáay sajjahén mardomi wati mehmándáriay sáhegá dáshtagant shomárá salám o dróta gwashit. É shahray hazánagay kelitdár Erástus o may brát Kwártus shomárá saláma gwashant."
"New","45","16","24","May Hodáwandén Issá Masihay rahmat shomá sajjahénáni hamráh bát. Anchosh bát. Ámin."
"New","45","16","25","Nun Hodáyá satá o saná bát, ke cha mani é wasshén mestág o Issá Masihay kolaway jár janagay barkatá, shomárá barjáh dáshta kant. É mestágay ráz, karnáni karn chér o bétawár at,"
"New","45","16","26","bale nun páshk o paddar butag o gón abadmánén Hodáay hokm o parmáná cha nabiáni nebeshtánkán darkawmáni nyámá pajjárénag butag, tán sajjahén kawm báwar bekanant o bemannant."
"New","45","16","27","Cha Issá Mashiay ráhá yakkén dánáén Hodáyá tán abad shán o shawkat berasát. Anchosh bát. Ámin."
"New","48","1","1","Cha Pulosay némagá, mane Pulos ke kásedé án o mani kásedi cha ensánáni némagá yá cha hásén mardoméay némagá naent, cha Issá Masih o Hodáén Petay némagá ent, hamá Hodá ke Issá Masihi cha mordagán zendag kort."
"New","48","1","2","É sajjahén brát ke gón man yakjáh ant, é kágad cha áyáni némagá ent ham. Pa Galátiahay kelisáyán."
"New","48","1","3","Cha may Hodáén Pet o Hodáwandén Issá Masihay némagá shomárá rahmat o émeni sar bát."
"New","48","1","4","Issá Masihá watá pa may gonáháni dur kanagá nadr kort ke may Hodáén Petay wáhagay barkatá márá cha annugén harábén zamánagá berakkénit."
"New","48","1","5","Hodáay shán o shawkat abad tán abad barjáh bát. Anchosh bát. Ámin."
"New","48","1","6","Man hayrán án ke shomá pa dega “wasshén mestágéá ” chón zutt hamá Hodáyá yalah kanagá ét ke shomárá tawári kortag ke Masihay rahmatáni chérá zend begwázénét."
"New","48","1","7","Albat dega wasshén mestág nést, bale lahtén mardom hast ke shomárá mán gisshénagá ant o Masihay wasshén mestágá badal kanaga lóthant."
"New","48","1","8","Tantaná agan má yá cha ásmáná átkagén préshtagé é wasshén mestágay badalá ke má shomay kerrá jár jatag, dega mestágéay járá bejant, áiá nálat bát."
"New","48","1","9","Anchó ke má pésará gwashtag, nun man padá gwashán, agan kasé shomay kerrá hamá wasshén mestágay badalá ke shomárá pésará rasetag, dega mestágéay járá bejant, áiá nálat bát."
"New","48","1","10","Annun man mardománi washnódiá lóthagá án yá Hodáay? Man mardománi wassh kanagay johdá naán. Agan man angat mardománi wassh kanagay johdá buténán, Masihay hezmatkáré naatán."
"New","48","1","11","Oo brátán! Shomárá gwashán, hamá wasshén mestág ke man shomay kerrá jár jatag, ensánay sázetagéné naent."
"New","48","1","12","Chéá ke é mestág maná cha ensánéay némagá narasetag o na ke kaséá maná dars dátag, é maná cha Issá Masihay nemagá elháméá rasetag."
"New","48","1","13","Shomá mani pésarigén zenday bárawá eshkotag ke man Yahudiáni dinay hesábá gwázéntag. Man Hodáay kelisá sakk báz ázár dátag o johdon kortag ke kelisáyá tabáh bekanán."
"New","48","1","14","Cha wati bázén hamkawmén hamsarókéá géshter Yahudi dinay páband butagán o wati pet o piroki dódáni barjam dáragá sakk porjósh butagán."
"New","48","1","15","Bale Hodáyá ke maná cha mátay lápá gechén kortagat, cha wati rahmatay barkatá maná tawár jat o paysalahi kort"
"New","48","1","16","ke wati Chokká pa man záher bekant tánke man darkawmán áiay Chokkay mestágá sar bekanán. Á wahdi man eshtáp eshtápá cha kassá sar o sój nagept o"
"New","48","1","17","dém pa Urshalimá pa hamá mardománi gendagá nashotán ke cha man pésar pa kásediá gechén kanag butagatant. Arabestáná shotán o randá Dameshká wátarr bután."
"New","48","1","18","Say sál gwast o nun Urshalimá Képáay didárá shotán o bass pánzdah róchá gón áiá dáshton."
"New","48","1","19","Man ódá á dega kásed nadistant, man bass Hodáwanday brát Ákub dist."
"New","48","1","20","Bechárét, harché ke pa shomá nebeshtah kanagá án, Hodá sháhed ent ke dróg naant."
"New","48","1","21","Randá Suriah o Kilikiahay damagán shotán."
"New","48","1","22","Masihay hamá báwarmand ke Yahudiahay kelisáyá ant, mani jendesh nadistagat,"
"New","48","1","23","bass eshkotagatesh ke may ázár dayók nun wat hamá imánay járá janagá ent ke yakk wahdé áiay tabáh kanagay randá butag."
"New","48","1","24","Gorhá é mardomán mani sawabá Hodáay satá o saná kort."
"New","48","2","1","Gorhá chárdah sálá rand man Bárnábáay hamráhiá padá Urshalimá shotán, man Titus ham gón wat bort gón."
"New","48","2","2","Elháméay sawabá shotán o wasshén mestág áyáni démá bayánon kort, hamá mestág ke man pa darkawmán jár janagá án. Hamá mardom ke kelisáay sarók zánaga butant, man gón áyán jetá gend o nend kort, tánke bezánán ke bépáedagén tach o tágé kanagá nabutagán o naán."
"New","48","2","3","Titus ham ke mani hamráh at, bell toré Yunánié at, bale pa sonnatá majbur kanag nabut."
"New","48","2","4","Sonnat kanagay habar paméshká chest but ke lahtén drógén “brát” may nyámá potertagat ke may jásusiá bekanant o hamá ázátiá ke márá cha Issá Masihay barkatá hastent, sarpad bebant tánke márá golám bekanant."
"New","48","2","5","Bale má pa damánéá ham áyáni démá sar jahl nakort tánke wasshén mestágay rásti pa shomá bemánit."
"New","48","2","6","Á ke kelisáay tahá sarók zánaga butant, áyán mani tálimáni tahá hecch chizz gésh nakort. Chónáhá ham mani kerrá é gappá hecch arzesh néstat ke á chinchok námdár ant, chéá ke Hodá ru o ryá nakant."
"New","48","2","7","Mani tálimáni tahá chizzé gésh kanagay badalá, á sarpad butant ke sonnat nakortagénáni kerrá wasshén mestágay jár janagay zemmah maná dayag butag, anchosh ke sonnat kortagénáni kerrá é járay janagay zemmah Petrosá dayag butag."
"New","48","2","8","Hamá Hodá ke Petrosá wák o twán dayagá at ke pa sonnat kortagénán áiay kásed bebit, hamá Hodá maná ham wák o twán dayagá at ke pa sonnat nakortagénán áiay kásed bebán."
"New","48","2","9","Ákub o Képá o Yuhanná ke kelisáay menok zánaga butant, wahdé sarpad butant ke maná rahmatay é sawgát rasetag, wati rástén dastesh mani o Bárnábáay némagá pa hamkáriá shahárt ke má darkawmáni kerrá berawén o á, sonnat kortagénáni kerrá berawant."
"New","48","2","10","Áyán cha má bass haminchok lóthet ke nézgárán béhayál makanén o man wat ham cha pésará pa hobb o wáhagé hamé kárá kanagá atán."
"New","48","2","11","Wahdé Képá Antákiahá átk, man paméshká áiay jenday démá, áiay helápá pád átkán ke á mayárig at."
"New","48","2","12","Gapp esh ent ke cha Ákubay némagá lahtén mardomay áyagá pésar, Képáyá gón darkawmén báwarmandán waráka wárt, bale wahdé é mardom átkant, áiá watá cha darkawmán dur dásht o áyáni nazzikká nayátk, chéá ke cha sonnat kanagay mannókán torseti."
"New","48","2","13","Képáay é dotal o dopóstiá é dega Yahudi báwarmand hamráh butant. Á degarán bell, Bárnábá ham áyáni dotal o dopóstiá gón kapt o gomráh but."
"New","48","2","14","Bale wahdé man dist ke é mardom wasshén mestágay rástén ráhá rawagá naant, sajjahénáni démá gón Képáyá gwashton: “Taw wat Yahudié ay o angat wati zendá Yahudiáni dhawlá nagwázénay, darkawmáni dhawlá gwázénay, gorhá darkawmán parchá hojja kanay ke Yahudiáni dhawlá zend begwázénant?”"
"New","48","2","15","Má pédáeshi Yahudi én o cha “gonahkárén darkawmán ” naén,"
"New","48","2","16","bale angat má zánén ke mardom Sharyatay randgiriay sawabá pák o palgára nabit, Issá Masihay sará báwar kanagay sawabá pák o palgára bit. Má Issá Masihay sará báwar kortag tánke Masihay sará báwaray sawabá pák o palgár bebén, Sharyatay randgiriay sawabá na, chéá ke Sharyatay randgiriay sawabá kass pák o palgára nabit."
"New","48","2","17","Bale hamá wahdá ke má Masihay barkatá pák o palgár bayaga lóthén, agan zánag but ke má wat ham gonahkár én, gorhá? Masih gonáhay hezmatá ent? Na, hechbar na."
"New","48","2","18","Nun agan man hamá chizzán padá bebandán ke man wat karótkagant, gorhá sábet kanagá án ke Sharyatay próshóké án."
"New","48","2","19","Chéá ke wahdé man zánt ke Sharyatá dáshta nakanán, man Sharyatay chammán mortán ke pa Hodáyá zendag bebán."
"New","48","2","20","Man Masihay hamráhiá salib kasshag bután. Nun é mardom ke zendag ent, é man naán, Masih ent ke mani tahá zendag ent. É jesmi zendagi ke maná hastent, maná Hodáay Chokkay sará báwar kanagay sawabá hastent ke hamáiá maná dóst dáshtag o wati jendi pa man nadr kortag."
"New","48","2","21","Man Hodáay rahmatán pádmála nakanán, chéá ke agan páki o palgári Sharyatay randgiriay sawabá berasetén, gorhá Masihay marká hecch máná nabutagat."
"New","48","3","1","Oo béaglén Galátián! Kayá shomárá sehr kortag? Issá Masihay salib kasshagay kessah gón shomá anchó pakkáiá bayán kanag but ke har chizz purah shomay chammáni démá záher but."
"New","48","3","2","Man cha shomá bass yakk chizzé zánaga lóthán, shomárá Pákén Ruh Sharyatay randgiriay sawabá rasetag yá wasshén mestágay eshkonag o báwar kanagay sawabá?"
"New","48","3","3","Haminchok béagl ét? Shomá wati sapar, Pákén Ruhay barkatá bendát kortag. Nun gón ensáni johdá menzelá sar bayaga lóthét?"
"New","48","3","4","Shomá inchok sakki o sóri mopt o náhudagá kasshetag? Maná báwara nakant."
"New","48","3","5","Hamá ke shomárá Pákén Ruha bakshit o mójezah pésha dárit, é kárán paméshká kant ke Sharyatay randgiriá kanagá ét? Yá paméshká ke shomá wasshén mestágá gósh dárag o báwar kanagá ét?"
"New","48","3","6","Ebráhémá bechárét, áiá Hodáay sará báwar kort o áiay é báwar pa áiá páki o palgárié hesáb but."
"New","48","3","7","Paméshká deljam bebét, Ebráhémay asligén chokk hamá ant ke imána kárant."
"New","48","3","8","Pákén Ketábá péshgói kort ke Hodá chón darkawmán imánay sawabá pák o palgára kant. Hodáyá Ebráhémay kerrá wasshén mestágay jár pésará jat, gwashti: “ Donyáay sajjahén kawm tai sawabá barkata gerant.”"
"New","48","3","9","Gorhá hamá ke imánay ráhá zurant gón Ebráhémá hawár barkata gerant, hamá Ebráhém ke imánay ráhi zortag."
"New","48","3","10","Á ke Sharyati káráni sará tawkala kanant, áyáni sará nálat ent. Chéá ke Pákén Ketábá nebeshtah ent: “Harkas ke dáemá Sharyatay Ketábay sajjahén nebeshtaháni páband naent o áyáni sará kára nakant, á nálatié.”"
