Testament,Book,Chapter,Verse,Content
"New","43","12","38","Eshayá nabiay habar hamé paymá rást o sarjam but ke áiá gwashtagat: “Oo Hodáwand! May kolaw kayá báwar kortag o Hodáwanday wák o kodrat pa kayá záher butag?”"
"New","43","12","39","Gorhá áyán báwar kort nakort, chéá ke Eshayáyá dega jágahé ham gwashtagat:"
"New","43","12","40","“Áyáni chammi kór o deli seng kortagant ke gón chammán magendant, gón delán sarpad mabant o dém pa man per matarrant. Agan mani kerrá byátkénant, man dráh kortagatant.”"
"New","43","12","41","Eshayáyá Issáay shán o shawkat dist, paméshká áiay bárawá é habari kort."
"New","43","12","42","Angat ham Yahudiáni bázén sarókéá áiay sará imán áwort. Bale cha hamé torsá ke Parisi áyán cha kanisahá dar makanant, námesha nagept."
"New","43","12","43","Chéá ke áyán ensánay dátagén ezzat o satá cha Hodáay dátagén ezzat o satáyá dóstter at."
"New","43","12","44","Padá Issáyá gón borzén tawáréá gwasht: “Harkas ke mani sará imána kárit, tahná mani sará na, mani dém dayókay sará ham imána kárit."
"New","43","12","45","Harkas ke maná gendit, mani dém dayóká ham gendit."
"New","43","12","46","Rozhn man án o é jaháná paméshká átkagán ke harkas ke mani sará imán byárit tahárókiá mamánit."
"New","43","12","47","Bale agan kasé mani habarán beshkont o áyáni sará kár makant, angat ham man áiá mayárbára nakanán. Chéá ke man pa jahánay mayárig kanagá nayátkagán, pa jahánay rakkénagá átkagán."
"New","43","12","48","Albat pa hamá mardomá ke maná namannit o mani habarána nazurit, dádrasé hast ke áiá mayárig bekant. Hamá habar ke man kortagant, áheratay róchá áiá mayáriga kanant."
"New","43","12","49","Chéá ke man watsará habar nakortag, hamá Petá ke maná rawán dátag, áiá hokm dátag ke ché begwashán o chón habar bekanán."
"New","43","12","50","Mana zánán ke áiay hokm o parmán abadmánén zend ent. É habarán ke mana kanán, hamá habar ant ke Petá maná gwashtagant.”"
"New","43","13","1","Sargwazay Aidá yakk o do róch pasht kaptagat. Issáyá zánt ke hamá sáhat o damán átkag ke man é jaháná yalah bedayán o Petay kerrá berawán. Áiá wati mardom é jaháná dóst dáshtagatant o tán wati omray áheri damáná pa del dóstia dáshtant."
"New","43","13","2","Shámay wahd at o Shaytáná cha pésará Shamun Eskaryutiay chokk Yahudáay del parmátagat ke Issáyá bedróhit o dozhmenáni dastá bedant."
"New","43","13","3","Issáyá zánt ke Petá sajjahén chizz mani dastá dátagant o man cha Hodáay némagá átkagán o hamáiay kerrá rawán."
"New","43","13","4","Issá cha waragay sará pád átk, wati kabáhi kasshet o lánkigé sréná basti."
"New","43","13","5","Nun trashté zorti o ápi mán kort o moridáni pádáni shódag o gón hamá lánkigá hoshk kanagi bendát kort ke sréná bastagati."
"New","43","13","6","Wahdé Shamun-Petrosay bárig átk, áiá gwasht: “Oo Hodáwand! Taw mani pádána shóday?”"
"New","43","13","7","Issáyá passaw tarrént: “Annun taw nazánay man ché kanagá án, randá sarpada bay.”"
"New","43","13","8","Petrosá gwasht: “Man hechbara naylán ke taw mani pádán beshóday.” Issáyá gwasht: “Agan tará mashódán, tará cha man hecch wandh o bahré narasit.”"
"New","43","13","9","Shamun-Petrosá gwasht: “Oo Hodáwand! Agan é gapp ent, gorhá tahná mani pádán na, mani sar o dastán ham beshód.”"
"New","43","13","10","Issáyá gwasht: “Á ke shódag butag, áiá abéd cha pádán dega hecch jágahay shódag pakár naent. Á sarjamá pák o sáp ent. Shomá pák ét, bale sajjahén na.”"
"New","43","13","11","Issáyá zánt ke kay maná dróhit, paméshká gwashti ke shomay nyámá nápákén ham hast."
"New","43","13","12","Sajjahénáni pádáni shódagá rand, wati kabáhi gwará kort o parzónagay sará padá nesht o gwashti: “Shomá zánét ke man pa shomá ché kort?"
"New","43","13","13","Shomá maná ostád o Hodáwanday námá tawára kanét, rásta gwashét, man hamá án."
"New","43","13","14","Agan man shomay Hodáwand o ostád án o shomay pádon shoshtant, shomárá ham yakdegaray pád shódagi ant."
"New","43","13","15","Man pa shomá mesálé ér kort tánke hamá dhawlá ke man gón shomá kort, shomá ham hamá dhawlá bekanét."
"New","43","13","16","Shomárá rásténa gwashán, hecch golám cha wati wájahá o hecch kásed cha wati dém dayóká master naent."
"New","43","13","17","Nun ke shomá é habará zánét, bahtáwar ét agan anchosh bekanét."
"New","43","13","18","É habarán ke mana kanán shomay sajjahénáni bárawá naant. Á mardom ke man gechén kortagant, áyána zánán. Bale Pákén Ketábay é habar rást o sarjam bayagi ent ke gwashit: Hamá kas ke gón man yakjáh waragi wártag, hamá mani helápá pád átkag."
"New","43","13","19","Annun cha é kárá pésar shomárá gwashán ke wahdé chosha bit, gorhá bezánét ke man hamá án."
"New","43","13","20","Shomárá rásténa gwashán, harkas ke mani ráh dátagéná wasshátka kant o sharapa dant, bezán maná sharapa dant. O harkas ke maná wasshátka kant o sharapa dant, bezán mani dém dayóká sharapa dant.”"
"New","43","13","21","Wahdé Issáyá é habar kort, cha del o daruná sakk padard but o pa deljami gwashti: “Man shomárá rásténa gwashán, cha shomá yakké maná dróhit.”"
"New","43","13","22","Moridán yakdomiay némagá cháret, hayrán atant ke Issá kai bárawá gappá ent."
"New","43","13","23","Cha moridán yakké, hamá ke Issáyá báz dóst at, Issáay kerrá neshtagat."
"New","43","13","24","Shamun-Petrosá hamá morid eshárah kort ke wájahá jost kan bárén kai bárawá gappá ent?"
"New","43","13","25","Á morid nazzikter kenzet o cha Issáyá josti kort: “Oo Hodáwand! Á kay ent?”"
"New","43","13","26","Issáyá passaw dát: “Á hamá ent ke man chondhé nagan kásagá pera janán o dayáni.” Gorhá nagani per jat o Shamun Eskaryutiay chokk, Yahudáyárá dáti."
"New","43","13","27","Anchosh ke Yahudáyá lonkah dastá kort, Shaytán áiay póstá potert. Nun Issáyá gón áiá gwasht: “Zutt kan! Har káré ke tará kanagi ent, bekani.”"
"New","43","13","28","Bale cha parzónagay saray neshtagén mardomán kassá nazánt ke gón é habará áiay morád ché ent."
"New","43","13","29","Zarr Yahudáay kerrá ér atant, paméshká lahténá gomán kort ke balkén Issá áiá gwashagá ent ke beraw o harché pa aidá pakár ent beger, yá garib o nézgárán chizzé beday."
"New","43","13","30","Anchosh ke Yahudáyá naganay chondh zort, dhanná dar kapt. Shap at."
"New","43","13","31","Yahudá ke dar kapt, Issáyá gwasht: “Nun Ensánay Chokkay shán o shawkat záher butag. Cha Ensánay Chokká Hodáay shán o shawkat ham záher butag."
"New","43","13","32","Agan cha Ensánay Chokká Hodáay shán o shawkat záher butag, Hodá ham Ensánay Chokkay shán o shawkatá záhera kant o hamé zuttán záheria kant."
"New","43","13","33","Oo mani chokkán! Angat tán gwandhén wahdéá man gón shomá gón án. Randá shomá mani shóházá gardét. Hamá dhawlá ke man gón Yahudián gwasht, gón shomá ham gwashán: Á jáhá ke mana rawán, shomá átka nakanét."
"New","43","13","34","Shomárá nókén hokmé dayán: Yakdegará dóst bedárét. Anchó ke man shomárá dóst dáshtag, shomá ham yakdegará dóst bedárét."
"New","43","13","35","Agan yakdegará dóst bedárét, gorhá harkasa zánt ke shomá mani morid ét.”"
"New","43","13","36","Shamun-Petrosá gwasht: “Oo Hodáwand! Kojá raway?” Issáyá passaw dát: “Anchén jáhé rawán ke taw annun gón man átka nakanay. Bale randterá káay.”"
"New","43","13","37","Petrosá gwasht: “Oo Hodáwand! Annun parchá gón taw átka nakanán? Man wati sáhá pa taw nadra kanán.”"
"New","43","13","38","Issáyá gwasht: “Taw pa man wati sáhay nadr kanagá tayár ay? Tará rásténa gwashán, cha korósay bángá pésar, say randá mani pajjáh áragá enkára kanay."
"New","43","14","1","Shomay del paréshán mabit. Hodáay sará imán byárét o mani sará ham imán byárét."
"New","43","14","2","Mani Petay lógá bázén báné hast. Agan na, man shomárá gwashtagat ke rawán tánke pa shomá jágahé tayár bekanán."
"New","43","14","3","Bale angat man pa shomay jágahay tayár kanagá rawán o padá káyán o shomárá gón wata barán, tánke hamódá ke man án, shomá ham hamódá bebét."
"New","43","14","4","Ódá ke mana rawán, shomá á jágahay ráhá zánét.”"
"New","43","14","5","Tumáyá gwasht: “Oo Hodáwand! Má nazánén ke taw kojá raway, gorhá ráhá chón zánta kanén?”"
"New","43","14","6","Issáyá gwasht: “Ráh man án, rásti man án o zend bakshók ham man án. Kass Petay kerrá sar buta nakant, agan mani ráhá marawt."
"New","43","14","7","Nun ke shomá maná zántag, mani Petá ham zánét, bezán cha ed o rand shomá áiá zánét o shomá á distag.”"
"New","43","14","8","Piliposá gwasht: “Oo Hodáwand! Petá márá pésh bedár, pa má hamé bass ent.”"
"New","43","14","9","Issáyá gwasht: “Oo Pilipos! Inchok wahd ent ke man gón shomá gón án o taw angat maná nazánay? Harkasá ke maná distag, mani Peti ham distag. Gorhá taw chóna gwashay ke Petá márá pésh bedár?"
"New","43","14","10","Báwara nakanay ke man Petay del o daruná án o Pet mani del o daruná? É habarán ke gón shomá gwashán mani naant, hamá Petayg ant ke mani del o daruná ent. Hamá ent ke é kárána kant."
"New","43","14","11","Mani é habará bemannét ke man Petay del o daruná án o Pet manigá. Yá kamm cha kamm hamá káráni sawabá imán byárét ke man kortag o shomá distagant."
"New","43","14","12","Man shomárá rásténa gwashán, harkas ke mani sará imána kárit, harché ke mana kanán á ham korta kant. Masterén kár ham korta kant, chéá ke man Petay kerrá rawán o"
"New","43","14","13","harché ke shomá mani námay sará lóthét, á wáhagá sarjama kanán, tánke Chokk Petay shán o shawkatá záher bekant."
"New","43","14","14","Harché ke shomá mani námay sará belóthét, man shomay wáhagá sarjama kanán."
"New","43","14","15","Agan shomá maná dósta dárét, gorhá mani hokmána mannét."
"New","43","14","16","Man wat cha Petá lóthán o á shomárá dega posht o panáhé dant ke modám gón shomá bemánit,"
"New","43","14","17","bezán rástiay hamá Ruh ke jahán áiay mannagá tayár naent, chéá ke nagenditi o pajjáhia nayárit. Bale shomá áiá pajjáha kárét, chéá ke shomay kerrá mánit o shomay del o daruná bit."
"New","43","14","18","Shomárá yatim o chórawa nakanán, shomay kerrá pera tarrán."
"New","43","14","19","Kammén wahdéá rand, jahán dega randé maná nagendit, bale shomá maná gendét. Man zendag án, paméshká shomá ham zendaga mánét."
"New","43","14","20","Á róchá shomá zánét ke man Petay del o daruná án o shomá mani del o daruná ét o man shomaygá."
"New","43","14","21","Á kasá ke mani hokm gón ant o esháni sará kára kant, hamá kas maná dósta dárit. Á ke maná dósta dárit, mani Pet ham áiá dósta dárit o man ham áiá dósta dárán o watá pa áiá záhera kanán.”"
"New","43","14","22","Yahudá Eskaryutiá na, domi Yahudáyá jost kort: “Oo Hodáwand! Chéá watá pa má záhera kanay bale pa jaháná záhera nakanay?”"
"New","43","14","23","Issáyá passaw tarrént: “Á kas ke maná dósta dárit, hamá habaráni sará kára kant ke man gwashtagant. Mani Pet áiá dósta dárit o man o Peta káén o áiay kerrá lóg o jágaha kanén."
"New","43","14","24","Á kas ke maná dósta nadárit, mani habaráni sará kára nakant. É habarán ke shomá cha mana eshkonét mani naant, hamá Petayg ant ke maná ráhi dátag."
"New","43","14","25","Man é habarán hamé wahdá kanán ke angat shomay kerrá án."
"New","43","14","26","Bale shomay posht o panáh hamá Pákén Ruh ent ke Pet áiá mani námay sará déma dant. Pákén Ruh sajjahén chizzán shomárá sója dant o hamá sajjahén habar ke man gón shomá kortagant, shomárá áyáni yátá perrénit."
"New","43","14","27","Man shomárá émeni o ásudagia dayán. Wati émeni o ásudagiá shomárá dayán. Jaháná é wák o twán nést ke hamá émeniá shomárá bedant ke mania dayán. Matorsét o wati delá paréshán makanét."
"New","43","14","28","Shomá eshkot, man gwasht ke rawán bale padá shomay kerrá pera tarrán. Agan shomá maná dóst bedáshtén, cha é habará gal butagatét ke man Petay kerrá rawán, chéá ke Pet cha man master ent."
"New","43","14","29","Man hamé habar cha é káray bayagá pésar kort ke wahdé chosha bit, imán byárét."
"New","43","14","30","Cha ed o rand, gón shomá báz habara nakanán, chéá ke é jahánay sardár Shaytána kayt. Áiá mani sará hecch wák o ehtiár nést."
"New","43","14","31","Man bass hamá kárána kanán ke Petá maná parmátagant, tánke jahán bezánt ke man Petá dósta dárán. Pád áét, cha edá rawén."
"New","43","15","1","Man anguray asligén drachk án o mani Pet bágpán ent."
"New","43","15","2","Mani har thálé ke bara nayárit, Pet áiá goddhit o har thálé ke bara kárit, áiá tráshit o palgárit ke géshter bar o samar byárit."
"New","43","15","3","Mani habaráni barkatá shomá cha pésará pák ét, hamá habar ke man gón shomá kortagant."
"New","43","15","4","Shomá mani del o daruná bemánét o man shomay del o daruná mánán. Agan thálé gón drachká hór mabit, bar áworta nakant. Hamé paymá shomá ham agan gón man hór mabét, bar áworta nakanét."
"New","43","15","5","Man anguray drachk án o shomá thál ét. Harkas ke mani del o daruná mánit o man áiaygá, á bázén bar o samaré kárit, chéá ke shomá cha man jetá hecch káré korta nakanét."
"New","43","15","6","Agan kasé mani del o daruná mamánit, sestagén tháléay dhawlá dawr dayaga bit o hoshka tarrit. Mardom hoshkén thálán moccha kanant o ásá dawra dayant o sóchant."
"New","43","15","7","Agan shomá mani del o daruná bemánét o mani habar shomay delá bemánant, harché ke lóthét belóthét, shomárá rasit."
"New","43","15","8","Mani Petay shán o shawkat gón hamé chizzá záhera bit ke shomá bázén bar o samaré kárét o mani morida bét."
"New","43","15","9","Hamá paymá ke Petá maná dóst dáshtag, man ham shomárá hamá paymá dóst dáshtag. Mani mehráni sáhegá bemánét."
"New","43","15","10","Agan mani hokmáni sará kár bekanét, mani mehráni sáhegá mánét, anchosh ke man wati Petay hokmáni sará kár kortag o áiay mehráni sáhegá neshtagán."
"New","43","15","11","Man é habar gón shomá paméshká kortant ke mani shádmáni shomay del o daruná benendit o shomay shádmáni kámel o sarjam bebit."
"New","43","15","12","Mani hokm esh ent ke shomá yakdegará dóst bedárét, hamá dhawlá ke man shomárá dóst dáshtag."
"New","43","15","13","Masterén mehr hamesh ent ke mardom wati sáhá pa dóstán nadr bekant."
"New","43","15","14","Agan shomá mani hokmáni sará kár bekanét, mani dóst ét."
"New","43","15","15","Cha ed o rand shomárá golám o bandaha nagwashán, chéá ke goláma nazánt wájah ché kant. Man shomárá wati dóst gwashtag chéá ke harché ke man cha Petá eshkotag, shomárá gwashtagon."
"New","43","15","16","Shomá maná gechén nakortag, man shomárá gechén kortag o dém dátag ke shomá berawét o bar o samar byárét, abadmánén bar o samar. Gorhá harché ke mani námay sará cha Petá belóthét, shomárá dant."
"New","43","15","17","Mani hokm pa shomá hamesh ent: Yakdegará dóst bedárét."
"New","43","15","18","Agan donyá cha shomá naprata kant, bezánét ke pésará cha man naprati kortag."
"New","43","15","19","Agan shomá é donyái mardom buténét, donyáyá shomárá watigáni dhawlá dóst dáshtagat. Bale shomá donyái mardom naét o man shomárá cha é donyáyá dar chetag, paméshká donyá cha shomá naprata kant."
"New","43","15","20","Cha é habará béhayál mabét ke man gón shomá gwashtag: ‘Golám cha wájahá mastera nabit.’ Agan áyán maná ázár dátag, shomárá ham ázára dayant. Agan mani habaresh zortag, shomay habará ham zurant."
"New","43","15","21","Pa mani námaygi gón shomá é dhawlá kanant, chéá ke mani dém dayóká nazánant."
"New","43","15","22","Agan man mayátkénán o gón áyán habaron makortén, á bémayár atant. Bale nun áyán pa wati gonáhán hecch ozr o nimmóné nést."
"New","43","15","23","Harkas ke cha man naprata kant, cha mani Petá ham naprata kant."
"New","43","15","24","Agan áyáni démá man á kár makorténant ke dega kassá nakortagant, bémayár atant. Bale nun wa áyán é kár distagant o angat cha man ham naprata kanant o cha mani Petá ham."
"New","43","15","25","Áyáni Sharyatá nebeshtah ent ke ‘Moptá cha man napratesh kort.’ É dhawlá é habar rást o sarjam but."
"New","43","15","26","Bale wahdé shomay posht o panáha kayt, bezán rástiay Pákén Ruh ke áiay sarchammag Pet ent o man áiá cha Petay némagá déma dayán, á mani bárawá sháhedia dant."
"New","43","15","27","Shomá ham mani sháheda bét, chéá ke cha bendátá gón man gón butagét."
"New","43","16","1","Man é chizz gón shomá gwashtant ke shomá mathagalét o rad mawarét."
"New","43","16","2","Shomárá cha kanisahán dara kanant. Choshén wahdé ham kayt ke shomay koshók gomána kanant ke gón shomay koshagá Hodáay hezmatá kanagá ant."
"New","43","16","3","Á é kárána kanant, chéá ke na Petá zánant o na maná."
"New","43","16","4","Man é habar gón shomá paméshká kortant ke wahdé chosha bit, gorhá shomá hayálá bekapét ke man shomárá ché gwashtag. Man é habar awalá gón shomá nakortant, chéá ke man wat gón shomá gón atán."
"New","43","16","5","Nun man wati dém dayókay kerrá rawán o cha shomá hechkas josta nakant ke kojá raway?"
"New","43","16","6","Shomay del cha gamá porr but, chéá ke man é habar shomárá gwashtant."
"New","43","16","7","Bale shomárá rásténa gwashán ke mani rawag pa shomá sharter ent. Chéá ke agan marawán, shomay posht o panáh pa shomá nayayt, bale agan berawán, áiá pa shomá déma dayán."
"New","43","16","8","Wahdé á kayt, gonáh o pahrézkári o dádrasiay bárawá donyáay mardomán sahiga kant o áyáni mayárbáriá záhera kant."
"New","43","16","9","Gonáhá záhera kant, chéá ke mardom mani sará imána nayárant;"
"New","43","16","10","ensáni pahrézkáriay nezóriá záhera kant, chéá ke man Petay kerrá rawán o shomá dega baré maná nagendét;"
"New","43","16","11","Hodáay dádrasiá ham záhera kant, chéá ke é jahánay sardár Shaytán mayárig kanag butag."
"New","43","16","12","Maná gón shomá bázén habaré kanagi ent, bale shomárá é wahdi áyáni eshkonagay wák o twán nést."
"New","43","16","13","Wahdé á kayt, bezán rástiay Ruh, shomárá dém pa sarjamén rástiá rahshónia kant, parchá ke á watsará heccha nagwashit, tahná hamá chizzána gwashit ke eshkontesh o shomárá démay háláni bárawá sarpada kant."
"New","43","16","14","Á mani shán o shawkatá záhera kant, chéá ke harché ke shomárá sarpada kant, cha manesha zurit."
"New","43","16","15","Harché ke mani Petá hast, manig ent. Paméshká gwashton ke Pákén Ruh cha mana zurit o shomárá sarpada kant."
"New","43","16","16","Kammén wahdéá rand shomá maná nagendét, bale padá kammoké randterá maná gendét.”"
"New","43","16","17","Gorhá cha moridán lahténá gón yakdegará gwasht: “Parchá gwashit: ‘Kammén wahdéá rand maná nagendét, bale padá kammoké randterá maná gendét,’ yá é habar ke á gwashit: ‘Petay kerrá rawán,’ áiay maksad ché ent?”"
"New","43","16","18","Á watmánwat gwashagá atant: “Á ke gwashit ‘kammén wahd,’ cha eshiá áiay morád ché ent? Má nazánén ke á ché gwashit?”"
"New","43","16","19","Issáyá zánt ke é bárawá á cha man jost kanaga lóthant. Gorhá gwashti: “Shomá mani hamé habaray bárawá gón yakdomiá jost o porsá ét ke man shomárá gwasht kammén wahdéá rand shomá maná nagendét, bale padá kammoké randterá maná gendét?"
"New","43","16","20","Shomárá rásténa gwashán, shomá arsa réchét o porsiga bét, bale jahán gala bit. Shomá gamiga bét, bale shomay é gam shádmániay tahá badala bit."
"New","43","16","21","Janéné wati chellagiay wahdá darda kasshit, bale anchó ke nonnok pédá bit, wati dardána shamóshit, chéá ke hamé gappá gal ent ke nókén ensáné donyáyá átkag."
"New","43","16","22","Shomá ham nun hamé dhawlá gamig ét, bale man shomárá padá gendán o á wahdi shomá gala bét o shomay wasshiá hechkas pach gepta nakant."
"New","43","16","23","Á róchá shomá cha man hecch chizzay jostá nakanét. Man shomárá rásténa gwashán, shomá mani námay sará harché ke cha Petá belóthét, shomárá dant."
"New","43","16","24","Tán é wahdi shomá hecch chizz mani námay sará nalóthetag, belóthét tánke shomárá berasit o shomay shádmáni sarjam bebit."
"New","43","16","25","Man pa namunah o mesál gón shomá é habar kortagant, bale yakk wahdé kayt ke dega baré pa namunah o mesál habara nakanán, gón shomá tachká tachk Petay bárawá habara kanán."
"New","43","16","26","Á róchá, shomá mani námay sará lóthét o mana nagwashán ke man pa shomá cha Petá lóthán."
"New","43","16","27","Pet wat shomárá dósta dárit, chéá ke shomá maná dóst dáshtag o mannetag ke man cha Hodáay némagá átkagán."
"New","43","16","28","Man cha Petay kerrá dar átkag o é jaháná átkagán. Nun é jaháná yalaha kanán o Petay gwará rawán.”"
"New","43","16","29","Moridán gón áiá gwasht: “Nun taw bé namunah o mesál, tachká tachk habar kanagá ay."
"New","43","16","30","Nun má deljam én ke taw sajjahén chizzána zánay o hecch zalurat naent ke kasé cha taw josté bekant. Paméshká márá yakin ent ke taw cha Hodáay némagá átkagay.”"
"New","43","16","31","Issáyá passaw dát: “Nun shomárá yakin ent."
"New","43","16","32","Bechárét, yakk wahdé kayt o á wahd annun bongéj butag ke shomá sajjahén sheng o shánga bét o harkas wati ráhá rawt. Maná tahná yalaha dayét, bale angat tahná nabán, chéá ke mani Pet gón man gón ent."
"New","43","16","33","Man é chizz shomárá gwashtant ke mani barkatá shomárá émeni o ásudagi berasit. Jaháná shomárá dard o ranja rasit, bale delá dhaddh kanét, chéá ke man jahánay sará báládast butagán.”"
"New","43","17","1","Cha é habarán o rand, Issáyá dém pa ásmáná cháret o gwasht: “Oo Pet! Á wahd o sáhat átkag. Wati Chokkay shán o shawkatá záher kan ke Chokk tai shán o shawkatá záher bekant."
"New","43","17","2","Taw sajjahén mardománi ehtiár wati Chokkay dastá dátag, tánke Chokk hamá mardomán abadmánén zend bedant ke taw áiárá dátagant."
"New","43","17","3","Oo yakk o barhakkén Hodá! Abadmánén zend hamesh ent ke é mardom tará bezánant o tai rawán dátagén Issá Masihá pajjáh byárant."
"New","43","17","4","Á kár ke taw maná dátagat ke sarjami bekanán, man sarjam kort o é dhawlá pa jaháná tai shán o shawkaton záher kort."
"New","43","17","5","Oo Pet! Nun wati bárgáhá mani shán o shawkatá záher kan, hamá shán o shawkat ke maná cha jahánay jórh bayagá pésar ham tai kerrá butag."
"New","43","17","6","Man tai nám pa hamáyán pajjárént ke taw cha jaháná gechén kortag o maná dátagant. É mardom tai butagant o taw maná dátagant. Eshán tai habar zortag."
"New","43","17","7","Nun eshán zántag ke har chizz ke taw maná dátag, pa rásti cha tai némagá ent."
"New","43","17","8","Chéá ke á habar ke taw maná gwashtagant, man esháná sar kortagant o eshán ham mannetagant. Nun eshán pa del zántag ke man cha tai némagá átkagán o báwaresh kortag ke taw maná rawán dátag."
"New","43","17","9","Man pa eshán dwá kanán, pa sajjahén jaháná dwá nakanán. Man pa hamá mardomán dwá kanán ke taw maná dátagant, chéá ke taig ant."
"New","43","17","10","Hamá ke manig ant, á sajjahén taig ant o hamá ke taig ant, á sajjahén manig ant o mani shán o shawkat cha áyán záher butag."
"New","43","17","11","Man cha ed o rand jaháná namánán. É mardom angat jaháná mánant o man tai kerrá káyán. Oo pákén Pet! Gón wati hamá námay zórá ke taw maná dátag, esháni negahpániá bekan ke é yakk bebant, hamá paymá ke man o taw yakk én."
"New","43","17","12","Tán hamá wahdá ke man gón eshán gón butagán, hamá námay zórá ke taw maná dátag, esháni negahpánion kortag. Cha eshán yakké ham tabáh nabut, abéd cha hamá yakkéná ke wat tabáhiay hakdár at, tánke Pákén Ketábay habar rást o sarjam bebant."
"New","43","17","13","Nun man tai gwará káyán. Jahánay yalah dayagá pésar, é chizzána gwashán tánke esháni del cha mani shádmániá sarréch bebit."
"New","43","17","14","Man tai habar esháná sar kort. Anchosh ke man donyái mardomé naán, é ham donyái mardom naant, paméshká donyá cha eshán naprata kant."
"New","43","17","15","É dwáyá nakanán ke eshán cha donyáyá bebar, dwá kanán ke eshán cha sherr o Shaytáná dur bedár."
"New","43","17","16","Hamá dhawlá ke man donyái mardomé naán, é ham naant."
"New","43","17","17","Eshán gón rástiá pák o palgár kan, tai habar rásti ent."
"New","43","17","18","Hamá dhawlá ke taw maná jaháná rawán dát, man ham é mardom jaháná rawán dátant."
"New","43","17","19","Nun pa hameshánigi watá gón páki o palgári tai sepordaha kanán, tánke é ham gón rástiá palgár o Hodáay sepordah bebant."
"New","43","17","20","Man tahná pa eshán dwá nakanán, pa hamá mardomán ham dwá kanán ke esháni habará báwara kanant o mani sará imána kárant"
